{
  "title": "10 Best Free Online Table Maker Tools in 2023",
  "authors": [
    "Yiyang Zhang"
  ],
  "tags": [
    "Content"
  ],
  "description": "Unravel the charm of a leading table maker for your needs. Discover the 10 top free table maker tools in 2023.",
  "created": 1699833600000,
  "updated": 1699833600000,
  "layout": "blog",
  "id": "UtvfS5eAc74AAaHExMpTW",
  "slug": "10-best-free-online-table-maker-tools-2023",
  "cover": "https://insider.affine.pro/api/workspaces/H6vffRmJbCfA-r3kq_36_/blobs/aa7PimEvaffx-2KbpNVfT-0FC1A_uexn3oFsqBxtfVE=.webp",
  "md": "---\n\ntitle: \"10 Best Free Online Table Maker Tools in 2023\"\n\nauthor: \"Yiyang Zhang\"\n\ntags: Content\n\nslug: 10-best-free-online-table-maker-tools-2023\n\ndescription: \"Unravel the charm of a leading table maker for your needs. Discover the 10 top free table maker tools in 2023.\"\n\ncreated: 2023-11-13\n\nupdated: 2023-11-13\n\nlayout: blog\n\npublish: true\n\n---\n\nWelcome to the world of table-making! With just a few clicks, organizing data becomes a breeze and tables come to life. Whether you're a student, a professional, or someone who loves keeping things neat and organized, finding the perfect table-making tool is essential. Luckily, in this digital age, we have a variety of online options to choose from.\n\n\n![aa7PimEvaffx-2KbpNVfT-0FC1A_uexn3oFsqBxtfVE=](https://insider.affine.pro/api/workspaces/H6vffRmJbCfA-r3kq_36_/blobs/aa7PimEvaffx-2KbpNVfT-0FC1A_uexn3oFsqBxtfVE=)\n\nIn this article, we have compiled a list of the top 10 free online table-maker tools in 2023 that will transform the way you create tables. Say goodbye to messy spreadsheets and welcome sleek and functional tables that will impress even the most critical observer. So, let's explore these amazing tools that make table-making a delightful experience!\n\n### What is a Table Maker?\n\nA table maker is a powerful tool that provides users with an intuitive and user-friendly interface to create tables that can be used for a variety of purposes. A table maker typically includes several features that enable users to customize the appearance of the table to suit their needs. It may include the ability to change font styles and colours, add images or logos, and adjust column widths and row heights. Moreover, a table maker often provides users with the ability to import data from various sources, including spreadsheets, databases, and other software applications, saving time and effort. A table maker is an essential tool for anyone who needs to present data in a clear and visually attractive way. It offers a great way to organize and present complex information, saving time and enhancing productivity.\n\n### What to Look for in an Agile Table Maker Tool?\n\n\n![EgF7I1XQYc9SYUrPuMIujn-6w9VV0d7w2HyLvN9fN-o=](https://insider.affine.pro/api/workspaces/H6vffRmJbCfA-r3kq_36_/blobs/EgF7I1XQYc9SYUrPuMIujn-6w9VV0d7w2HyLvN9fN-o=)\n\n* Flexibility is crucial. Look for a tool that allows you to customize your tables according to your specific needs and preferences. This includes being able to add or remove columns, rearrange the order of rows, and adjust the formatting.\n* Ease of use is important. You want a table maker tool that is intuitive and user-friendly. It should have a simple interface with drag-and-drop functionality so that creating tables becomes a hassle-free experience.\n* Collaboration capabilities are worth considering. Look for a tool that allows multiple users to work on the same table simultaneously and enables easy sharing and exporting of tables.\nBy considering these factors when selecting an agile table maker tool, you'll ensure that you find one that meets all your requirements and makes table creation easier than ever before!\n\n\n\n### 10 Best Free Table Maker Tools in 2023\n\nIf you're searching for the best free online table maker tools in 2023, look no further! We've compiled a list of top-rated options that will surely meet your table-making needs. These tools are not only user-friendly but also offer a range of features to customize and create visually appealing tables.\n\n1.**[AFFiNE](https://affine.pro/)**\n\n\n![tQunWJIPRxkcABnHlZvoNzn1pWyq9oo2_ZBswgXop3w=](https://insider.affine.pro/api/workspaces/H6vffRmJbCfA-r3kq_36_/blobs/tQunWJIPRxkcABnHlZvoNzn1pWyq9oo2_ZBswgXop3w=)\n\nAFFiNE is a fantastic open-source, all-in-one knowledge base ideal for table-making, embracing a database consisting of Table and Kanban, as comprehensive assistance to upgrade your workflow. In addition to table and kanban views for storing data, it also provides offline-first support, complete markdown support, and other amazing features. With our elevated Notion Import feature, you can now bring it to your table with just one click.\n\n**Key features:**\n\n* Robust Table View: It's essential to organize your tasks by day and schedule them on a single table. With AFFiNE‘s table view, you can easily track the progress and deadlines of each project, making it simple to see updates on unscheduled or overdue tasks. To enhance your table of contents, you can add properties, set timelines, divide tasks, and monitor your daily progress, allowing for personalized categorization.\n\n![s1-kYhapEsBPNhy4eDA2SnXKwB_ws6Ke7dGXUqpMjDo=](https://insider.affine.pro/api/workspaces/H6vffRmJbCfA-r3kq_36_/blobs/s1-kYhapEsBPNhy4eDA2SnXKwB_ws6Ke7dGXUqpMjDo=)\n\n* Data import and export options: If you already have data in a spreadsheet or other format, AFFiNE supports PDF, PNG, Markdown and HTML export! It supports the saving and sharing of multiple file formats, which can greatly improve your work efficiency, and you no longer have to worry about data migration!\n\n![a5qHSgry5auvwlz59punU2nun2AGvTd23_TocYkuhr0=](https://insider.affine.pro/api/workspaces/H6vffRmJbCfA-r3kq_36_/blobs/a5qHSgry5auvwlz59punU2nun2AGvTd23_TocYkuhr0=)\n\n* Appealing Collaboration Capabilities: When you do need to collaborate with other contributors, AFFiNE makes getting feedback simple. Appealing collaboration capability provides visibility into assigned tasks, making tables easier to estimate, and ensuring your project remains well-designed.\n\n![gO6-jmUw_4ju0gtKNhWzA7GrwrGQVJuWo0OurVlsfNY=](https://insider.affine.pro/api/workspaces/H6vffRmJbCfA-r3kq_36_/blobs/gO6-jmUw_4ju0gtKNhWzA7GrwrGQVJuWo0OurVlsfNY=)\n\n2.**[Canva](https://www.canva.com/graphs/tables/)**\n\n\n![28AfHLCXB13FM3t00Vte9aU5kOjhO91QnY_hsnLa85U=](https://insider.affine.pro/api/workspaces/H6vffRmJbCfA-r3kq_36_/blobs/28AfHLCXB13FM3t00Vte9aU5kOjhO91QnY_hsnLa85U=)\n\nCanva is an easy-to-use, web-based graphic design tool that has gained a lot of popularity. It is a platform that allows users to create content with a strong emphasis on design. Essentially, Canva can be thought of as an online version of Photoshop, which is tailored to meet the needs of small businesses and individuals who may not have any design skills or access to a professional designer. With Canva, you can create visually appealing content such as social media graphics, presentations, posters, tables, and more.\n\n**Key features:**\n\n* Magic writing AI.\n* Image enhancer.\n* Add frames to photos\n**Pros of Canva**\n\n* Pre-made templates help you to save your precious time.\n* Team collaboration feature helps you to share designs & work together.\n**Cons of Canva**\n\n* Inserting a table is not that easy\n* Output formats are limited\n3.**[Creatly](https://creately.com/lp/table-chart-maker/)**\n\n\n![MhOH45Maf2YusNqonbXaHRyAohSGEJy2rHI9K-p_Qbc=](https://insider.affine.pro/api/workspaces/H6vffRmJbCfA-r3kq_36_/blobs/MhOH45Maf2YusNqonbXaHRyAohSGEJy2rHI9K-p_Qbc=)\n\nCreately is a data-connected visual workspace where you can plan and brainstorm new projects. The software is built to help you make flowcharts quickly and easily. Creately boasts an extensive library of shapes, icons, and templates that cater to various industries' needs. Its advanced diagramming features make it suitable for both professionals and students alike.\n\n**Key features:**\n\n* Huge library of shapes. Allow choose the shape from Icon Finder or Google.\n* Automatically pick the right connector.\n* Create complex shapes from the written text.\n**Pros of Creatly**\n\n* Support real-time collaboration.\n* Offer Web and desktop apps.\n**Cons of Creatly**\n\n* Limited template selection.\n* Cancelling or changing an account requires an email to the company.\n4.**[Visme](https://www.visme.co/)**\n\n\n![62CXvxlk641L13JDj4TGZkpS62VpHEULflTFgKmpsoo=](https://insider.affine.pro/api/workspaces/H6vffRmJbCfA-r3kq_36_/blobs/62CXvxlk641L13JDj4TGZkpS62VpHEULflTFgKmpsoo=)\n\nVisme offers templates and tools for making professional slide decks, social media posts, online ads, tables, and more. That means people can work from ready-made samples and quickly turn them into their own branded content. Its strongest features are its user-friendly presentation, infographic & document creator, as well as its tool kit.\n\n**Key features:**\n\n* Access Controls/Permissions.\n* Activity Dashboard.\n* Table-making.\n**Pros of Visme**\n\nNumerous templates for slideshows and marketing materials\n\n**Cons of Visme**\n\n* Lower-priced plans are too restrictive\n* Does not support guest collaborators\n5.**[Smartsheet](https://affine.pro/blog/top-advanced-smartsheet-alternatives-project-management-2023)**\n\n\n![BvwynyiGMgn6HfWf2qC7X5TOE-1CNUicwj0hbjIbnjs=](https://insider.affine.pro/api/workspaces/H6vffRmJbCfA-r3kq_36_/blobs/BvwynyiGMgn6HfWf2qC7X5TOE-1CNUicwj0hbjIbnjs=)\n\nSmartsheet is a popular project management tool that describes itself as a “work execution platform. Combining the flexibility of spreadsheets with project management tools, Smartsheet empowers users to create custom workflows that align perfectly with their unique agile needs.\n\n**Key features:**\n\n* Multiple templates that can adapt to the ever-changing demands of project scheduling\n* Connection to the record system\n* Secure and user-driven\n**Pros of Smartsheet**\n\n* Easy to pick up\n* Collaborative and adaptable\n**Cons of Smartsheet**\n\n* The complexity involved in setting up more complex workflows or automation\n* Limited integration options\n6.**[Miro](https://miro.com/)**\n\n\n![yqGbxR5Lpay-KancTPQDMXE8Kafc0wcJBADdMdtEJtI=](https://insider.affine.pro/api/workspaces/H6vffRmJbCfA-r3kq_36_/blobs/yqGbxR5Lpay-KancTPQDMXE8Kafc0wcJBADdMdtEJtI=)\n\nMiro embraces more than 1,000 templates, including mind maps, Kanban boards, Gantt charts, product wireframes, research boards, and flowcharts. Miro provides an online collaborative platform where teams can brainstorm ideas, map workflows, and design prototypes all in one place. This versatile tool combines whiteboarding, collaboration, and project management functionalities, taking visual communication to new heights.\n\n**Key features:**\n\n* Provide real-time collaborative drawing\n* Built-in comments, video, chat, and seamless communication\n* Unlimited team workspaces with granular permissions, privacy & sharing controls\n**Pros of Miro**\n\n* Easy-to-build smart-looking flowcharts and mind maps\n* Simple to collaborate with teammates\n**Cons of Miro**\n\n* Hard to import or export content from time to time\n* Difficult to navigate large accounts\n7.**[Trello](https://affine.pro/blog/best-trello-alternatives-2023-project-management)**\n\n\n![wa3rlXnaHs4YQeuYKvXmKbh6gmuvFoXVvW4N1Lq0F-Q=](https://insider.affine.pro/api/workspaces/H6vffRmJbCfA-r3kq_36_/blobs/wa3rlXnaHs4YQeuYKvXmKbh6gmuvFoXVvW4N1Lq0F-Q=)\n\nTrello is also among the finest table-making tools for distributed teams because of its focus on project management. You can see the large picture of all your projects at once thanks to the Table view it employs. If you open the chart for a certain project, you can see where it stands. By creating a board for each undertaking, you will be able to do more than ever before.\n\n**Key features:**\n\n* Support the [Table view](https://affine.pro/blog/10-top-best-free-kanban-board-software-apps-2023) system for organizing tasks.\n* Customizable lists to represent a stage of a project.\n* Map view that is available to track location-based tasks.\n**Pros of Trello**\n\n* Agile collaboration.\n* Superb notification system.\n**Cons of Trello**\n\n* Limited advanced features for complex projects.\n* Over-reliance on third-party integrations.\n8.**[Venngage](https://venngage.com/features/table-chart-maker)**\n\n\n![1_oz4EbmS4pBIs4E76q6v1H0VfU1w2My-MVPtgjtcJg=](https://insider.affine.pro/api/workspaces/H6vffRmJbCfA-r3kq_36_/blobs/1_oz4EbmS4pBIs4E76q6v1H0VfU1w2My-MVPtgjtcJg=)\n\nVenngage provides a range of business-to-business templates, which can be used to communicate complex information, both within and outside the organization, without the need for a designer. You can use Venngage to create and organize important visual assets for your organization, such as reports, organizational structure, onboarding guides, research documents, and white papers.\n\n**Key features:**\n\n* Sync collaboration support.\n* Mindmaps tracks and auto-layouts that shape mindmaps\n* Powerful mindmap examples for strategic planning\n**Pros of Venngage**\n\n* Multiple design solutions for non-designers.\n* Offer employ of templates\n**Cons of Venngage**\n\n* Many templates are the same, and difficult to edit for users' purposes.\n* Clunky and nonintuitive for graphic creation.\n9.**[Gliffy](https://www.gliffy.com/)**\n\n\n![MX3r0f8CK6D8teLMqrzHIN8hznvtyO-qwNENL-0qK44=](https://insider.affine.pro/api/workspaces/H6vffRmJbCfA-r3kq_36_/blobs/MX3r0f8CK6D8teLMqrzHIN8hznvtyO-qwNENL-0qK44=)\n\nGliffy is a great choice for teams in need of a reliable and integrated diagramming tool on Confluence. With its intuitive user interface, plenty of ready-to-use components, and automatic updating of diagrams, there's no need to worry about having an outdated image - you'll always have the latest version. As if that weren't enough, Gliffy has Cloud Fortified certification, over 18 million users, and a long pedigree within Atlassian's products.\n\n**Key features:**\n\n* Links and syncs diagrams\n* Real-Time collaboration in Confluence cloud\n* Advanced security and access management features\n**Pros of Gliffy**\n\n* Wide range of shapes, symbols, and templates designed for flowchart\n* Support collaboration\n**Cons of Gliffy**\n\n* Occasional lags and errors when you work with a large diagram\n* Limited option to export selected areas directly as PNG or JPEG\n10.**[Airtable](https://www.airtable.com/)**\n\n\n![YRwapD4DDRLo2w-ZBbUZ7Yy1u0FFf3LfHiTtP3JvrYA=](https://insider.affine.pro/api/workspaces/H6vffRmJbCfA-r3kq_36_/blobs/YRwapD4DDRLo2w-ZBbUZ7Yy1u0FFf3LfHiTtP3JvrYA=)\n\nWith its intuitive interface and powerful features, Airtable is a popular choice among users looking for a flexible alternative to Microsoft Access. The system uses a spreadsheet format to organize data. Related data can be linked together. It allows you to create custom databases, manage data with ease, and collaborate seamlessly with your team.\n\n**Key features:**\n\n* Low-code application development platform\n* Native AI components and dynamic AI functionality\n* Relational databases that sync in real-time with other systems\n**Pros of Airtable**\n\n* Offers templates for easy setup and use\n* Provides real-time collaboration and communication\n**Cons of Airtable**\n\n* Limited project customization without a paid plan\n* Take time to learn and grasp advanced features\n### Refresh Your Table-Making Experience at AFFiNE\n\nRemember: Tables don't have to be tedious and time-consuming anymore – embrace the power of modern technology with these top 10 free online table-maker tools in 2023! With **AFFiNE**, you can create beautiful tables with just a few clicks. Whether you need a simple data table or a complex financial report, this tool covers you. The intuitive interface allows for easy customization, so you can tailor your tables to suit your specific needs. Give it a try today and see how it revolutionizes how you create tables online! So go ahead and start organizing those appointments, deadlines, and meetings – whatever it may be – with confidence using these free customizable templates, or create one yourself using the innovative tools available at **AFFiNE**! 🚀\n\nSo why settle for mediocre table-maker tools when you can refresh your table-making experience in **AFFiNE**? Presently, **AFFiNE** has launched its **[Stable Version](https://affine.pro/download)**, with ongoing efforts to develop a more comprehensive and dependable iteration. Join us on our voyage through our social media channels and be part of the experience. **Come and join us on our journey over on our media platforms.**\n\n* Official Website: [https://affine.pro/](https://affine.pro/)\n* GitHub: [https://github.com/toeverything/AFFiNE](https://github.com/toeverything/AFFiNE)\n* Discord: [https://discord.gg/Arn7TqJBvG](https://discord.gg/Arn7TqJBvG)\n* Twitter: [https://twitter.com/AffineOfficial](https://twitter.com/AffineOfficial)\n",
  "publish": true
}