{
  "title": "10 of the Best Smartsheet Alternatives & Competitors for Project Management in 2024",
  "authors": [
    "Yanxi Liu"
  ],
  "tags": [
    "Content"
  ],
  "description": "Discover the top 10 Smartsheet alternatives and competitors for efficient project management. Explore these powerful tools to find the perfect solution for your project needs.",
  "created": 1698192000000,
  "updated": 1703462400000,
  "layout": "blog",
  "id": "IRRntyRQw8",
  "slug": "10-best-free-smart-sheet-alternatives-for-project-management-2023",
  "cover": "https://app.affine.pro/api/workspaces/qf73AF6vzWphbTJdN7KiX/blobs/9xujQpZ1zI4FOReqHB-YMCtSzoNuymUBrlyVsDNM_L0=.webp",
  "md": "---\n\ntitle: \"10 of the Best Smartsheet Alternatives & Competitors for Project Management in 2024\"\n\nauthor: \"Yanxi Liu\"\n\ntags: Content\n\nslug: 10-best-free-smart-sheet-alternatives-for-project-management-2023\n\ndescription: \"Discover the top 10 Smartsheet alternatives and competitors for efficient project management. Explore these powerful tools to find the perfect solution for your project needs.\"\n\ncreated: 2023-10-25\n\nupdated: 2023-12-25\n\nlayout: blog\n\npublish: true\n\n---\n\n\n![9xujQpZ1zI4FOReqHB-YMCtSzoNuymUBrlyVsDNM_L0=](https://app.affine.pro/api/workspaces/qf73AF6vzWphbTJdN7KiX/blobs/9xujQpZ1zI4FOReqHB-YMCtSzoNuymUBrlyVsDNM_L0=)\n\nWe understand that project management software is a hot commodity, and you deserve options that go beyond the mundane. So, buckle up and get ready to explore Top 10 free Smartsheet alternatives with comprehensive properties that will bring your productivity to the next level. Explore a world of innovation, time-saving magic, and features now!\n\nWith these alternatives, you'll have the power to conquer dependencies like a fearless warrior, allocate resources with the precision of a master strategist, and tackle recurring tasks with the finesse of a seasoned acrobat. You'll be the project management master, conducting your team like a symphony and achieving success with a flair.\n\n###### **Why to Look for Smartsheet Alternatives?**\n\n\n![rD1lLprOgtEzz1bCVNPbmUmWP3od2Ic5Q9Iz_D1-_wU=](https://app.affine.pro/api/workspaces/qf73AF6vzWphbTJdN7KiX/blobs/rD1lLprOgtEzz1bCVNPbmUmWP3od2Ic5Q9Iz_D1-_wU=)\n\nThere are several reasons why you might consider finding an alternative to Smartsheet:\n\n1. Better Integrations: If you require seamless integration with other tools and software that are critical to your workflow, you may find that other project management platforms offer more extensive integration options.\n1. Enhanced Time Tracking: If accurate time tracking and monitoring are crucial for your projects, you might find that alternative platforms provide more advanced time tracking features and reporting capabilities.\n1. Native Chat Functionality: If real-time collaboration and communication are essential for your team, you may prefer a project management tool that includes native chat functionality, allowing for easier and more efficient communication within the platform.\n1. Cost Considerations: Smartsheet is known to be one of the more expensive project management tools on the market. If cost is a significant factor for your organization, exploring alternatives may help you find similar solutions at a lower price point or even for free.\nBy considering these factors and exploring alternative options, you can find a project management tool that better suits your specific needs and requirements.\n\n###### The 10 Best Smartsheet Alternatives You Have to Try\n\nWhile Smartsheet remains popular and offers many useful features, it can be comparatively expensive. Fortunately, there are excellent alternatives available that provide similar functionalities at lower costs or even for free.\n\n###### **AFFiNE**\n\n\n![YbXZfSQZfEVeddZ6MYZ5A2JPyePURgUIP3HnaIwQ-58=](https://app.affine.pro/api/workspaces/qf73AF6vzWphbTJdN7KiX/blobs/YbXZfSQZfEVeddZ6MYZ5A2JPyePURgUIP3HnaIwQ-58=)\n\n_[Via AFFiNE](https://affine.pro/download)_\n\n[AFFiNE](https://affine.pro/) is an innovative task management software, offering organization, collaboration, and management of tasks, projects, and information. It stands out as a free and open-source solution, prioritizing accessibility through offline technology. It is a valuable find for individuals seeking a comprehensive task management solution. Startups and large corporations can also benefit from its user-friendly interface for efficient group task management.\n\n**Key Features:**\n\n* Time tracking and goal setting: Utilize AFFiNE's integrated features to track task time and set goals for enhanced productivity.\n* Text-to-Kanban Conversion: Effortlessly convert blocks into a Kanban view with a single click using our new Kanban feature.\n* Properties Editing: Enhance your interaction with a dedicated panel for Kanban editing. Click the \"Edit\" button, and a right-side panel will appear.\n* Custom Classifying for Maximum Flexibility: Experience unparalleled customization by classifying based on nearly any property, allowing personalized categorization to align perfectly with your needs.\n* Intuitive Drag-and-Drop Sorting: Easily rearrange items by dragging and dropping them to desired locations. Move entire columns or individual Kanban cards with flexibility and ease.\n* Unification of Kanban and Table Views: Changes made in the Kanban view automatically reflect in the corresponding table view, ensuring seamless integration.\n\n![wTNgyrpvo8nL6XojCwwuTwOz-z3_aeLNXj8ibcFxVYM=](https://app.affine.pro/api/workspaces/qf73AF6vzWphbTJdN7KiX/blobs/wTNgyrpvo8nL6XojCwwuTwOz-z3_aeLNXj8ibcFxVYM=)\n\n\n![crjX5_HRaAu3feQ3mQMTVmg-FqXutYjATZJpEZEMi98=](https://app.affine.pro/api/workspaces/qf73AF6vzWphbTJdN7KiX/blobs/crjX5_HRaAu3feQ3mQMTVmg-FqXutYjATZJpEZEMi98=)\n\n* **Pricing: Free**\n  In the future, we will supply some advanced features and AFFiNE Cloud uses. If you are interested, please check the specific Pricing plan.For more things related to AFFiNE, come and check out the Official website:[https://app.affine.pro/](https://app.affine.pro/)\n\n###### Asana\n\n\n![Ft6JbUq6Gdt3YKJx8TR3xXJVgDC7ZKb79tCMEzsDifI=](https://app.affine.pro/api/workspaces/qf73AF6vzWphbTJdN7KiX/blobs/Ft6JbUq6Gdt3YKJx8TR3xXJVgDC7ZKb79tCMEzsDifI=)\n\nAsana is a widely-used project management software that is favored by many project managers. It offers a user-friendly interface and provides numerous integrations, making it a viable alternative to Smartsheet. Asana is particularly well-suited for smaller and less complex projects, thanks to its simplicity and ease of use.\n\n**Key features**\n\nFile sharing and task comments for better team collaboration\n\n* Advanced task management features with subtasks and checklists\n* Powerful project overviews for better resource management\n###### **Google Sheets**\n\n\n![6WaqNEQCKjch3xKW20Wa8zQBUgkjcc0coLHQZw3EIm4=](https://app.affine.pro/api/workspaces/qf73AF6vzWphbTJdN7KiX/blobs/6WaqNEQCKjch3xKW20Wa8zQBUgkjcc0coLHQZw3EIm4=)\n\n[Google Sheets](http://Google.doc.com) is a straightforward alternative to Smartsheet. It is a free spreadsheet tool developed by Google that offers a range of functionalities, including data management and project management. Google Sheets follows a similar concept to Excel but presents a simpler and cleaner interface.\n\n* Project templates such as project plans, time trackers, and project timelines\n* Gantt charts to track project progress\n###### Clickup\n\n\n![ST7Mwyp82UgV9SjK-yMufKnyabeGY3-txs_0KhEiC-A=](https://app.affine.pro/api/workspaces/qf73AF6vzWphbTJdN7KiX/blobs/ST7Mwyp82UgV9SjK-yMufKnyabeGY3-txs_0KhEiC-A=)\n\nClickUp provides a built-in Comment section for every task, facilitating project-related discussions. Whether you need to share files or use Assigned Comments to tag team members to specific tasks, ClickUp offers a comprehensive collaborative solution.\n\n**Key features**\n\n* Mind Maps: Plan and organize new or existing tasks, ideas, or projects through a highly-visual outline\n* Task Checklists: Create checklists within tasks to give projects more details and accountability\n###### Hive\n\n\n![wGSBEJRO6Pz4ZwU3RGufeadO4TP6_pJ0Ny1Rieu_3Tk=](https://app.affine.pro/api/workspaces/qf73AF6vzWphbTJdN7KiX/blobs/wGSBEJRO6Pz4ZwU3RGufeadO4TP6_pJ0Ny1Rieu_3Tk=)\n\nHive is a fan favorite project management tool for teams, and it is also one of the top Smartsheet alternatives. Built for users by users, Hive is a flexible tool that offers its users time tracking, reporting capabilities, and multiple views to handle project management with ease\n\n**Key Features:**\n\n* Flexible project views: Table (spreadsheet), Kanban, Gantt, Calendar, Label, and Team Views\n* Over 1,000 integration options\n* Automation, reporting, and time-tracking functionality\n###### Jira\n\n\n![fkJQh-Wc5nCqVtRYhLZNrgwQtmX7Bh7ay83wa6nqEac=](https://app.affine.pro/api/workspaces/qf73AF6vzWphbTJdN7KiX/blobs/fkJQh-Wc5nCqVtRYhLZNrgwQtmX7Bh7ay83wa6nqEac=)\n\nJira is a software solution designed for bug tracking and project management, specifically tailored for Agile and Scrum teams. What sets it apart from other tools is its open-source version, which provides users with additional flexibility and customization options.\n\n**Key features**\n\n* Powerful Agile views with Kanban board\n* Custom workflow templates and automated workflow function\n###### Monday\n\n\n![Eyiuo3WYBUg4ouK1oQoHQi4m8SOKD15hPSzHsJ6BJaI=](https://app.affine.pro/api/workspaces/qf73AF6vzWphbTJdN7KiX/blobs/Eyiuo3WYBUg4ouK1oQoHQi4m8SOKD15hPSzHsJ6BJaI=)\n\nIf you use Smartsheet but you are looking to improve productivity without compromising your companyâ€™s budget, Monday.com can be a great alternative for you. Monday also offers native social media management and free educational webinars for all subscribers, while Smartsheet only offers free live webinars for enterprise subscribers, the material can be purchased at additional cost for other plans.\n\n**Key Features**\n\n* Boards & Columns\n* Checklists\n* Apps Integration\n###### Notion\n\n\n![vMZT2p3uVocXm23hE9hTm_7bXfHuZjs8Ah41HY0zqL4=](https://app.affine.pro/api/workspaces/qf73AF6vzWphbTJdN7KiX/blobs/vMZT2p3uVocXm23hE9hTm_7bXfHuZjs8Ah41HY0zqL4=)\n\nNotion  presents a distinctive alternative to Smartsheet in the realm of project management, offering a fantastic combinition of flexibility and multifunctionality. Unlike Smartsheet, which primarily focuses on spreadsheet-based planning and task management, Notion provides a comprehensive workspace that integrates project management, documentation, and databases into a single platform.\n\n**Key features:**\n\n* Block-based structure\n* Integrated note-taking\n###### nTask\n\nnTask  is a comprehensive project and task management application that offers a range of powerful features for managing tasks and teams. With its intuitive interface, you can easily track your development process and monitor all the associated tasks within a single platform. The application includes risk management and issue tracking features, which are essential for ensuring the safety and well-being of your business.\n\n**Key Features:**\n\n* Task and project management\n* Issue tracking and risk management\n* Meeting management and collaborative tools\n###### Trello\n\n\n![-FYWjJwidEKAMjKxNekpPGLzAH9FwrGgSxjWPVbz50o=](https://app.affine.pro/api/workspaces/qf73AF6vzWphbTJdN7KiX/blobs/-FYWjJwidEKAMjKxNekpPGLzAH9FwrGgSxjWPVbz50o=)\n\nTrello utilizes Kanban boards, lists, and cards as its core structure, providing a flexible and visual approach to managing projects and tasks. With its intuitive interface, Trello can easily adapt to your team's workflow, and it offers no-code automation features that streamline repetitive tasks, saving you valuable time.\n\nKey Features:\n\n* Kanban boards, lists and cards\n* Easy-to-copy templates\n* Workflow automation\n###### Try AFFiNE! The Best Smartsheet Alternative\n\nWhile Smartsheet may have its merits, let's face it, relying solely on a spreadsheet for project management is like using a typewriter in the age of AI. Why settle for something so outdated when you can have a cutting-edge project management tool that caters to all your team's needs?\n\nEach of these Smartsheet alternatives offers a range of features to streamline your workflow and effectively organize information. However, there is one standout option that goes above and beyond, providing comprehensive solutions for teams and businesses across various industries - AFFiNE.\n\nWith AFFiNE, you can create spreadsheets effortlessly using the Table view, allowing you to manage everything from inventories to client information. The Custom Fields feature enables you to convey important context at a glance, incorporating file attachments, ratings, and progress percentages into your task columns.\n\nIn addition, AFFiNE's intuitive drag-and-drop functionality in the AFFiNE Table View simplifies task organization. You can easily rearrange tasks, ensuring a seamless workflow. Moreover, the Form view in AFFiNE transforms bug submissions and customer feedback into actionable tasks, which can be organized based on priority in a clean and functional table.\n\nSo, why wait? Sign up with AFFiNE today and unlock a world of possibilities. Leave the limitations of Smartsheet behind and take your productivity to the next level.\n\n* Official Website: [https://affine.pro/](https://affine.pro/)\n* GitHub: [https://github.com/toeverything/AFFiNE](https://github.com/toeverything/AFFiNE)\n* Discord: [https://discord.gg/Arn7TqJBvG](https://discord.gg/Arn7TqJBvG)\n* Twitter: [https://twitter.com/AffineOfficial](https://twitter.com/AffineOfficial)\n",
  "publish": true
}