{
  "title": "10 Best Flowchart Software Tools of 2024 (Features & Pricing)",
  "authors": [
    "Yiyang Zhang",
    "Yuhang Zhao"
  ],
  "tags": [
    "Content"
  ],
  "description": "Unlock the charm behind outstanding flowcharts that will improve your workflow. Discover the 10 best flowchart software tools in 2024.",
  "created": 1697414400000,
  "updated": 1704153600000,
  "layout": "blog",
  "id": "Vy-tvwEKRi",
  "slug": "10-best-flowchart-software-tools-2023-features-pricing",
  "cover": "https://app.affine.pro/api/workspaces/qf73AF6vzWphbTJdN7KiX/blobs/Tw7IfBdrTCDPpGqcgtillVetiixB9nbFZZ6zNsc8K9k=.webp",
  "md": "---\n\ntitle: \"10 Best Flowchart Software Tools of 2024 (Features & Pricing)\"\n\nauthor: Yiyang Zhang, Yuhang Zhao\n\ntags: Content\n\nslug: 10-best-flowchart-software-tools-2023-features-pricing\n\ndescription: \"Unlock the charm behind outstanding flowcharts that will improve your workflow. Discover the 10 best flowchart software tools in 2024.\"\n\ncreated: 2023-10-16\n\nupdated: 2024-01-02\n\nlayout: blog\n\npublish: true\n\n---\n\nAre you tired of trying to visualize complex processes and systems?\n\nDo you find yourself getting lost in a sea of tangled information?\n\nAre you a business professional, designer, or simply someone who wants to organize thoughts visually but encounters the chaos of projects?\n\n\n![Tw7IfBdrTCDPpGqcgtillVetiixB9nbFZZ6zNsc8K9k=](https://app.affine.pro/api/workspaces/qf73AF6vzWphbTJdN7KiX/blobs/Tw7IfBdrTCDPpGqcgtillVetiixB9nbFZZ6zNsc8K9k=.webp)\n\nFret no more! Flowchart software is here to rescue you from the chaos and bring clarity to your projects. In this article, we will explore the world of flowchart software and unveil the top 10 options for 2024. We'll dive into their features, pros and cons so that you can make an informed decision when choosing the best one for your needs. So let's get started on this exciting journey towards simplifying complexity with flowchart software!\n\n### What is a Flowchart\n\n[Flowchart](https://affine.pro/blog/how-to-create-flowchart-google-docs-step-by-step-guide) is a visual representation of a process, used widely across various industries for problem-solving, decision-making and documenting workflows. It provides a clear and concise overview of complex processes making it easier to analyze and communicate with others. Think of it as a roadmap that guides you from start to finish, allowing you to understand the logical sequence and dependencies between different elements and helping you [streamline](https://affine.pro/blog/free-lessons-learned-templates-for-project-management) processes efficiently and effectively!\n\n### What Makes a Good Flowchart Software\n\nLet's dive into the key features and qualities that set apart the top flowchart software options in 2024.\n\n\n![dHVghs6Ci1acj1iVGlvi0yZxJLZjuiUhfjRHw4ZATS0=](https://app.affine.pro/api/workspaces/qf73AF6vzWphbTJdN7KiX/blobs/dHVghs6Ci1acj1iVGlvi0yZxJLZjuiUhfjRHw4ZATS0=.webp)\n\n* Be user-friendly and intuitive. It should offer a simple drag-and-drop interface, making it easy for users to create and edit their flowcharts without any technical expertise or coding skills.\n\n* Offer versatility. A good flowchart software should support various types of diagrams, including mind maps, swimlane sequence diagrams, linear graphs and way beyond just basic flowcharts.\n\n* Provide collaboration capabilities. The best flowchart software will offer real-time collaboration tools that allow multiple team members to work together on a diagram simultaneously.\n\n* Integrate well with other tools. A good flowchart software should seamlessly integrate well with popular platforms. This integration could include popular project management software, cloud storage services, and communication platforms.\n\n### Best 10 Flowchart Softwares of 2024 You Need\n\nWhen it comes to creating flowcharts, having the right software can make a world of difference. With so many options available, it can be overwhelming to choose the best one for your needs. That's why we've compiled a list of the top 10 flowchart software of 2024 that you need to know about!\n\n#### 1.**[AFFiNE](https://affine.pro/)**\n\n\n![AGktpsX8erKLUUNNpY-lvQS6tcQn5Pt5qi9VUQhV7gY=](https://app.affine.pro/api/workspaces/qf73AF6vzWphbTJdN7KiX/blobs/AGktpsX8erKLUUNNpY-lvQS6tcQn5Pt5qi9VUQhV7gY=.webp)\n\nWith AFFiNE, professionals have access to a unified platform for knowledge base planning, organisation, and content development. This flexible tool allows users to create their flowcharts as well as set up their goals, all while staying in sync and constructing content with blocks. The limitless workspace allows for user-driven innovation. The benefits of AFFiNE include safe data storage, open-source benefits, and collaborative functionality. Those looking for a fresh take on knowledge management will find its comprehensive approach to be a compelling option.\n\nKey features:\n\n* Edgeless Mode: Our exciting Edgeless Mode, including a redesigned toolbar, eraser, connector, block slicer, integrated canvas text and copy as PNG, etc. Get ready to unlock new levels of productivity and immerse yourself in a seamless and efficient workflow.\n\n  * Simplified Flowcharts and Mind Maps: Gone are the days of manually shaping every element in your edgeless mode mind maps or flowcharts and linking them together.\n\n\n![q1kRb852K7CyMTlg9CXig9gOklaMKSlob1bGxmyH11k=](https://app.affine.pro/api/workspaces/qf73AF6vzWphbTJdN7KiX/blobs/q1kRb852K7CyMTlg9CXig9gOklaMKSlob1bGxmyH11k=.webp)\n\n* Tailor Your Workflow: To elevate your flowchart experience, we offer shape customization options, including colours and styles. Click to create a new shape, and watch it harmonize seamlessly with the previous one, giving you a cohesive toolkit to play with.\n\n\n![ndYv530Fmd8nIV8PHF_XOI1aj477zMkeAS-kuPxZRG8=](https://app.affine.pro/api/workspaces/qf73AF6vzWphbTJdN7KiX/blobs/ndYv530Fmd8nIV8PHF_XOI1aj477zMkeAS-kuPxZRG8=.webp)\n\n* AFFiNE Cloud: With AFFiNE Cloud, you can invite your family and friends to collaborate in real-time within a shared workspace. This feature makes your habit of tracking work smoother and more efficient.\n\n  * Remote Selection for Collaboration: Now, you can choose and work with content from afar, ensuring smoother collaboration.\n\n\n![7sC9sHff3sHGQBmTEKzUZGo-t0-4fs92M2IM3GSiPkQ=](https://app.affine.pro/api/workspaces/qf73AF6vzWphbTJdN7KiX/blobs/7sC9sHff3sHGQBmTEKzUZGo-t0-4fs92M2IM3GSiPkQ=.webp)\n\n* Kanban: With our new Kanban feature, it's as simple as a single click to transform your blocks into a Kanban view. Now you can effortlessly start using AFFiNE as your ultimate to-do list manager.\n\n  * Properties Editing: To enhance your interaction, we've introduced a dedicated panel for Kanban editing. Here, you have the freedom to edit properties at your convenience, enriching your Kanban experience.\n\n\n![PrWKlqwLbz13lYnPPyIU4acy6ukqZ4X4ZFMVonMmSO8=](https://app.affine.pro/api/workspaces/qf73AF6vzWphbTJdN7KiX/blobs/PrWKlqwLbz13lYnPPyIU4acy6ukqZ4X4ZFMVonMmSO8=.webp)\n\n**Pricing:** FREE\n\n#### 2.**[SmartDraw](https://www.smartdraw.com/)**\n\n\n![ketDWKTPYe3ASxOAV0IZ1bqKkS7AmUnuKuWjIqIAT7s=](https://app.affine.pro/api/workspaces/qf73AF6vzWphbTJdN7KiX/blobs/ketDWKTPYe3ASxOAV0IZ1bqKkS7AmUnuKuWjIqIAT7s=.webp)\n\nSmartDraw is a powerful flowchart software tool for businesses that need to make a lot of visual assets. Aside from flowcharts and schematics, SmartDraw has powerful customization and collaboration options, so drafting these designs is a breeze. With SmartDraw, you can create over 70 types of diagrams, from flowcharts to schematics.K\n\ney features:\n\n* Huge selection of templates and objects\n\n* Helpful Smart Panel feature\n\n* Create diagrams straight from data with built-in extensions\n\nPros of SmartDraw\n\n* Good integration options\n\n* Easy to use\n\n* Powerful engine allows for professional charts and diagrams\n\nCons of SmartDraw\n\n* Weak collaboration features.\n\n* Expensive.\n\n* Can't export to Visio format.\n\nPricing: $9.95/month after a free trial\n\n#### 3.**[Microsoft Visio](https://affine.pro/blog/best-free-word-processor-software-2023-alternatives-microsoft)**\n\n\n![E4qFsgAf1UELGp5BEZAox9B0Dhu_fZk3YQ96EQEB1Q8=](https://app.affine.pro/api/workspaces/qf73AF6vzWphbTJdN7KiX/blobs/E4qFsgAf1UELGp5BEZAox9B0Dhu_fZk3YQ96EQEB1Q8=.webp)\n\nMicrosoft Visio is an excellent software for creating flow charts on Windows. It has three products: Visio Online, Visio Standard, and Visio Professional. With Microsoft Visio, you can quickly and easily create flow charts, organizational charts, network diagrams, floor plans, engineering designs, etc. It even includes templates to help you get started. You can also customize shapes and add your own text labels or images to make the perfect diagram.\n\nKey features:\n\n* Provide modern shapes and templates.\n\n* Allow collaboration with the team.\n\n* Visio online will help you to work from anywhere.\n\nPros of Microsoft Visio\n\n* Powerful & easy to use\n\n* Huge library of templates and objects\n\n* Wide array of export formats\n\nCons of Microsoft Visio\n\n* Confusing purchasing process.\n\n* Limited collaboration capabilities.\n\n* Clunky and cluttered.\n\nPricing: Online Plan 1 ($5 per user per month) and Online Plan2 ($14.96 per user per month)\n\n#### 4.**[Miro](https://miro.com/)**\n\n\n![yqGbxR5Lpay-KancTPQDMXE8Kafc0wcJBADdMdtEJtI=](https://app.affine.pro/api/workspaces/qf73AF6vzWphbTJdN7KiX/blobs/yqGbxR5Lpay-KancTPQDMXE8Kafc0wcJBADdMdtEJtI=.webp)\n\nMiro embraces more than 1,000 templates, including mind maps, Kanban boards, Gantt charts, product wireframes, research boards, and flowcharts. More than 99% of Fortune 100 companies use it, including TransUnion, HP, Upwork, Cisco, Qlik, and Atkins. With Miro Academy, online events, and a community forum, it has robust resources for continuous learning.\n\nKey features:\n\n* Provide real-time collaborative drawing\n\n* Built-in comments, video, chat, and seamless communication\n\n* Unlimited team workspaces with granular permissions, privacy & sharing controls\n\nPros of Miro\n\n* Easy to build smart-looking flowcharts and mind maps\n\n* Simple to collaborate with teammates\n\n* Intuitive UI\n\nCons of Miro\n\n* Hard to import or export content from time to time\n\n* Difficult to navigate large accounts can quickly\n\nPricing: $8/month per user for starter; $16/month per user for business\n\n#### 5.**[Lucidchart](https://www.lucidchart.com/pages/)**\n\n\n![2OcBEcPtKFwIN0zpps1Da1Tdj5eYu38C4RfnhzfIno4=](https://app.affine.pro/api/workspaces/qf73AF6vzWphbTJdN7KiX/blobs/2OcBEcPtKFwIN0zpps1Da1Tdj5eYu38C4RfnhzfIno4=.webp)\n\nLucidchart is an intelligent diagramming application that empowers teams to clarify complexity, align their insights, and build the future—faster. With this intuitive, cloud-based solution, everyone can work visually and collaborate in real time while building flowcharts, mockups, UML diagrams, and more.\n\nKey features:\n\n1. Intelligent diagramming\n\n1. 1,000+ templates\n\n1. Ability to share outside of Google Docs\n\nPros of Lucidchart\n\n* Intuitive user interface\n\n* Smooth performance on all tested platforms\n\n* Adequate shapes and templates\n\nCons of Lucidchart\n\n* No desktop apps\n\n* Quite limiting free account\n\n* Mobile apps don't have offline mode\n\nPricing: $4.95 per month for basic plan; $9.95 per month for pro plan\n\n#### 6.**[Canva](https://www.canva.com/pro/)**\n\n\n![u2KwzK0mJFBO5_SefQ3YTCY47qHExf7_QuRiY6Fyv9s=](https://app.affine.pro/api/workspaces/qf73AF6vzWphbTJdN7KiX/blobs/u2KwzK0mJFBO5_SefQ3YTCY47qHExf7_QuRiY6Fyv9s=.webp)\n\nCanva is an online tool for graphic designing that can be used for layout designing, sharing, presentations, and printing business cards, logos, and flowcharts. It is available on Android devices, tablets, iPhones, and iPads. Canva’s intuitive drag-and-drop editor makes creating beautiful designs from templates quick and easy. Plus, its large library of illustrations and icons make customizing your design easy.\n\nKey features:\n\n* It has more than 50000 templates.\n\n* You can create different types of graphs and charts.\n\n* It has features for photo editing.\n\nPros of Canva\n\n* Ideal for various visual project\n\n* Lots of well-designed templates\n\nCons of Canva\n\n* Not as intuitive as other purpose-built flowchart makers\n\n* Slow to load and difficult to keep organized\n\nPricing: $12.99/month per user for pro plan; $14.99/ month per user for team plan\n\n#### 7.**[ClickUp](https://clickup.com/)**\n\n\n![G5Z6ttL_7JgH_ooXFl9GesLkL0tKZpc9f1wW1Kwfd70=](https://app.affine.pro/api/workspaces/qf73AF6vzWphbTJdN7KiX/blobs/G5Z6ttL_7JgH_ooXFl9GesLkL0tKZpc9f1wW1Kwfd70=.webp)\n\nClickUp is an all-in-one productivity platform that teams of all sizes and across industries rely on to **manage projects, create complex flowcharts, and optimize their processes with the entire team**. With ClickUp’s Mind Maps feature, you have everything you need to make smart, collaborative, and good-looking flowcharts in minutes.\n\nKey features:\n\n* Task Creation and Assignment\n\n* Effortless Workflow Updates\n\n* Real-time Communication\n\nPros of ClickUp\n\n* Real-time collaboration\n\n* Versatile & customize\n\n* Multiple templates that can makes flowcharts, mind maps and more\n\nCons of ClickUp\n\n* Learning curving\n\n* Limited functionality\n\nPricing: Unlimited: $7/month per user; Business: $12/month per user\n\n#### 8.**[Creatly](https://creately.com/)**\n\n\n![pjSCg9_WhN-7OZblPHyLl_P6gEJ4dXbCccQbOj-jg_c=](https://app.affine.pro/api/workspaces/qf73AF6vzWphbTJdN7KiX/blobs/pjSCg9_WhN-7OZblPHyLl_P6gEJ4dXbCccQbOj-jg_c=.webp)\n\nCreately is a data-connected visual workspace where you can plan and brainstorm new projects. The software is built to help you make flowcharts quickly and easily. To begin with, they have an extensive library of templates ranging across industries and topics, so it is simple to find an example that fits your needs.\n\nKey features:\n\n* Huge library of shapes. Also, allow choose the shape from Icon Finder or Google.\n\n* Automatically pick the right connector.\n\n* Create complex shapes from the written text.\n\nPros of Creatly\n\n* Support real-time collaboration.\n\n* Offer Web and desktop apps.\n\nCons of Creatly\n\n* Limited template selection.\n\n* Cancelling or changing an account requires an email to the company.\n\nPricing: $5 per month for individuals; Team plans are based on the team size (5 users: $25/month, 10 Users: $45/month, and 25 Users: $75/month)\n\n#### 9.**[Cacoo](https://nulab.com/cacoo/)**\n\n\n![m9vYBTj8s0HM9IlXSoBzoOAvmEnUDTEq12Uatz-e3KY=](https://app.affine.pro/api/workspaces/qf73AF6vzWphbTJdN7KiX/blobs/m9vYBTj8s0HM9IlXSoBzoOAvmEnUDTEq12Uatz-e3KY=.webp)\n\nNulab's Cacoo is an online diagramming tool that allows you to collaborate on wireframes, flowcharts, and more. With easy sharing links and embed links, you can edit, track changes, and collaborate on flowcharts you designed and updated. With Cacoo, you can organize team assets, save work directly, monitor project status with activity notifications, and more.\n\nKey features:\n\n* Multiple people can edit diagrams at the same time.\n\n* Support chat, comment or video chat inside the tool.\n\n* It has hundreds of templates to get you started.\n\nPros of Cacoo\n\n* Smart and modern charts\n\n* A wide range of cloud services\n\n* Team management keep charts organized at the team-level\n\nCons of Cacoo\n\n* Learning curve\n\n* Not enough integrations\n\nPricing: $6 per user per month\n\n#### 10.**[Draw.io](https://www.drawio.com/)**\n\n\n![8Jgad9bwtPLzn0Rod2NgoN5dCevengqcsoemeHxkWH8=](https://app.affine.pro/api/workspaces/qf73AF6vzWphbTJdN7KiX/blobs/8Jgad9bwtPLzn0Rod2NgoN5dCevengqcsoemeHxkWH8=.webp)\n\nDraw.io can be used instantly to build charts since it's online (though it can be used offline as well). With drag-and-drop functionality, a library of shapes, plenty of templates, importing/exporting a variety of formats, and more, it's easy to get started and start creating at any time.\n\nKey features:\n\n* Intuitive interface with drag-and-drop functionality.\n\n* Allows track and restore changes.\n\n* Support various formats for import and export.\n\nPros of Draw.io\n\n* No login is required, free\n\n* Speed & simple\n\n* Excellent real-time collaboration support included when connected to a Google account\n\nCons of Draw.io\n\n* Collection of templates and unimpressive shapes.\n\n* Less professional\n\n* Importing from other file types was unsuccessful in testing.\n\nPricing: Free\n\nEach of these software brings something unique to the table in terms of features and pricing. Whether you're a solo entrepreneur or part of a large organization.\n\n### Conclusion\n\nFlowchart software is an essential tool for businesses and individuals alike, offering a visual representation of processes, workflows, and decision trees. While each of the flowchart software tools discussed offers its own unique and appealing features, we encourage users to choose the ideal option based on their specific needs and pain points. However, with a humble perspective, we still propose that **AFFiNE** emerges as the ultimate winner in this evaluation, providing a comprehensive and versatile solution for managing daily tasks, goals and flowchart needs, catering to a wide range of user requirements.\n\n\n![Q0vuhMENkHvfWLaVVSEYyTuW2RcJuHP-hWz6oCa51O0=](https://app.affine.pro/api/workspaces/qf73AF6vzWphbTJdN7KiX/blobs/Q0vuhMENkHvfWLaVVSEYyTuW2RcJuHP-hWz6oCa51O0=.webp)\n\nSo why wait? Start creating your own flowcharts today with AFFiNE's easy-to-use tool. Currently, AFFiNE has released its stable version, but we are continuing to build to a more feature-rich and stable build. Come and join us on our journey over on our media platforms.\n\n* Official Website: [https://affine.pro/](https://affine.pro/)\n\n* GitHub: [https://github.com/toeverything/AFFiNE](https://github.com/toeverything/AFFiNE)\n\n* Discord: [https://discord.gg/Arn7TqJBvG](https://discord.gg/Arn7TqJBvG)\n\n* Twitter: [https://twitter.com/AffineOfficial](https://twitter.com/AffineOfficial)\n\n\n\n\n\n",
  "publish": true
}