{
  "title": "15 Different Types of Events in Event Management (Categories, Examples)",
  "authors": [
    "Yuhang Zhao"
  ],
  "tags": [
    "Content"
  ],
  "description": "Uncover the nuances of types of events management with our guide to 15 different types of events. Explore a comprehensive list and gain valuable insights for orchestrating memorable experiences in both personal milestones and corporate affairs.",
  "created": 1704240000000,
  "updated": 1704240000000,
  "layout": "blog",
  "id": "VtkRRaPLxq-ZUtxTH5SWm",
  "slug": "15-types-events-event-management-categories-examples",
  "cover": "https://insider.affine.pro/api/workspaces/qf73AF6vzWphbTJdN7KiX/blobs/f3x5Z35P2617UkJHUam1TxFIAXlLFnlYrAtTIyCV49Y=.webp",
  "md": "---\n\ntitle: \"15 Different Types of Events in Event Management (Categories, Examples)\"\n\nauthor: \"Yuhang Zhao\"\n\ntags: Content\n\nslug: 15-types-events-event-management-categories-examples\n\ndescription: \"Uncover the nuances of types of events management with our guide to 15 different types of events. Explore a comprehensive list and gain valuable insights for orchestrating memorable experiences in both personal milestones and corporate affairs.\"\n\ncreated: 2024-01-03\n\nupdated: 2024-01-03\n\nlayout: blog\n\npublish: true\n\n---\n\n\n![f3x5Z35P2617UkJHUam1TxFIAXlLFnlYrAtTIyCV49Y=](https://insider.affine.pro/api/workspaces/qf73AF6vzWphbTJdN7KiX/blobs/f3x5Z35P2617UkJHUam1TxFIAXlLFnlYrAtTIyCV49Y=)\n\n**ðŸŽ‰AFFiNE is now on ProductHunt, support us and leave your feedback here: [https://www.producthunt.com/posts/affine-3](https://www.producthunt.com/posts/affine-3)**\n\n\n![uO1ZB4KWJaUGczcj2ij-OuUOEy0qu6eGa08hzMPp6yk=](https://insider.affine.pro/api/workspaces/qf73AF6vzWphbTJdN7KiX/blobs/uO1ZB4KWJaUGczcj2ij-OuUOEy0qu6eGa08hzMPp6yk=)\n\nIn both personal and professional realms, we often find ourselves managing a myriad of events. Have you ever struggled with the complexity of diverse types, overlapping timelines, and extensive content of events, unable to organize them systematically?\n\nThis article aims to be your compass through the labyrinth, delving into the expansive landscape of event management. By delineating the diverse types of events and presenting practical approaches to their orchestration, we strive to empower you with a comprehensive understanding of event management. Whether it's a personal milestone or a corporate affair, our exploration will unveil the nuances of different events and equip you with valuable insights to navigate the complexities with ease and efficiency. Welcome to the world of \"**Different Types of Events in Event [Management](https://affine.pro/blog/8-free-project-tracker-templates-work-management-2023),**\" where clarity meets [strategy](https://affine.pro/blog/navigating-organizational-strategies-a-path-to-project-success) in crafting memorable experiences.\n\n# Why Should We Manage Events?\n\nEvent management serves the purpose of strategically [planning](https://affine.pro/blog/best-free-whiteboard-layout-ideas-organization), coordinating, and executing [activities](https://affine.pro/blog/team-building-activities-for-collaboration-success) to successfully create and organize diverse events. This process involves conceptualizing events, defining objectives, budgeting, logistical planning, and overseeing implementation. Event management is essential across various domains, including corporate conferences, weddings, trade shows, and concerts.\nKey aspects of event management encompass venue selection, vendor coordination, budget management, logistics handling, promotion, and ensuring flawless execution. The primary goal is to deliver a memorable and well-organized experience that aligns with event objectives, whether they involve networking, education, celebration, or promotion. Managing events demands a versatile skill set, combining creativity, attention to detail, effective communication, and problem-solving capabilities.\n\n# How to Manage Different Types of Events?\n\n* **Define Clear Objectives**: Clearly outline the goals and [objectives](https://affine.pro/blog/best-free-okr-templates-2023) for the event, setting a clear direction for planning and execution.\n* **Understand Your Audience**: Identify and understand the target audience to tailor the event experience and engagement strategies accordingly.\n* **Strategic Planning**: Develop a comprehensive plan covering logistics, budgeting, and promotional strategies, aligning with the event's purpose.\n* **Logistical Coordination**: Ensure meticulous coordination of all logistical aspects, including venue selection, vendor collaboration, and technical requirements.\n* **Post-Event Evaluation**: Conduct a thorough evaluation post-event, gathering feedback and analyzing key performance indicators to identify areas for improvement in future events.\n# 15 Different Types of Events in Event Management\n\n\n![bB0juN9bz_2NH5TOWWF_13XjeN4lD4A6Vb0bClpxsjs=](https://insider.affine.pro/api/workspaces/qf73AF6vzWphbTJdN7KiX/blobs/bB0juN9bz_2NH5TOWWF_13XjeN4lD4A6Vb0bClpxsjs=)\n\n## In-person Events\n\n### 1. Conference\n\n\n![NBISLom6qSyQ0KuXFvY5l1GGAj1pXDx6rfWv6bWPBWs=](https://insider.affine.pro/api/workspaces/qf73AF6vzWphbTJdN7KiX/blobs/NBISLom6qSyQ0KuXFvY5l1GGAj1pXDx6rfWv6bWPBWs=)\n\nConferences are large-scale gatherings for industry professionals where thought leaders share insights, fostering knowledge exchange and advancements within the industry.\n\n**Thematic Planning:**\n\n* Develop a clear conference theme and objectives to guide content and presentations.\n* Ensure alignment with industry trends, fostering relevant knowledge exchange and advancements.\n**Speaker and** [Agenda](https://affine.pro/blog/how-to-create-kickoff-meeting-agenda-step-by-step-guide) **Curation:**\n\n* Identify thought leaders and experts as speakers, ensuring diverse perspectives and expertise.\n* Curate a comprehensive agenda with engaging sessions, allowing for meaningful knowledge sharing.\n**Logistics and Venue Coordination:**\n\n* Secure a spacious and well-equipped venue suitable for the conference's scale and purpose.\n* Coordinate logistical aspects, including registration, seating arrangements, and technical requirements, to ensure a smooth event flow.\n**Networking Opportunities:**\n\n* Create structured networking sessions, facilitating connections among industry professionals.\n* Implement digital tools or platforms to enhance networking, fostering [collaboration](https://affine.pro/blog/top-asynchronous-communication-tools-free-2024) and knowledge exchange beyond scheduled sessions.\n### 2. Seminars\n\n\n![EnjYWkqTpy_by5ma6WgfX7_sNMul3n8esl0vgVBxTJU=](https://insider.affine.pro/api/workspaces/qf73AF6vzWphbTJdN7KiX/blobs/EnjYWkqTpy_by5ma6WgfX7_sNMul3n8esl0vgVBxTJU=)\n\nSeminars are interactive sessions strategically focused on specific topics. They represent opportunities for in-depth exploration and skill development within targeted areas.\n\n**Topic Selection and Planning:**\n\n* Choose a relevant and engaging topic aligned with the audience's interests.\n* Develop a detailed agenda outlining key discussion points and activities for the seminar.\n**Interactive Format:**\n\n* Design the seminar as an interactive session with Q&A, discussions, and hands-on activities.\n* Encourage active participation to foster in-depth exploration and skill development.\n**Venue and Technology Setup:**\n\n* Select a venue conducive to collaboration, ensuring proper seating and audio-visual equipment.\n* Test and ensure the functionality of technology tools for presentations and interactive elements.\n**Promotion and Registration:**\n\n* Develop a marketing strategy to promote the seminar and attract the target audience.\n* Implement a streamlined registration process, providing necessary information and confirming attendee participation.\n### 3. Sports Events\n\n\n![mThtFzQjMOYppb-iCDnLHnYOp_DW3dT_gjg3v-cNJ5c=](https://insider.affine.pro/api/workspaces/qf73AF6vzWphbTJdN7KiX/blobs/mThtFzQjMOYppb-iCDnLHnYOp_DW3dT_gjg3v-cNJ5c=)\n\nSports events bring together enthusiasts for competitions, tournaments, and gatherings. Whether participating or spectating, individuals engage in various sports activities, fostering camaraderie and celebrating achievements through events like marathons and awards ceremonies.\n\n**Detailed Planning:**\n\n* Develop a comprehensive event plan outlining the [schedule](https://affine.pro/blog/11-free-customizable-weekly-schedule-planner-templates-2023), venue logistics, and safety protocols.\n* Collaborate with sports organizations, authorities, and vendors to ensure all aspects are meticulously arranged.\n**Participant Engagement:**\n\n* Implement engaging activities and ceremonies to enhance the overall experience for participants.\n* Coordinate with teams, sponsors, and volunteers to create an inclusive and spirited atmosphere during the event.\n**Logistical Coordination:**\n\n* Manage logistics such as transportation, accommodation, and equipment.\n* Ensure seamless coordination with officials, referees, and medical teams to guarantee the safety and smooth execution of the sports event.\n### 4. Weddings\n\n\n![b6lOa6E-hrGAgOePXG5vZMqL9QYSj86hKnvCNzAGce0=](https://insider.affine.pro/api/workspaces/qf73AF6vzWphbTJdN7KiX/blobs/b6lOa6E-hrGAgOePXG5vZMqL9QYSj86hKnvCNzAGce0=)\n\nWeddings symbolize the ceremonial union of couples, celebrating not only their love but also the commitment to a lifelong journey together. These joyous events often incorporate traditions, rituals, and personalized touches.\n\n**Detailed Planning:**\n\n* Work closely with the couple to understand their vision, preferences, and expectations.\n* Develop a comprehensive [timeline](https://affine.pro/blog/how-to-create-timeline-template-google-docs-step-by-step-guide) outlining key milestones from pre-wedding preparations to the actual ceremony.\n**Vendor Coordination:**\n\n* Collaborate with and coordinate various vendors, including florists, caterers, photographers, and decorators.\n* Ensure clear communication channels and detailed contracts to avoid misunderstandings.\n**Logistical Management:**\n\n* Oversee logistical aspects, including venue setup, transportation, and coordination of the wedding party.\n* Address potential challenges by having contingency plans in place for unforeseen circumstances.\n### 5. Birthday Parties\n\n\n![su04IRsZI1sUFWzsBpmeUE_XtNaM9WddRSIX8_99di8=](https://insider.affine.pro/api/workspaces/qf73AF6vzWphbTJdN7KiX/blobs/su04IRsZI1sUFWzsBpmeUE_XtNaM9WddRSIX8_99di8=)\n\nBirthday parties are joyous celebrations marking the milestone of an individual's birth. These gatherings are filled with laughter, decorations, and shared moments, creating a festive atmosphere to commemorate the person's special day.\n\n**Personalized Planning:**\n\n* Collaborate with the host to understand preferences, themes, and specific requirements for the birthday celebration.\n* Create a personalized party plan encompassing decorations, activities, and entertainment tailored to the individual's tastes.\n**Vendor Coordination:**\n\n* Coordinate with vendors such as caterers, decorators, and entertainers to ensure timely and efficient services.\n* Ensure clear communication regarding expectations, preferences, and any special arrangements required for the birthday party.\n**Logistical Execution:**\n\n* Oversee logistical aspects, including venue setup, catering, and entertainment.\n* Implement a timeline for the party, ensuring that activities, games, and special moments align seamlessly to create a joyous and memorable birthday celebration.\n### 6. [Team-building](https://affine.pro/blog/team-building-activities-for-collaboration-success) Event\n\n\n![iCbZdU9RuEKcLIktlUiMWL2Kuf4M63jPRjXNN8TRV-w=](https://insider.affine.pro/api/workspaces/qf73AF6vzWphbTJdN7KiX/blobs/iCbZdU9RuEKcLIktlUiMWL2Kuf4M63jPRjXNN8TRV-w=)\n\nTeam-building events involve purposeful activities designed to strengthen teamwork, improve communication, and foster camaraderie among participants. These events enhance collaboration and create a positive and cohesive team dynamic.\n\n**Objective Setting:**\n\n* Define specific objectives for the team-building event, such as improving communication or fostering trust among team members.\n* Align activities with these objectives to ensure a targeted and impactful experience.\n**Activity Selection:**\n\n* Choose activities that cater to the team's dynamics and address specific areas needing improvement.\n* Incorporate a mix of indoor and outdoor activities to provide variety and accommodate diverse preferences.\n**Facilitator Guidance:**\n\n* Employ experienced facilitators to guide activities and debrief sessions, ensuring participants extract valuable insights.\n* Facilitators play a crucial role in steering the event toward its intended goals.\n### 7. Fashion Events\n\n\n![tLbaKMcTx-lxwFRqX9uAwVxCfVlL3csJJCiWFP3q_BU=](https://insider.affine.pro/api/workspaces/qf73AF6vzWphbTJdN7KiX/blobs/tLbaKMcTx-lxwFRqX9uAwVxCfVlL3csJJCiWFP3q_BU=)\n\nFashion Events are dynamic showcases spotlighting the latest trends in clothing and style. These events, including fashion shows and runway presentations, provide a platform for designers to unveil their creations and influence industry trends.\n\n**Creative Conceptualization:**\n\n* Develop a compelling and unique theme for the fashion event, aligning with current trends and brand objectives.\n* Collaborate with designers, stylists, and creative teams to bring the concept to life through innovative presentations.\n**Logistical Precision:**\n\n* Coordinate venue logistics to ensure it complements the fashion theme and comfortably accommodates attendees.\n* Oversee backstage coordination, including model management, wardrobe changes, and seamless runway transitions.\n**Promotional Strategy:**\n\n* Implement a robust promotional strategy to generate buzz around the fashion event.\n* Utilize social media, influencers, and partnerships to reach a wider audience, building anticipation and ensuring a successful turnout.\n## Virtual Events\n\n### 1. Virtual Summits\n\n\n![IlKTbokzjp4Muw5U8fY2FX8JZprmAYPgLiYD8sQqmXY=](https://insider.affine.pro/api/workspaces/qf73AF6vzWphbTJdN7KiX/blobs/IlKTbokzjp4Muw5U8fY2FX8JZprmAYPgLiYD8sQqmXY=)\n\nHigh-stakes business summits, often attended by industry leaders and board members, are increasingly shifting to virtual formats. The surge in demand for virtual conferences is driven by effective engagement tools, global speaker accessibility, cost savings, and enhanced brand fulfillment.\n\n**Platform Selection:**\n\n* Choose a reliable virtual summit platform tailored to the event's scale and goals.\n* Ensure it supports interactive features like live sessions, Q&A, and virtual networking to enhance participant experience.\n**Engagement Planning:**\n\n* Develop strategies to keep participants engaged, including live Q&A sessions, polls, and virtual networking opportunities.\n* Balance content with interactive elements, utilizing both pre-recorded and live sessions for a dynamic and engaging virtual summit.\n**Technical Support:**\n\n* Offer dedicated technical support to address participant queries and troubleshoot platform-related issues.\n* Conduct thorough testing of audiovisual components and interactive features to ensure a seamless virtual summit experience for all attendees.\n### 2. Webinars\n\n\n![iEZgnFAR-LaR9JrSEA5xGYpQkg9LEb8P2svcLRJVSJ8=](https://insider.affine.pro/api/workspaces/qf73AF6vzWphbTJdN7KiX/blobs/iEZgnFAR-LaR9JrSEA5xGYpQkg9LEb8P2svcLRJVSJ8=)\n\nWebinars, considered vital by 95% of marketers, serve diverse purposes like lead generation, training, and product launches. They contribute to increased brand awareness, partnership facilitation, and thought leadership, providing a broad networking platform.\n\n**Strategic Planning:**\n\n* Develop a well-defined strategy outlining the webinar's goals, target audience, and key messages.\n* Plan engaging content and incorporate interactive elements to maintain participant interest throughout the session.\n**Technical Setup:**\n\n* Ensure a seamless technical setup, including a reliable webinar platform and necessary audiovisual equipment.\n* Conduct thorough testing to address any potential technical glitches and ensure a smooth webinar experience for both presenters and attendees.\n**Participant Engagement:**\n\n* Encourage participant engagement through live polls, Q&A sessions, and interactive discussions.\n* Foster networking opportunities by providing a platform for attendees to connect with speakers and fellow participants, enhancing the overall webinar experience.\n### 3. Training Sessions\n\n\n![tb4MUxH5Y0oqNOBI9mPRoj44H60DkcAtxF58TBUYkpg=](https://insider.affine.pro/api/workspaces/qf73AF6vzWphbTJdN7KiX/blobs/tb4MUxH5Y0oqNOBI9mPRoj44H60DkcAtxF58TBUYkpg=)\n\nVirtual training sessions enable global team participation, fostering interaction among diverse departments and geographical zones. These events facilitate camaraderie and peer learning, overcoming challenges associated with travel in a remote setup.\n\n**Technology Integration:**\n\n* Select and integrate user-friendly virtual training platforms.\n* Ensure compatibility with various devices and provide technical support for a smooth learning experience.\n**Interactive Content:**\n\n* Develop engaging and interactive training materials.\n* Incorporate multimedia elements, quizzes, and discussions to enhance participant involvement and [knowledge](https://affine.pro/blog/top-5-google-docs-alternatives-pkm) retention.\n**Participant Support:**\n\n* Provide pre-training resources and instructions to familiarize participants with the virtual platform.\n* Offer ongoing technical support during the session and encourage participant interaction through Q&A sessions and virtual discussions.\n## Hybrid Events\n\n### 1. Product Launches\n\n\n![U6_yaacv584E66uuyYEGDwiTsBAR0XHdXjEZxgSvu7E=](https://insider.affine.pro/api/workspaces/qf73AF6vzWphbTJdN7KiX/blobs/U6_yaacv584E66uuyYEGDwiTsBAR0XHdXjEZxgSvu7E=)\n\nProduct launches involve introducing new products or services to the market. These launches serve as pivotal moments, demanding meticulous planning to craft impactful first impressions. The seamless coordination of such events includes selecting suitable venues, collaborating with vendors, managing budgets, and ensuring all logistical aspects, such as transportation and catering, align cohesively.\n\n**Strategic Planning:**\n\n* Develop a comprehensive plan for goals, target audience, and key messages.\n* Optimize product launch timing for maximum impact.\n**Venue and Vendors:**\n\n* Choose a suitable venue aligned with the product and engage reliable vendors.\n* Ensure clear communication channels, considering atmosphere, capacity, and accessibility.\n**Budget and Logistics:**\n\n* Develop and monitor a detailed budget for all launch aspects.\n* Coordinate transportation, logistics, and ensure seamless event flow.\n**Presentation and Evaluation:**\n\n* Craft impactful presentations showcasing product features.\n* Implement a comprehensive marketing strategy and gather post-launch feedback for continuous improvement.\n### 2. Trade Shows and Exhibitions\n\n\n![V9aVjknDYPDCgfBxTcs0EE6qUeyxWy8wZ1CUzsm2540=](https://insider.affine.pro/api/workspaces/qf73AF6vzWphbTJdN7KiX/blobs/V9aVjknDYPDCgfBxTcs0EE6qUeyxWy8wZ1CUzsm2540=)\n\nTrade shows and exhibitions provide platforms for industries to exhibit their products and services. These events not only showcase innovations but also foster networking, creating valuable [business opportunities](https://affine.pro/blog/8-free-project-tracker-templates-work-management-2023) for participants.\n\n**Strategic Planning:**\n\n* Develop a clear strategy outlining exhibition goals, target audience, and desired outcomes.\n* Plan booth layout and design to effectively showcase products or services.\n**Engagement Activities:**\n\n* Implement interactive activities to attract attendees, such as product demonstrations or workshops.\n* Arrange networking opportunities, facilitating connections between exhibitors and potential clients.\n**Logistical Coordination:**\n\n* Ensure efficient logistical coordination, including booth setup, transportation, and staff allocation.\n* Implement technology for streamlined registration and data collection to enhance the overall event experience.\n**Marketing and Promotion:**\n\n* Create a comprehensive marketing plan to generate buzz before the event.\n* Utilize various channels, including social media and email campaigns, to reach the target audience and drive attendance.\n### 3. Networking Events\n\n\n![Rrm439mQZa_9sb3_7wxdtUormkc5oKexWf0wj6eivtk=](https://insider.affine.pro/api/workspaces/qf73AF6vzWphbTJdN7KiX/blobs/Rrm439mQZa_9sb3_7wxdtUormkc5oKexWf0wj6eivtk=)\n\nNetworking events offer individuals the chance to connect, fostering professional relationships and providing opportunities for [collaboration](https://affine.pro/blog/best-trello-alternatives-project-management). These occasions facilitate interactions, allowing attendees to explore shared interests and potential synergies.\n\n**Strategic Planning:**\n\n* Define clear goals for the networking event, such as fostering collaborations or introducing professionals to industry trends.\n* Plan activities that encourage meaningful interactions and relationship-building.\n**Facilitate Interaction:**\n\n* Design a conducive environment for networking, with designated areas for conversations and collaboration.\n* Implement icebreaker activities or guided discussions to promote engagement among attendees.\n**Technology Integration:**\n\n* Utilize event management apps or platforms to facilitate seamless networking.\n* Incorporate features like digital business cards or matchmaking algorithms to connect attendees based on shared interests.\n**Follow-Up and Feedback:**\n\n* Establish a system for post-event follow-ups to nurture connections made during the networking event.\n* Collect feedback to assess the event's success and gather insights for improvements in future networking opportunities.\n### 4. Non-profit and Fundraising Event\n\n\n![4NIPZ340fpvFvkigIOhFjg1BNO1r06WGWMaRTvN6-r0=](https://insider.affine.pro/api/workspaces/qf73AF6vzWphbTJdN7KiX/blobs/4NIPZ340fpvFvkigIOhFjg1BNO1r06WGWMaRTvN6-r0=)\n\nNon-profit and Fundraising Events are organized to champion charitable causes, raising both funds and awareness for diverse social issues. These events play a crucial role in fostering community support and positive change.\n\n**Strategic Planning:**\n\n* Develop a comprehensive plan outlining the goals, target audience, and key messages for the non-profit or fundraising event.\n* Strategize fundraising initiatives, considering the unique characteristics of the cause and the audience.\n**Engagement Strategies:**\n\n* Implement creative and impactful engagement strategies to connect emotionally with participants and donors.\n* Utilize storytelling, testimonials, and interactive elements to convey the mission and encourage donations.\n**Logistical Coordination:**\n\n* Oversee logistical aspects such as venue selection, permits, and catering.\n* Collaborate with sponsors, volunteers, and vendors to ensure seamless coordination, creating a positive and memorable experience for attendees.\n### 5. Art and Cultural Events\n\n\n![T77etWS-UtzLvXkvwZtFNMktXaH1L_EZm9RBbgQR6YI=](https://insider.affine.pro/api/workspaces/qf73AF6vzWphbTJdN7KiX/blobs/T77etWS-UtzLvXkvwZtFNMktXaH1L_EZm9RBbgQR6YI=)\n\nArt and Cultural Events are vibrant celebrations embracing artistic expression and cultural diversity. These events encompass art exhibitions, cultural festivals, and heritage events, fostering a rich tapestry of creativity and tradition.\n\n**Curatorial Expertise:**\n\n* Collaborate with curators and cultural experts to curate compelling exhibitions or events that showcase diverse artistic expressions and cultural heritage.\n* Ensure a thoughtful selection that resonates with the event's theme and objectives.\n**Community Engagement:**\n\n* Foster community involvement by organizing interactive workshops, performances, or discussions that promote audience participation.\n* Encourage local artists and community members to contribute, creating a sense of shared cultural celebration.\n**Logistical Coordination:**\n\n* Plan logistical details, including venue selection, permits, and exhibition layout.\n* Coordinate with artists, performers, and vendors to ensure smooth event execution, providing an immersive and enjoyable experience for attendees.\n# Which Event [Management Tool](https://affine.pro/blog/10-best-free-smart-sheet-alternatives-for-project-management-2023) Offers the Best Solution?\n\n\n![aBn3NI7QxiNtATK15n4ew0ICIfBen_dJ-i733stoOlU=](https://insider.affine.pro/api/workspaces/qf73AF6vzWphbTJdN7KiX/blobs/aBn3NI7QxiNtATK15n4ew0ICIfBen_dJ-i733stoOlU=)\n\n**[AFFiNE](https://affine.pro/)** emerges as the unrivaled leader in the realm of event management tools, offering an unparalleled solution for orchestrating seamless and successful events. With its comprehensive set of features and [user-friendly interface](https://affine.pro/blog/affine-0-10-0-launch-week-day-1-lightening-up-visual-experience), AFFiNE caters to the diverse needs of event planners, ensuring every aspect is meticulously addressed.\n\n### Streamlining Projects Through Powerful [Templates](https://affine.pro/blog/free-best-8-storyboard-templates-examples)\n\nAFFiNE revolutionizes project planning with a diverse [Template Gallery](https://affine.pro/blog/affine-0-11-0-launch-day-4-navigating-canvas-complexity-templates-clarity-free-online-whiteboard), featuring robust Gantt charts, [concept maps](https://affine.pro/blog/top-8-concept-map-templates-examples), and monthly calendars. This curated collection accelerates project execution, serving as a launchpad to skip groundwork and enhance efficiency. Crafted for seamless collaboration, AFFiNE's templates offer structured canvases, saving time in [project management](https://affine.pro/blog/8-best-monday-alternatives-for-project-management-2023), content creation, and planning. With these tools, AFFiNE transforms event management into a streamlined, efficient, and collaborative experience.\n\n\n![OP3GdbE7dwmQKK2uKzBgJbhpVJxkLuDsVtomxcggvSQ=](https://insider.affine.pro/api/workspaces/qf73AF6vzWphbTJdN7KiX/blobs/OP3GdbE7dwmQKK2uKzBgJbhpVJxkLuDsVtomxcggvSQ=)\n\n### Advanced Collaboration Capability\n\nWhen you do need to [collaborate](https://affine.pro/blog/top-asynchronous-communication-tools-free-2024) with other contributors to discuss your concept map, AFFiNE makes getting feedback simple. Appealing collaboration capability provides visibility into assigned tasks, making tables easier to estimate, and ensuring your concept map remains well-designed. You can invite team members or classmates to collaborate on concept maps together, making it perfect for group projects or study sessions.\n\n\n![O88V12dZ7eALpdMD8-6eyyfRec5yZyWiQxCnvNEb3r0=](https://insider.affine.pro/api/workspaces/qf73AF6vzWphbTJdN7KiX/blobs/O88V12dZ7eALpdMD8-6eyyfRec5yZyWiQxCnvNEb3r0=)\n\nWith top-notch software like AFFiNE at your disposal along with its diverse range of templates and user-friendly features, creating concept maps has never been easier or more effective. Commence concept mapping by using AFFiNE's user-friendly tool. Presently, **AFFiNE** has launched its **[Stable Version](https://affine.pro/download)**, with ongoing efforts to develop a more comprehensive and dependable iteration. Join us on our voyage through our social media channels and be part of the experience. **Come and join us on our journey over on our media platforms. ðŸš€**\n\n* Official Website: [https://affine.pro/](https://affine.pro/)\n* GitHub: [https://github.com/toeverything/AFFiNE](https://github.com/toeverything/AFFiNE)\n* Discord: [https://discord.gg/Arn7TqJBvG](https://discord.gg/Arn7TqJBvG)\n* Twitter: [https://twitter.com/AffineOfficial](https://twitter.com/AffineOfficial)\n\n\n\n\n",
  "publish": true
}