{
  "title": "8 Best Habit Tracker Apps You Need in 2024 (Features & Price)",
  "authors": [
    "Yiyang Zhang"
  ],
  "tags": [
    "Content"
  ],
  "description": "Unevil the secrets behind habit tracking that will boost your well-being. Discover 8 best habit tracker apps you need in 20234.",
  "created": 1694649600000,
  "updated": null,
  "layout": "blog",
  "id": "jxhJcCM27U",
  "slug": "8-best-habit-tracker-apps-your-need-2023-features-price",
  "cover": "https://insider.affine.pro/api/workspaces/qf73AF6vzWphbTJdN7KiX/blobs/C5xh2oHxMZdZtu_akkcBJbGvsMZli7emKrtsXTNL95M=.webp",
  "md": "---\n\ntitle: \"8 Best Habit Tracker Apps You Need in 2024 (Features & Price)\"\n\nauthor: \"Yiyang Zhang\"\n\ntags: Content\n\nslug: 8-best-habit-tracker-apps-your-need-2023-features-price\n\ndescription: \"Unevil the secrets behind habit tracking that will boost your well-being. Discover 8 best habit tracker apps you need in 20234.\"\n\ncreated: 2023-09-14\n\nupdated: 20234-01-02\n\nlayout: blog\n\npublish: true\n\n---\n\n\n![C5xh2oHxMZdZtu_akkcBJbGvsMZli7emKrtsXTNL95M=](https://insider.affine.pro/api/workspaces/qf73AF6vzWphbTJdN7KiX/blobs/C5xh2oHxMZdZtu_akkcBJbGvsMZli7emKrtsXTNL95M=)\n\nPicture this: instead of relying solely on sheer willpower and memory, sticking to that daily routine for a few days, weeks, or months, and then falling back into our old habits, imagine having a personal coach right at your fingertips; a companion that reminds you of what needs to be done. That's where habit tracker apps comes in handy to help youstay on track!\n\nIn this article, we'll explore 8 remarkable habit tracking apps that have taken the market by storm. With the best habit tracker apps by your side in 2024, achieving your goals has never been easier or more enjoyable! From their unique features and benefits to pricing options – we've got you covered!\n\n### What is Habit Tracking\n\nHabit tracking is the process of monitoring and recording your daily behaviors and routines. It involves keeping a record of activities you want to turn into habits, such as exercise, reading, or even meditation. By tracking these habits consistently, you gain valuable insights into your progress and areas for improvement. Habit tracking empowers us to take control of our actions by providing visibility into how well we are sticking to our intentions.\n\n### Why Use a Habit Tracking App\n\nIn today's fast-paced world, staying on top of our goals and building new habits can be challenging. That's where habit-tracking apps come in handy!\n\n\n![6CUdviAfHWtdYuiLYap_E-hTSFSFAKcWGARPvkZMG70=](https://insider.affine.pro/api/workspaces/qf73AF6vzWphbTJdN7KiX/blobs/6CUdviAfHWtdYuiLYap_E-hTSFSFAKcWGARPvkZMG70=)\n\n* Develop self-awareness. By logging your daily activities and habits, you can gain valuable insights into your behaviors and patterns over time. This awareness allows you to identify areas for improvement and make necessary adjustments.\n* Provide motivation and encouragement. Many apps use visual cues, such as charts or streak counters, that show your progress towards achieving your goals.\n* Offer convenience. By providing reminders and notifications, whether it's a gentle nudge in the morning or an alert throughout the day, these reminders ensure that you don't forget about the habits you want to cultivate.\n\n\nIncorporating a habit tracking app into your routine can be incredibly beneficial when it comes to building good habits. It keeps you accountable while providing valuable insights, motivation, convenience.\n\n### 2024 Best 8 Habit Tracking Apps You Have to Try\n\n#### 1.**[AFFiNE](https://affine.pro/)**\n\n\n![zQNqEVje-o-sRCv6ttcGZPJ46pOL5_5Qk0lKbVb9EJk=](https://insider.affine.pro/api/workspaces/qf73AF6vzWphbTJdN7KiX/blobs/zQNqEVje-o-sRCv6ttcGZPJ46pOL5_5Qk0lKbVb9EJk=)\n\nWith AFFiNE, professionals have access to a unified platform for knowledge base planning, organisation, and content development. This flexible tool allows users to track their habbits as well as set up their goals, all while staying in sync and constructing content with blocks. The limitless workspace allows for user-driven innovation. The benefits of AFFiNE include safe data storage, open-source benefits, and collaborative functionality. Those looking for a fresh take on knowledge management will find its comprehensive approach to be a compelling option.\n\nThe AFFiNE [community](https://community.affine.pro/home) edition is available for free, and it includes complete control, the ability to operate offline, peer-to-peer syncing between devices, and some cloud storage.\n\n**Key features of AFFiNE:**\n\n* Properties Editing: To enhance your interaction, we've introduced a dedicated panel for Kanban editing. Here, you have the freedom to edit properties at your convenience, enriching your Kanban experience.\n\n![PrWKlqwLbz13lYnPPyIU4acy6ukqZ4X4ZFMVonMmSO8=](https://insider.affine.pro/api/workspaces/qf73AF6vzWphbTJdN7KiX/blobs/PrWKlqwLbz13lYnPPyIU4acy6ukqZ4X4ZFMVonMmSO8=)\n\n* Unparalleled customization: Now, you can classify based on almost any property, allowing for personalized categorization that aligns perfectly with your needs.\n\n![UQ37RBZanYmZt_xalHX36RiT4YeUrGDNNQNtrNbC-zs=](https://insider.affine.pro/api/workspaces/qf73AF6vzWphbTJdN7KiX/blobs/UQ37RBZanYmZt_xalHX36RiT4YeUrGDNNQNtrNbC-zs=)\n\n* Intuitive Drag-and-Drop Sorting: By simply dragging and dropping to the desired spot, you have the flexibility to move entire columns or individual Kanban cards to your preferred locations effortlessly.\n\n![zwXUytnIiLZIAPLE1ujUVUFmHqngYjhG1Y0eaIXSS4g=](https://insider.affine.pro/api/workspaces/qf73AF6vzWphbTJdN7KiX/blobs/zwXUytnIiLZIAPLE1ujUVUFmHqngYjhG1Y0eaIXSS4g=)\n\n* AFFiNE Cloud: With AFFiNE Cloud, you can invite your family and friends to collaborate in real-time within a shared workspace. This feature makes your habit of tracking work smoother and more efficient.\n\n![7sC9sHff3sHGQBmTEKzUZGo-t0-4fs92M2IM3GSiPkQ=](https://insider.affine.pro/api/workspaces/qf73AF6vzWphbTJdN7KiX/blobs/7sC9sHff3sHGQBmTEKzUZGo-t0-4fs92M2IM3GSiPkQ=)\n\n* Edgeless Mode: Our exciting Edgeless Mode, including a redesigned toolbar, eraser, connector, blockslicer, integrated canvas text and copy as PNG, etc. Get ready to unlock new levels of productivity and immerse yourself in a seamless and efficient workflow.\n\n![q1kRb852K7CyMTlg9CXig9gOklaMKSlob1bGxmyH11k=](https://insider.affine.pro/api/workspaces/qf73AF6vzWphbTJdN7KiX/blobs/q1kRb852K7CyMTlg9CXig9gOklaMKSlob1bGxmyH11k=)\n\n **Pricing:** FREE\n\n#### 2.**[StickK](https://www.stickk.com/)**\n\n\n![wCbVZ77dQ5jvHDmFp2PA-NNFpUjoJN1EUPKVmx0tmns=](https://insider.affine.pro/api/workspaces/qf73AF6vzWphbTJdN7KiX/blobs/wCbVZ77dQ5jvHDmFp2PA-NNFpUjoJN1EUPKVmx0tmns=)\n\nStickK allows you to create a commitment contract, setting your goal and a custom timeline to reach it. Commitment Contracts are free to create, and you can create as many as you want. Also, you can assign a friend or family member to check your data to ensure you’re on your way to reaching your goals.\n\nKey features:\n\n* Set goals and custom timelines\n* More than 10 support communities\n* Invite a friend or family member to hold you accountable\nPros of StickK\n\n* Support communities with over 60,000 users\n* Option to add monetary stakes for motivation\n* Have a close member witness your progress\nCons of StickK\n\n* Poor app ratings\n* No upfront pricing information\nPricing: $10/user per month\n\n\n\n#### 3.**[Streaks](https://streaks.app/)**\n\n\n![ONvrQ9cPc94De-mjUJTOljIt1uui4WKyXgatyUtQ7jc=](https://insider.affine.pro/api/workspaces/qf73AF6vzWphbTJdN7KiX/blobs/ONvrQ9cPc94De-mjUJTOljIt1uui4WKyXgatyUtQ7jc=)\n\nStreaks is perfect for visual learners who enjoy tracking their progress through colourful charts and graphs, with its sleek design and customizable features. It supports health-related habits like exercise and mindfulness practices but lacks social interaction features.\n\nKey features:\n\n* Tracks steps, heart rate, blood pressure, and more with Apple Health\n* Set specific days for each task\n* Detailed statistics to help you track your progress\nPros of Streaks\n\n* Highly customizable with color themes and task icons\n* Customizable interface\n* Automatic reminders\nCons of Streaks\n\n* Limited to 12 tasks per day\n* Not available for Android\nPricing: $4.99/user per month\n\n#### 4.**[Habitica](https://habitica.com/static/home)**\n\n\n![1utk0GvflL6yiLdXLijGxKdHHHaKxc1xlU6TO7nktO4=](https://insider.affine.pro/api/workspaces/qf73AF6vzWphbTJdN7KiX/blobs/1utk0GvflL6yiLdXLijGxKdHHHaKxc1xlU6TO7nktO4=)\n\nHabitica is a gamified habit tracker app that lets you turn your daily tasks into a fun role-playing game. Earn points, level up your character, and unlock rewards as you complete habits. The app also allows you to join guilds and collaborate with friends on quests.\n\nKey features:\n\n* The easy-to-use interface simplifies managing habits and daily goals\n* Fully-customizable task lists\n* Customizable colour schemes, reminders and widgets\nPros of Habitica\n\n* Make habit-building a fun process\n* The group plan includes a group chat & group task board\n* Engage in and complete quests with others\nCons of Habitica\n\n* No free plan\n* No automated tracking\nPricing: $5/month per user. Group plan ($9/month and $3/member).\n\n#### 5.**[Productive](https://productive.io/)**\n\n\n![26blUugEPLyRmFBSMODuRwl2T6TihHTXaF731PL36Fw=](https://insider.affine.pro/api/workspaces/qf73AF6vzWphbTJdN7KiX/blobs/26blUugEPLyRmFBSMODuRwl2T6TihHTXaF731PL36Fw=)\n\nProductive tracks your daily habits and activities, and it provides progress tracking tools, such as charts to show how well you're doing with a particular task over time.\n\nKey features:\n\n* Customizable habit templates you can tailor to your goals\n* Detailed analytics & visualizations\n* Location-based & smart reminders\nPros of Productive\n\n* Easy-to-use interface\n* Extra incentive\n* Smart reminders help to keep you accountable\nCons of Productive\n\n* No cloud storage back-up options\n* Tracking capabilities are limited\nPricing: $6.99/month per user\n\n#### 6.**[Way of Life](https://wayoflifeapp.com/)**\n\n\n![0im38KS6yUhk1aJDLPZMoGt8hPK5uVWRioKZKS-CpQM=](https://insider.affine.pro/api/workspaces/qf73AF6vzWphbTJdN7KiX/blobs/0im38KS6yUhk1aJDLPZMoGt8hPK5uVWRioKZKS-CpQM=)\n\nWith Way of Life, you can set custom streak lengths by tapping on Chains when creating a journal. Way of Life has separate journals for each habit.\n\nKey features:\n\n* Diary feature lets you take notes about your habits\n* Analytics charts provide your behavioral details\n* Unique color-coded system to keep track of your habits\nPros of Way of Life\n\n* User-friendly platform\n* Reminders to help your complete your tasks\n* High data secure\nCons of Way of Life\n\n* Limited progress tracking features\n* Unavailable to set recurring tasks\nPricing: $4.99/user per month\n\n#### 7.**[Strides](https://www.stridesapp.com/)**\n\n\n![n7KEY5xuaKxG-Yhb8JctunvBcqwdMgo39ctmpE7Tzyw=](https://insider.affine.pro/api/workspaces/qf73AF6vzWphbTJdN7KiX/blobs/n7KEY5xuaKxG-Yhb8JctunvBcqwdMgo39ctmpE7Tzyw=)\n\nStrides is a habit tracking app that offers four different habit tracking views, where you can step forward in many different ways to get organized and track anything you want to build.\n\nKey features:\n\n* Deeper insights with progress reports\n* Tags to help you categorize various habits\n* Tracker template\nPros of Strides\n\n* Available for iPhone, iPad and, Apple Watch\n* Daily & weekly reminders\n* Motivation when achieving your goals\nCons of Strides\n\n* Only suitable for individuals\n* Limited to basic task tracking features\nPricing:  $4.99/user per month\n\n#### 8.**[Habitify](https://www.habitify.me/)**\n\n\n![tOmHIR_LkYuhblUvTx6F_m45n3SL1G8OAeOEw6bERy4=](https://insider.affine.pro/api/workspaces/qf73AF6vzWphbTJdN7KiX/blobs/tOmHIR_LkYuhblUvTx6F_m45n3SL1G8OAeOEw6bERy4=)\n\nHabitify is super easy to set up and begin tracking your habits. With Habitify, you can keep track of your progress, receive reminders on all devices, organise your habits, and visualise your improvements every day.\n\nKey features:\n\n* Built-in note-taking feature\n* Multiple reminders to remind you of projects\n* Detailed weekly and monthly reports\nPros of Habitify\n\n* Supports Android, iOS, Apple Watch, and Mac\n* Keep your habit-building goals secure with facial recognition and fingerprint lock\nCons of Habitify\n\n* Limited to three habits in the free plan\n* Not able to select custom dates for progress reports\nPricing: $4.99/user per month\n\n### Build Good Habits Now\n\nNow that you have discovered the top 8 habit tracker apps for 2024, it's time to take action and build good habits. Remember, consistency is key when it comes to forming new habits. Also, you need a productive habit tracker app, like **AFFiNE**, that’ll help you get the job done. Incorporating a habit tracker app into your daily routine can provide tremendous support as you work towards achieving personal growth and [master time management](https://affine.pro/blog/top-5-free-practical-time-management-templates) — whether it’s productivity, mental health, or anything else important to YOU!\n\n\n![o7LQRbUwYfnNmBFLgNwkmK0c5fcLOepmeRh7iN4Gcwk=](https://insider.affine.pro/api/workspaces/qf73AF6vzWphbTJdN7KiX/blobs/o7LQRbUwYfnNmBFLgNwkmK0c5fcLOepmeRh7iN4Gcwk=)\n\n\n\nSo why wait? Download AFFiNE today! Embrace this opportunity to transform yourself into the best version possible while staying organized. It's never too late! Start track your habits today with AFFiNE's easy-to-use tool. Currently, AFFiNE has released its [stable version](https://affine.pro/download), but we are continuing to build to a more feature-rich and stable build. Come and join us on our journey over on our media platforms.\n\n* Official Website: [https://affine.pro/](https://affine.pro/)\n* GitHub: [https://github.com/toeverything/AFFiNE](https://github.com/toeverything/AFFiNE)\n* Discord: [https://discord.gg/Arn7TqJBvG](https://discord.gg/Arn7TqJBvG)\n* Twitter: [https://twitter.com/AffineOfficial](https://twitter.com/AffineOfficial)\n",
  "publish": true
}