{
  "title": "8 Free Printable Vision Board Templates and Examples for 2023",
  "authors": [
    "Yiyang Zhang"
  ],
  "tags": [
    "Content"
  ],
  "description": "Unravel the elegance of vision board templates for your needs. Discover 8 free printable examples of vision board templates to upgrade your work efficiency in 2023.",
  "created": 1699228800000,
  "updated": 1699315200000,
  "layout": "blog",
  "id": "siVFmLrvI-bKkBlpcemaF",
  "slug": "8-free-printable-vision-board-templates-examples-2023",
  "cover": "https://insider.affine.pro/api/workspaces/H6vffRmJbCfA-r3kq_36_/blobs/Dz7z47_oEzeWvly2iYlxS9FCnMFwm5cyBww6F739Ftc=.webp",
  "md": "---\n\ntitle: \"8 Free Printable Vision Board Templates and Examples for 2023\"\n\nauthor: \"Yiyang Zhang\"\n\ntags: Content\n\nslug: 8-free-printable-vision-board-templates-examples-2023\n\ndescription: \"Unravel the elegance of vision board templates for your needs. Discover 8 free printable examples of vision board templates to upgrade your work efficiency in 2023.\"\n\ncreated: 2023-11-06\n\nupdated: 2023-11-07\n\nlayout: blog\n\npublish: true\n\n---\n\n\n![Dz7z47_oEzeWvly2iYlxS9FCnMFwm5cyBww6F739Ftc=](https://insider.affine.pro/api/workspaces/H6vffRmJbCfA-r3kq_36_/blobs/Dz7z47_oEzeWvly2iYlxS9FCnMFwm5cyBww6F739Ftc=)\n\nAre you ready to turn your dreams into reality?\n\nA vision board can be the powerful tool you need to manifest your desires and create a life that truly aligns with your goals. But where do you start? With so many ideas swirling in your head, it can be overwhelming to put them all together in a visually appealing and meaningful way. That's where vision board templates come in handy.\n\n\n![sChO-S5ldUvE6vXQ5JHgBHmEEhqjBIEgA9gYgAS1AB4=](https://insider.affine.pro/api/workspaces/H6vffRmJbCfA-r3kq_36_/blobs/sChO-S5ldUvE6vXQ5JHgBHmEEhqjBIEgA9gYgAS1AB4=)\n\nIn this article, we'll explore what exactly a vision board template is and why it's essential for crafting an effective vision board. We'll also provide you with 8 free printable templates specifically designed for 2023, so you can get started on bringing your dreams to life. Let's dive into the world of vision board templates and discover how these templates can help shape an extraordinary year ahead!\n\n### What is a Vision Board Template?\n\nA vision board template is a pre-designed layout that helps you create a blueprint for your vision board. It provides structure and guidance, making it easier for you to organize your goals, dreams, and aspirations into a visually appealing collage. By using pre-designed templates, you can create your vision board with ease while saving time and energy on layout design. These templates are flexible and customizable, allowing you to express your unique vision. Curate images that align with your aspirations and easily update and revise them as needed throughout the year.\n\n### What Makes a Good Vision Board Template?\n\nWhen it comes to creating a vision board, the template you choose plays a crucial role in helping you manifest your dreams and goals. But what exactly makes a good vision board template? Let's dive in and explore some key factors.\n\n* üìäSimplicity is key. A good vision board template should have a clean layout that allows for easy organization of images, quotes, and affirmations. It should be visually appealing without being overwhelming.\n* üé®Customization options are important. Look for templates that allow you to personalize colors, fonts, and backgrounds to align with your unique style and preferences. This way, you can create a vision board that truly resonates with you.\n* üîçVersatility is essential. When choosing a vision board template, you may want to use your vision board for different purposes throughout the year or even update it periodically as you achieve certain milestones in your journey toward success.\n* üßêAccessibility is paramount. Opting for free printable vision board templates means they're readily available online so that anyone can access them easily without any hassle.\nRemember: each person has their unique preferences when it comes to designing their dream life on paper through visual aids like vision boards. So ultimately, choose a template that speaks to YOU ‚Äì one that ignites inspiration within you every time you look at it!\n\n### 8 Free Vision Board Templates to Use for 2023\n\nLooking to make 2023 your best year yet? A vision board can be a powerful tool to help you visualize and manifest your goals. And the best part? You don't have to start from scratch! There are plenty of free vision board templates available that can jumpstart your creative process.\n\n1.**[AFFiNE](https://affine.pro/) Vision Board Template for Book Notes**\n\n\n![r9zApXValu4H5VoC3-vzpL8kecErOBl2TaIabV2_xcI=](https://insider.affine.pro/api/workspaces/H6vffRmJbCfA-r3kq_36_/blobs/r9zApXValu4H5VoC3-vzpL8kecErOBl2TaIabV2_xcI=)\n\n\n\nThe AFFiNE classic collage vision board template for book notes features a grid layout where you can paste tables, quotes, and affirmations that align with your aspirations. It's perfect for those who love multiple organizing styles. This minimalist approach allows space for reflection while still capturing the essence of what matters most to you.\n\n2.**[AFFiNE](https://affine.pro/) Vision Board Template for Brainstorming**\n\n\n![-1vWtuoARlaC9DQ3u2RX_EzagZYpwgJCJ6GPppPKgEk=](https://insider.affine.pro/api/workspaces/H6vffRmJbCfA-r3kq_36_/blobs/-1vWtuoARlaC9DQ3u2RX_EzagZYpwgJCJ6GPppPKgEk=)\n\nIf you're more of a visual thinker, the AFFiNE vision board template for brainstorming is for you. Create a page by connecting different focus areas with colorful arrows or lines. Let your ideas flow freely! This template divides your vision board into sections dedicated to specific goals, such as a checklist, map, trips, and personal growth. Organize each area with relevant visuals and motivating quotes.\n\n3.**[Canva](https://www.canva.com/) Cute Inspiration Vision Board Template**\n\n\n![kuzvC1ViUDqifPNuyYDANI0chGLo-oKshbxBNN0fkGU=](https://insider.affine.pro/api/workspaces/H6vffRmJbCfA-r3kq_36_/blobs/kuzvC1ViUDqifPNuyYDANI0chGLo-oKshbxBNN0fkGU=)\n\nThe Canva cute inspiration vision board template Sometimes images speak louder than words. This template allows you to create a colourful and inspiring cloud filled with keywords that represent what you want to achieve. You can organize your boards by areas of your life, such as relationships, careers, finances, home, travel, personal growth, and health. With the help of this template, you can easily visualize your aspirations and take steps toward achieving them.\n\n4.**[Canva](https://www.canva.com/) Elegant Vision Board Template**\n\n\n![p2Hj3tAsyLjh6MH-0QmagTLEEAqWEfBhiKzWkyeDd50=](https://insider.affine.pro/api/workspaces/H6vffRmJbCfA-r3kq_36_/blobs/p2Hj3tAsyLjh6MH-0QmagTLEEAqWEfBhiKzWkyeDd50=)\n\nThe Canva elegant vision board template embraces various square shapes and beautifully composed placeholders for images, notes, and colour swatches. This template will serve as your daily visual reminder to facilitate your daily work and study.\n\n5.**[ClickUp](https://clickup.com/) Vision Board Template**\n\n\n![zYGVcwirFnKXjDBmNqxLXogX1c1bT3H1xWYf8ScCXGQ=](https://insider.affine.pro/api/workspaces/H6vffRmJbCfA-r3kq_36_/blobs/zYGVcwirFnKXjDBmNqxLXogX1c1bT3H1xWYf8ScCXGQ=)\n\nThe ClickUp vision board template is a valuable tool for your team to define your product's purpose, target audience, clients, and users. Once you have laid out the fundamentals, you can delve deeper into the problems your product will solve and the resources required for success.\n\n6.**[ClickUp](https://clickup.com/) Vision to Values Board Template**\n\n\n![H3iaFyE_P0wzSYuLljI79o_ky9PGiCk4L-m_c_GZ1uU=](https://insider.affine.pro/api/workspaces/H6vffRmJbCfA-r3kq_36_/blobs/H3iaFyE_P0wzSYuLljI79o_ky9PGiCk4L-m_c_GZ1uU=)\n\nThe ClickUp vision to values template guides you and your team through the process of documenting all the necessary aspects required to define your company or project's direction. Think of it as a pre-worksheet that assists you in creating a digital vision board.\n\n7.**[Notion](https://affine.pro/blog/notion-alternatives-to-revolutionise-your-personal-workflow) New Year's Vision Board Template**\n\n\n![prlSFa6FuszrBHTjQR4yC9-g6u10dGKE74hWcHy1wEM=](https://insider.affine.pro/api/workspaces/H6vffRmJbCfA-r3kq_36_/blobs/prlSFa6FuszrBHTjQR4yC9-g6u10dGKE74hWcHy1wEM=)\n\nThe Notion New Year's vision board template can help you keep your goals and inspirations in focus throughout the year. With Notion's partnership, you can find the perfect source of inspiration for any goal you have in mind. If you want to add more details, simply click on a gallery card to create a goal-specific vision board, set expectations, or even track your progress throughout the year.\n\n8.**[Notion](https://affine.pro/blog/notion-alternatives-to-revolutionise-your-personal-workflow) Vision Board Template for Class Notes**\n\n\n![qfF6kTEpv_9fRbVLxwqcvq01h4YNgjmQVVYW7dNRDuI=](https://insider.affine.pro/api/workspaces/H6vffRmJbCfA-r3kq_36_/blobs/qfF6kTEpv_9fRbVLxwqcvq01h4YNgjmQVVYW7dNRDuI=)\n\nThe Notion vision board template can make things easier for you. With this template, you can capture all your class-related notes, tag them by class, and automatically date them. You can easily identify what you need to review and upload any related materials. This way, you can keep all your notes in one spot and never miss out on important information.\n\n### Harness Vision Board Templates to Improve Your Workflow\n\nLaunching a successful product or project begins with a clear sense of direction. Vision boards are invaluable tools for aligning your team and ensuring everyone knows the path forward. Whether you're a creative, a technical expert, or a team leader, the challenge of where to start is universal. Enter AFFiNE's vision board templates - a user-friendly, collaborative platform.\n\n\n![tQunWJIPRxkcABnHlZvoNzn1pWyq9oo2_ZBswgXop3w=](https://insider.affine.pro/api/workspaces/H6vffRmJbCfA-r3kq_36_/blobs/tQunWJIPRxkcABnHlZvoNzn1pWyq9oo2_ZBswgXop3w=)\n\nAFFiNE facilitates the creation process and guides anchoring your vision in your core values. Consider AFFiNE your comprehensive vision board kit for a smooth start. If you're already an AFFiNE user, integrate a template into your Workspace. If you haven't explored AFFiNE's powerful project management and collaboration platform, sign up today, and take it for a spin - with some added sparkle if you wish!\" ‚ú®\n\nKey features:\n\n* **Powerful [Database](https://affine.pro/blog/best-project-planning-tools-software-for-teams-2023):** AFFiNE's database includes two main views: **[Kanban](https://affine.pro/blog/affine-080-launch-week-day3)** and **Table**. In the Kanban view, you can easily track your progress, visualize timelines, and manage tasks. You can move Kanban cards to your preferred location to prioritize your tasks and edit their properties for your convenience to create personal vision boards. The Kanban view presents your data in a structured format, making it easier to analyze and manage your boards.\n\n![crjX5_HRaAu3feQ3mQMTVmg-FqXutYjATZJpEZEMi98=](https://insider.affine.pro/api/workspaces/H6vffRmJbCfA-r3kq_36_/blobs/crjX5_HRaAu3feQ3mQMTVmg-FqXutYjATZJpEZEMi98=)\n\n* **Edgeless Mode:** Creating **mindmaps** and **flowcharts** can be a breeze with AFFiNE's Edgeless Mode. It helps you to consolidate your thoughts and organize your ideas in a more efficient way. AFFiNE also allows you to **frame** your vision boards, so that you can keep them well-structured. Moreover, the **presentation mode** in AFFiNE empowers you to present your ideas more effectively. Get ready to achieve new productivity levels and immerse yourself in a seamless and efficient workflow.\n\n![cXPfaH7yGKuxN6x24MrIF_2SxJEMnAdSfT2q9HhQpD4=](https://insider.affine.pro/api/workspaces/H6vffRmJbCfA-r3kq_36_/blobs/cXPfaH7yGKuxN6x24MrIF_2SxJEMnAdSfT2q9HhQpD4=)\n\n* **Reliable [Offline](https://affine.pro/blog/5-best-offline-alternatives-to-notion) Capability:** We prioritize your privacy and have made the decision to provide offline support for AFFiNE. With offline support, your work is saved on your device, allowing you to make uninterrupted progress even during internet disruptions. This feature enhances productivity and ensures high-quality decision-making.\n\n![b170NZ_-DTtnErSRI_iPhSOzNlf5B9Nt2716NlXYe6Y=](https://insider.affine.pro/api/workspaces/H6vffRmJbCfA-r3kq_36_/blobs/b170NZ_-DTtnErSRI_iPhSOzNlf5B9Nt2716NlXYe6Y=)\n\nPresently, AFFiNE has launched its **[Stable Version](https://affine.pro/download)**, with ongoing efforts to develop a more comprehensive and dependable iteration. Join us on our voyage through our social media channels and be part of the experience. **Come and join us on our journey over on our media platforms.**\n\n* Official Website: [https://affine.pro/](https://affine.pro/)\n* GitHub: [https://github.com/toeverything/AFFiNE](https://github.com/toeverything/AFFiNE)\n* Discord: [https://discord.gg/Arn7TqJBvG](https://discord.gg/Arn7TqJBvG)\n* Twitter: [https://twitter.com/AffineOfficial](https://twitter.com/AffineOfficial)\n",
  "publish": true
}