{
  "title": "AFFiNE 0725 V0.0.1-alpha.0.3.0 Release Notes",
  "authors": [
    "Jiachen He",
    "Fangyuan Zheng",
    "Fanjing Zhang"
  ],
  "tags": [
    "Release Note"
  ],
  "description": "Thank you very much for your attention to AFFiNE! Some exciting changes in AFFiNE are as follows",
  "created": 1658707200000,
  "updated": 1658707200000,
  "layout": "blog",
  "id": "11d6f7c7fd594a2aac940c36c0dbb770",
  "slug": "affine-0725-v0.0.1-alpha.0.3.0-release-notes",
  "cover": "https://app.affine.pro/api/workspaces/qf73AF6vzWphbTJdN7KiX/blobs/6VRed784f7jyEctOTJiQR8ir11tFfOQsV4kubVrH0bQ=.webp",
  "md": "---\n\ntitle: AFFiNE 0725 V0.0.1-alpha.0.3.0 Release Notes\n\nauthor: Jiachen He, Fangyuan Zheng, Fanjing Zhang\n\ntags: Release Note\n\nslug: affine-0725-v0.0.1-alpha.0.3.0-release-notes\n\ndescription: Thank you very much for your attention to AFFiNE! Some exciting changes in AFFiNE are as follows\n\ncreated: 2022-07-25\n\nupdated: 2022-07-25\n\nlayout: blog\n\npublish: true\n\n---\n\n\n![6VRed784f7jyEctOTJiQR8ir11tFfOQsV4kubVrH0bQ=](https://app.affine.pro/api/workspaces/qf73AF6vzWphbTJdN7KiX/blobs/6VRed784f7jyEctOTJiQR8ir11tFfOQsV4kubVrH0bQ=)\n\n**Thank you very much for your attention to AFFiNE! Some exciting changes in AFFiNE are as follows:**\n\n### **New Features：**\n\n**Doc:**\n\n* Adjust the website logo style and add click events to the logo;\n* AFFiNE the top toolbar update page icon;\n* The account button replaces the original history button;\n* Optimize the style of the edit box when it is selected;\n* Editor block drag-and-drop layout feature is online in page mode.\n\n\n**Sidebar：**\n\n* Sidebar user ID online customization function;\n* Sidebar “Activities” shows the last five modified documents;\n* The page tree list can be modified by dragging and dropping documents to modify the dependencies;\n* The template function is online.\n\n\n**Tag App：**\n\n* Field title in \"Add tag\" can be modified;\n* Tag app adds animation when the system is woken up.\n**Kanban:**\n\n* Mouse hover to show the tab add & delete function.\n**Board:**\n\n* New board icon update.\n**Development：**\n\n* Local data synchronized with online.\n### **Bug Fixes**\n\nIn our continued effort to make AFFiNE the most reliable all in one knowledge base 展开, fixing bugs is always our main concern. Here's our work in the last few days:\n\n* Fixed: When pasting text in the input, that text will appear elsewhere;\n* Fixed: In the Doc mode, the top toolbar will obscure the article content;\n* Fixed: When dragging and dropping images into columns, the images are not automatically resized and positioned causing the content to be obscured;\n* Fixed: Occur a \"JS Error\" when deleting the YouTuBe block;\nAFFiNE is currently in the early alpha stage with limited access, and public early access will be available in the autumn of 2022.\n\nAFFiNE is an open-source project which can be viewed on Github: [https://github.com/toeverything/AFFiNE#readme](https://github.com/toeverything/AFFiNE#readme)\n\nIf you endorse this open source project, please help us by clicking the GitHub star, which is crucial for the future development of AFFiNE.\n\nAFFiNE is very grateful to all open source contributors and will work to build a more positive open source ecosystem.\n\nHope you have a nice time with AFFiNE!\n\n",
  "publish": true
}