{
  "title": "AFFiNE 0715 V0.0.1-alpha.0.1.1 Release Notes",
  "authors": [
    "Jiachen He",
    "Fangyuan Zheng",
    "Fanjing Zhang"
  ],
  "tags": [
    "Release Note"
  ],
  "description": "Thank you very much for your attention to AFFiNE! Some exciting changes in AFFiNE are as follows",
  "created": 1657843200000,
  "updated": 1657843200000,
  "layout": "blog",
  "id": "417e18b287e34ef7a33692b214e888c5",
  "slug": "affine-0715-v0.0.1-alpha.0.1.1-release-notes",
  "cover": "https://insider.affine.pro/api/workspaces/qf73AF6vzWphbTJdN7KiX/blobs/oSmlB48rgShBiKSetZZnBGQS1qfcpu7uQPKpVVp2pUU=.webp",
  "md": "---\n\ntitle: AFFiNE 0715 V0.0.1-alpha.0.1.1 Release Notes\n\nauthor: Jiachen He, Fangyuan Zheng, Fanjing Zhang\n\ntags: Release Note\n\nslug: affine-0715-v0.0.1-alpha.0.1.1-release-notes\n\ndescription: Thank you very much for your attention to AFFiNE! Some exciting changes in AFFiNE are as follows\n\ncreated: 2022-07-15\n\nupdated: 2022-07-15\n\nlayout: blog\n\npublish: true\n\n---\n\n\n![oSmlB48rgShBiKSetZZnBGQS1qfcpu7uQPKpVVp2pUU=](https://insider.affine.pro/api/workspaces/qf73AF6vzWphbTJdN7KiX/blobs/oSmlB48rgShBiKSetZZnBGQS1qfcpu7uQPKpVVp2pUU=)\n\n**Thank you very much for your attention to AFFiNE! Some exciting changes in AFFiNE are as follows:**\n\n### **Bug Fixes**\n\nIn our continued effort to make AFFiNE the most reliable all in one knowledge base 展开, fixing bugs is always our main concern. Here's our work in the last few days:\n\n* Fixed: Drag and drop function of Kanban can not be used;\n* Fixed: The default color of the Kanban status label is yellow;\n* Fixed: After modifying the content of a sub-Kanban in Kanban mode, the sub-Kanban will move up and down with the mouse.\nAFFiNE is currently in the early alpha stage with limited access and public early access will be available in the autumn of 2022.\n\nAFFiNE is an open-source project which can be viewed on Github: [https://github.com/toeverything/AFFiNE#readme](https://github.com/toeverything/AFFiNE#readme)\n\nIf you endorse this open source project, please help us by clicking the GitHub star, which is crucial for the future development of AFFiNE.\n\nAFFiNE is very grateful to all open source contributors and will work to build a more positive open source ecosystem.\n\nHope you have a nice time with AFFiNE!\n\n",
  "publish": true
}