{
  "title": "The Best 10 Trello Alternatives & Competitors in 2024 for Project Management (Free & Paid)",
  "authors": [
    "Yuhang Zhao"
  ],
  "tags": [
    "Content"
  ],
  "description": "Explore the best Trello alternatives and competitors in 2024 for both free and paid project management solutions. Find the perfect fit for your team's collaboration and organization needs.",
  "created": 1693872000000,
  "updated": 1703462400000,
  "layout": "blog",
  "id": "yabFvgHqk-",
  "slug": "best-trello-alternatives-project-management",
  "cover": "https://insider.affine.pro/api/workspaces/qf73AF6vzWphbTJdN7KiX/blobs/BK1eSsRQGc8-hu3kQAhzFPutp7Lik94JT6RU76q_RHs=.webp",
  "md": "---\n\ntitle: \"The Best 10 Trello Alternatives & Competitors in 2024 for Project Management (Free & Paid)\"\n\nauthor: Yuhang Zhao\n\ntags: Content\n\nslug: best-trello-alternatives-project-management\n\ndescription: \"Explore the best Trello alternatives and competitors in 2024 for both free and paid project management solutions. Find the perfect fit for your team's collaboration and organization needs.\"\n\ncreated: 2023-09-05\n\nupdated: 2023-12-25\n\nlayout: blog\n\npublish: true\n\n---\n\nTrello has established itself as one of the user-friendly Kanban tools since its inception in 2011. Even after more than ten years, Trello remains a prominent choice for Kanban software. However, many users are impeded by its restricted functionality and reporting capabilities. Teams seek better alternatives for enhanced productivity.\n\nTherefore, this article aims to familiarize you with Trello's functionalities and also present its top 10 alternatives. Let's begin this journey of exploration!\n\n# **What is Trello?**\n\n\n![BK1eSsRQGc8-hu3kQAhzFPutp7Lik94JT6RU76q_RHs=](https://insider.affine.pro/api/workspaces/qf73AF6vzWphbTJdN7KiX/blobs/BK1eSsRQGc8-hu3kQAhzFPutp7Lik94JT6RU76q_RHs=)\n\nTrello, developed by Atlassian, serves as a project management solution built upon the principles of the Kanban framework. It excels in overseeing tasks through a user-friendly to-do list layout. Facilitating the exchange of boards and cards among individuals or groups, Trello comes with both a complimentary package and premium options. The upgraded versions provide enhanced automation, collaborative capabilities, and increased administrative authority.\n\n# **Pros and Cons:**\n\n\n![wRZ4uEifgIz5kFGV30kbcKD8P87OjQKrqUcCgCJIoKM=](https://insider.affine.pro/api/workspaces/qf73AF6vzWphbTJdN7KiX/blobs/wRZ4uEifgIz5kFGV30kbcKD8P87OjQKrqUcCgCJIoKM=)\n\n## Pros:\n\n**Kanban Framework**: Trello's implementation of the Kanban methodology provides a simple and effective way to manage tasks and workflows, particularly for smaller projects and teams.\n\n**Flexibility**: Its flexible card and board structure allows users to customize their workflow, adapting Trello to various project types and work processes.\n\n**Collaboration**: Trello enables smooth collaboration through shared boards, cards, and real-time updates, fostering teamwork and communication within projects.\n\n## Cons:\n\n**Limited Complexity**: Trello's simplicity can be a limitation for more complex projects or larger teams that require advanced features and customization options.\n\n**Lack of Advanced Reporting**: Trello's reporting capabilities are relatively basic, lacking in-depth analytics and advanced reporting features needed for comprehensive project analysis.\n\n**Restricted Free Offering**: While Trello provides a free plan, its capabilities are notably limited. Key features like Calendar, Timeline, Map, Table, and Dashboard Views are inaccessible. Sole reliance on the Kanban board can be problematic when different teams need diverse layouts. Consider alternatives with a strong free plan offering varied viewing options.\n\n# **What is a Good Project Management Tool for Kanban?**\n\nA proficient project management tool for Kanban should effectively fulfil the fundamental principles of the Kanban system, encompassing the visualization of work, constraining work-in-progress, and optimizing overall flow and efficiency. To achieve this, there are several vital attributes that such a tool should possess:\n\n\n![qwAbt86sJPy9I2F68E2nKEkNi2RisOIoWa_ta2AmI7M=](https://insider.affine.pro/api/workspaces/qf73AF6vzWphbTJdN7KiX/blobs/qwAbt86sJPy9I2F68E2nKEkNi2RisOIoWa_ta2AmI7M=)\n\n* User-Friendly Interface: The tool's interface should be user-friendly, facilitating effortless creation, movement, and management of tasks.\n* Customizable Boards and Cards: A quality Kanban tool should offer the ability to tailor boards according to your workflow, while also permitting customization of task cards to include relevant task details.\n* Work-In-Progress Limits: A cornerstone of Kanban, the tool should empower you to establish limits on concurrent tasks in progress, thus preventing overload and aiding in pinpointing bottlenecks.\n* Real-Time Updates: The tool must provide real-time updates, ensuring that all team members have access to the current status of tasks at any given moment.\n* Reporting and Analytics: The tool should furnish valuable insights into your team's workflow, including task duration at each stage, bottleneck identification, and overall project advancement.\n# **The 10 Best Trello Alternatives You Need to Know**\n\n## 1.[AFFiNE](https://affine.pro/)\n\nAFFiNE stands as an all-in-one task management solution, facilitating organization, collaboration, and project handling. These comprehensive software streamlines workflows while boasting a robust Kanban feature for enhanced database management and smoother workflows.\n\nKey Features of AFFiNE's [**Kanban**](https://affine.pro/blog/affine-080-launch-week-day3):\n\n* **Text-to-Kanban Conversion**: With a single click, convert your blocks into a Kanban view in AFFiNE. Seamlessly transition to an intuitive task management layout, simplifying your to-do list management.\n\n![wTNgyrpvo8nL6XojCwwuTwOz-z3_aeLNXj8ibcFxVYM=](https://insider.affine.pro/api/workspaces/qf73AF6vzWphbTJdN7KiX/blobs/wTNgyrpvo8nL6XojCwwuTwOz-z3_aeLNXj8ibcFxVYM=)\n\n* **Unification of Kanban and Table Views**: Enjoy synchronized updates between Kanban and table views. Modifications in the Kanban layout are automatically mirrored in the corresponding table view, offering dual data management options for seamless convenience.\n\n![crjX5_HRaAu3feQ3mQMTVmg-FqXutYjATZJpEZEMi98=](https://insider.affine.pro/api/workspaces/qf73AF6vzWphbTJdN7KiX/blobs/crjX5_HRaAu3feQ3mQMTVmg-FqXutYjATZJpEZEMi98=)\n\n* **Intuitive Drag-and-Drop Sorting**: Require a change in sequence? It's effortless â€“ just use drag-and-drop to place items where you want. Enjoy the freedom to move complete columns or individual Kanban cards effortlessly to your desired positions.\n\n![zwXUytnIiLZIAPLE1ujUVUFmHqngYjhG1Y0eaIXSS4g=](https://insider.affine.pro/api/workspaces/qf73AF6vzWphbTJdN7KiX/blobs/zwXUytnIiLZIAPLE1ujUVUFmHqngYjhG1Y0eaIXSS4g=)\n\n**Pricing:** Free\n\n**Pro Plan:** Please go to https://affine.pro/pricing.\n\n## 2.Clickup\n\n\n![nHlpIGjaADNCxGnGLHj7E_FdLmgm_M1_rvgLvCLOo-0=](https://insider.affine.pro/api/workspaces/qf73AF6vzWphbTJdN7KiX/blobs/nHlpIGjaADNCxGnGLHj7E_FdLmgm_M1_rvgLvCLOo-0=)\n\n**Key features:**\n\n* **Cloud-based Collaboration**: A cloud-powered collaborative tool designed for crafting and storing intricate company and project documents. Seamlessly collaborate and share essential information with your team, enhancing productivity and information accessibility.\n* **Business Metrics Tracking**: Empower your business journey by defining and monitoring key performance metrics. This feature aids in setting targets and tracking progress, providing actionable insights for informed decision-making.\n* **Mind Maps:** Generate visually captivating outlines effortlessly, either from scratch or by utilizing existing tasks. This feature streamlines idea organization, helping you conceptualize projects with clarity and creativity.\nPricing:\n\n* Free Forever Plan\n* Unlimited Plan: $7 per month per member\n* Business Plan: $12 per month per member\n* Business Plus Plan: $19 per month per member\n## 3.Asana\n\n\n![Kmb9Hzv6bQeQ3ITmpgRnbT60AzdLQNjjH81g-cfcU_g=](https://insider.affine.pro/api/workspaces/qf73AF6vzWphbTJdN7KiX/blobs/Kmb9Hzv6bQeQ3ITmpgRnbT60AzdLQNjjH81g-cfcU_g=)\n\nKey features:\n\n* **Task Views:** Gain diverse insights into tasks with versatile viewing options. Switch between list, Kanban board, or timeline perspectives to suit your preferred task management approach.\n* **Project Templates:** Access a collection of over 50 project templates to kickstart your endeavours seamlessly. These templates offer a ready-to-use foundation for various project types, saving you time and effort.\n* **Gantt Charts:** Harness the power of Gantt charts, complete with timelines, to attain a comprehensive visual representation of your project. This feature simplifies complex project tracking and planning processes.\n**Pricing:**\n\n* Basic plan: Free\n* Premium plan: $12 per month per member\n* Business plan: $24.99 per month per member\n* Enterprise plan: Contact for details\n## 4.KanbanFlow\n\n\n![aEGpi2GpBuRmgUDmxmEOoPdaaJNo5y7moL4bEe9Wml0=](https://insider.affine.pro/api/workspaces/qf73AF6vzWphbTJdN7KiX/blobs/aEGpi2GpBuRmgUDmxmEOoPdaaJNo5y7moL4bEe9Wml0=)\n\nKey features:\n\n* File & Document Attachment: Enhance collaboration by effortlessly attaching files and documents to tasks. This feature promotes streamlined communication and ensures all relevant materials are accessible within the task environment.\n* Filter & Search: Efficiently navigate your task database with advanced filtering and robust search functionality. Easily locate specific tasks or groups of tasks, optimizing your workflow and information retrieval.\n* Mobile Support: Stay connected and productive on the go with comprehensive mobile compatibility. Access and manage tasks seamlessly from your mobile device, ensuring productivity regardless of your location.\n**Pricing:**\n\n* Free\n* Premium: $5 per month per user\n## 5.Proofhub\n\n\n![_bTIDpFxY_OZYlyQ7l4Z9Ghej13nuwuEhHam4Qcl2PM=](https://insider.affine.pro/api/workspaces/qf73AF6vzWphbTJdN7KiX/blobs/_bTIDpFxY_OZYlyQ7l4Z9Ghej13nuwuEhHam4Qcl2PM=)\n\nFeatures:\n\n* Detailed Project Reports: ProofHub offers detailed project reports for tracking progress, monitoring tasks, and analyzing project performance. These reports provide insights into timelines, task completion rates, and resource allocation.\n* Powerful Mobile Apps: With dedicated mobile apps for both iOS and Android platforms, ProofHub ensures that team members can stay connected and engaged while on the go. This mobile accessibility enables real-time updates, task tracking, and seamless communication.\n* Built-in Notepad: The built-in notepad feature in ProofHub allows users to jot down notes, ideas, and important information directly within the platform. This feature streamlines the process of capturing and organizing thoughts during project discussions and brainstorming sessions.\n\n\nPricing:\n\n* Essential: ($45/month)\n* Ultimate control:($89/month)\n## 6.Basecamp\n\n\n![Zb26ntgXaNqrL49mzuuAT-PJcPdq72OjjjIBg_HJC3Y=](https://insider.affine.pro/api/workspaces/qf73AF6vzWphbTJdN7KiX/blobs/Zb26ntgXaNqrL49mzuuAT-PJcPdq72OjjjIBg_HJC3Y=)\n\nKey features:\n\n* Unified Team Conversations: Create a cohesive hub for team discussions with message boards. Facilitate clear and organized communication by centralizing conversations on a single page, fostering collaboration and eliminating scattered communication.\n* Comprehensive Task Management: Streamline team productivity by compiling all necessary tasks into organized to-do lists. This feature ensures that the entire scope of work is accounted for, promoting clarity and efficient task execution.\n* Structured Time Management: Effectively plan and manage projects by assigning specific dates and times using the scheduling feature. This ensures tasks are executed in a well-coordinated manner, optimizing project timelines and outcomes.\n**Pricing:**\n\n* Personal: Free\n* Business: $99 per month (unlimited users)\n## 7.Podio\n\n\n![Din4FTNW0yTx10yNpOwgZIvw5DwUDqpOIP_cpDQwiss=](https://insider.affine.pro/api/workspaces/qf73AF6vzWphbTJdN7KiX/blobs/Din4FTNW0yTx10yNpOwgZIvw5DwUDqpOIP_cpDQwiss=)\n\nKey features:\n\n* Add-ons: Augment platform capabilities with supplementary features like file sharing and messaging apps. These add-ons extend utility, promoting seamless collaboration and communication within a single ecosystem.\n* Built-in Calendar: Benefit from a cohesive built-in calendar to streamline project scheduling and task tracking. This feature ensures a comprehensive overview of project timelines, aiding in efficient time allocation.\n* Integrated Chat Messenger: Foster real-time communication with an integrated chat messenger. This facilitates swift and efficient exchanges, reducing the need for external communication tools and promoting centralized collaboration.\nPricing:\n\n* Free\n* Basic Plan: $9 per month per user\n* Plus Plan: $14 per month per user\n* Premium Plan: $24 per month per user\n## 8.Wrike\n\n\n![cYNXEfO33Ub9x0N_oNY4elPOTPDBQ86UR6CvomuPnkc=](https://insider.affine.pro/api/workspaces/qf73AF6vzWphbTJdN7KiX/blobs/cYNXEfO33Ub9x0N_oNY4elPOTPDBQ86UR6CvomuPnkc=)\n\nKey features:\n\n* Seamless Connectivity: Integrate effortlessly with popular apps such as Zapier, Github, and Gmail. This functionality allows for fluid data flow and enhanced collaboration across platforms, optimizing workflow efficiency.\n* Real-time Insights: Access comprehensive and insightful reports for up-to-the-minute updates. These detailed reports provide valuable data-driven insights, facilitating informed decision-making and agile project management.\n* Team Updates: Stay informed with a dedicated project newsfeed for team updates. This feature ensures everyone is on the same page by consolidating vital project-related information in one accessible location.\nPricing:\n\n* Free\n* Professional variant: $9.80 per month per user\n* Business variant: $24.80 per month per user\n## 9.MeisterTask\n\n\n![K12q_MLbJkXreLkcFOZBQ2A2hP_ppKVTwP69OmRJd8o=](https://insider.affine.pro/api/workspaces/qf73AF6vzWphbTJdN7KiX/blobs/K12q_MLbJkXreLkcFOZBQ2A2hP_ppKVTwP69OmRJd8o=)\n\nKey features:\n\n* Activity Stream: Foster team collaboration with an activity stream for every board. This stream captures ongoing interactions, discussions, and updates, facilitating seamless teamwork and transparency.\n* Customizable Project Boards: Tailor project boards to your needs and receive real-time updates. This feature allows for personalized project management spaces that adapt to your workflow, ensuring optimal organization.\n* Built-in Notepad: Enhance productivity with a built-in notepad for quick idea capture and essential note-taking. This tool provides a convenient space to jot down concepts, reminders, and insights, ensuring no valuable thoughts are lost.\nPricing:\n\n* Free plan\n* Pro plan: $4.19 per month per user\n* Business plan: $10.39 per month per user\n## 10.Hive\n\n\n![tIUi0SV90pL4UHKCmpAp7RI4rSoAv9cC3Zyd4UKbLw8=](https://insider.affine.pro/api/workspaces/qf73AF6vzWphbTJdN7KiX/blobs/tIUi0SV90pL4UHKCmpAp7RI4rSoAv9cC3Zyd4UKbLw8=)\n\nKey features:\n\n* Flexible Project Views: Adapt project views to your preferences and needs. This feature provides versatile ways to visualize and organize tasks, enhancing your ability to manage projects efficiently.\n* Instant Messaging: Foster real-time communication with an instant messaging feature. Seamlessly connect with team members to discuss tasks, share updates, and collaborate, promoting swift and effective information exchange.\n* Action Templates: Expedite task creation with action templates. These pre-defined templates streamline repetitive processes, allowing you to swiftly set up tasks according to established workflows or standards.\nPricing:\n\n* Solo: Free\n* Teams: $12 per month per user\n* Enterprise: Contact for details\n# **Getting Started with Project Management Tools for Kanban!**\n\nExploring the top 10 Kanban-based tools of 2024 is just the starting point. Transform this insight into actionable strategies for heightened productivity. Consistency is key as you adopt new routines.\n\nAFFiNE, as a revolutionary self-hosted data security solution that empowers individuals and businesses to effortlessly collaborate, unlock limitless potential, and engage in seamless multitasking, allowing you to write, draw, and plan all at once.\n\n\n![o7LQRbUwYfnNmBFLgNwkmK0c5fcLOepmeRh7iN4Gcwk=](https://insider.affine.pro/api/workspaces/qf73AF6vzWphbTJdN7KiX/blobs/o7LQRbUwYfnNmBFLgNwkmK0c5fcLOepmeRh7iN4Gcwk=)\n\nSo why wait? Get your hands on AFFiNE today! The timing is opportune, and it's never too late to embark on this transformative journey. Commence tracking your progress in project management using AFFiNE's user-friendly tool. Presently, AFFiNE has launched its [**Stable Version**](https://affine.pro/download), with ongoing efforts to develop a more comprehensive and dependable iteration. Join us on our voyage through our social media channels and be part of the experience. Come and join us on our journey over on our media platforms.\n\n* Official Website: [https://affine.pro/](https://affine.pro/)\n* GitHub: [https://github.com/toeverything/AFFiNE](https://github.com/toeverything/AFFiNE)\n* Discord: [https://discord.gg/Arn7TqJBvG](https://discord.gg/Arn7TqJBvG)\n* Twitter: [https://twitter.com/AffineOfficial](https://twitter.com/AffineOfficial)\n",
  "publish": true
}