{
  "title": "How to Write a Helpful Executive Summary (Free Templates & Examples)",
  "authors": [
    "Yiyang Zhang",
    "Xuan Pang"
  ],
  "tags": [
    "Content"
  ],
  "description": "Unlock the secrets behind crafting an outstanding executive summary that will inspire your team. Learn how to create your own executive summary templates by AFFiNE.",
  "created": 1694390400000,
  "updated": 1694390400000,
  "layout": "blog",
  "id": "rDwQ0XvSVd",
  "slug": "how-to-write-helpful-executive-summary-free-templates-examples",
  "cover": "https://app.affine.pro/api/workspaces/qf73AF6vzWphbTJdN7KiX/blobs/mdoy6Vj8EiMsnvNwEGbMorsMTrd82RIhcjTwQ4OC-iQ=.webp",
  "md": "---\n\ntitle: \"How to Write a Helpful Executive Summary (Free Templates & Examples)\"\n\nauthor: Yiyang Zhang, Xuan Pang\n\ntags: Content\n\nslug: how-to-write-helpful-executive-summary-free-templates-examples\n\ndescription: \"Unlock the secrets behind crafting an outstanding executive summary that will inspire your team. Learn how to create your own executive summary templates by AFFiNE.\"\n\ncreated: 2023-09-11\n\nupdated: 2023-09-11\n\nlayout: blog\n\npublish: true\n\n---\n\n\n![mdoy6Vj8EiMsnvNwEGbMorsMTrd82RIhcjTwQ4OC-iQ=](https://app.affine.pro/api/workspaces/qf73AF6vzWphbTJdN7KiX/blobs/mdoy6Vj8EiMsnvNwEGbMorsMTrd82RIhcjTwQ4OC-iQ=.webp)\n\nPicture this: you have a brilliant business idea or an important project proposal that you need to present to key stakeholders, investors, or potential clients. The challenge? You only have a limited amount of time to grab their attention and make your case. This is where the executive summary comes into play.\n\nIn this article, we'll walk you through what an executive summary is, highlight the top elements to look for in executive summary templates, provide a step-by-step guide to writing one, and  share two top free templates that you can start using right away. Plus, if you're feeling creative, we recommend to design your own template using [AFFiNE](https://community.affine.pro/home). Get ready to impress with your next business proposal or project pitch – let's dive in!\n\n### What is an Executive Summary\n\nAn executive summary is a concise overview of your entire document, whether it's a business plan, report, or proposal. It serves as the first impression – a snapshot that highlights the most crucial information and persuades readers to delve deeper into the details.\n\nThink of the executive summary as your elevator pitch. It is a quick, concise explanation of your paper or screen presentation that captures its main points. Its purpose is to inform and engage readers, motivating them to invest their time and resources into learning more. To be effective, an executive summary should be clear, concise, and compelling. It should provide enough context for readers to understand your offering while leaving them wanting more.\n\n### Top Elements to Look for in Executive Summary Templates\n\nWhen it comes to creating a powerful executive summary, having a well-designed template can make all the difference. But what are the key elements you should be looking for in these templates? Let's take a closer look.\n\n\n![XqeeUDUphTMdCXbeJLsU2jz40X8pFIitaiX6tjBSZFU=](https://app.affine.pro/api/workspaces/qf73AF6vzWphbTJdN7KiX/blobs/XqeeUDUphTMdCXbeJLsU2jz40X8pFIitaiX6tjBSZFU=.webp)\n\n* Clarity and Conciseness: A good executive summary template should present information in a clear and concise manner.\n* Structure: Look for a template that has a logical structure, with sections that flow smoothly from one to another.\n* Visual Appeal: An effective template will incorporate visual elements such as headings, subheadings, bullet points, and charts to break up text and highlight key information.\n* Key Findings: Your executive summary should clearly outline the most important findings or insights from your report or proposal.\nBy selecting an executive summary template with these essential elements, you'll have a solid foundation upon which to create an impactful document capturing both attention and understanding!\n\n* Clarity and Conciseness: A good executive summary template should present information in a clear and concise manner.\n* Structure: Look for a template that has a logical structure, with sections that flow smoothly from one to another.\n* Visual Appeal: An effective template will incorporate visual elements such as headings, subheadings, bullet points, and charts to break up text and highlight key information.\n* Key Findings: Your executive summary should clearly outline the most important findings or insights from your report or proposal.\nBy selecting an executive summary template with these essential elements, you'll have a solid foundation upon which to create an impactful document capturing both attention and understanding!\n\n### Step-by-Step Guide to Writing a Helpful Executive Summary\n\nWriting a helpful executive summary can be a daunting task, but with our step-by-step guide, you'll be able to create one that effectively communicates the key points of your business proposal or report. Here's how:\n\n**Step 1: Understand the Purpose**\n\nBefore you start writing, it's important to understand the purpose of an executive summary. It serves as a concise overview of your document, highlighting the main points and enticing readers to delve deeper.\n\n\n![2ZKblbOwV35p3FErXupXLAwZCQSHJK6T3tjQhqM0Zq8=](https://app.affine.pro/api/workspaces/qf73AF6vzWphbTJdN7KiX/blobs/2ZKblbOwV35p3FErXupXLAwZCQSHJK6T3tjQhqM0Zq8=.webp)\n\n**Step 2: Identify Key Information**\n\nReview your entire document and identify the most important information that needs to be included in the executive summary. This could include key findings, recommendations, financial data, or market analysis.\n\n\n![FYmy3TaxmArS2q6GY_F3_xW90fjJtDUeEgio7M8_nZM=](https://app.affine.pro/api/workspaces/qf73AF6vzWphbTJdN7KiX/blobs/FYmy3TaxmArS2q6GY_F3_xW90fjJtDUeEgio7M8_nZM=.webp)\n\n**Step 3: Outline the Structure**\n\nOrganize your executive summary with sections like introduction, objective, methodology, findings, recommendations, and conclusion.\n\n\n![Wp1NaQEzBpMYBbr3XuBBlUKdPBplZl_7mi12-5QQyz0=](https://app.affine.pro/api/workspaces/qf73AF6vzWphbTJdN7KiX/blobs/Wp1NaQEzBpMYBbr3XuBBlUKdPBplZl_7mi12-5QQyz0=.webp)\n\n**Step 4: Summarize Objectives and Methodology**\n\nSet the context and help the reader understand the approach taken by giving a brief overview of the document's objectives.\n\n\n![XmFeQ5VNvQqHexoWJ4t9TpX-aTyYOKh7gKzpJcNNtnQ=](https://app.affine.pro/api/workspaces/qf73AF6vzWphbTJdN7KiX/blobs/XmFeQ5VNvQqHexoWJ4t9TpX-aTyYOKh7gKzpJcNNtnQ=.webp)\n\n**Step 5:** **Present Key Recommendations**\n\nClearly state what needs to be done, why it matters, and how it aligns with the document's objectives. Make the recommendations actionable and realistic.\n\n\n![zdpPu41SEq8dqa44tkE65UXZneOomVH3PYRHb2zhImI=](https://app.affine.pro/api/workspaces/qf73AF6vzWphbTJdN7KiX/blobs/zdpPu41SEq8dqa44tkE65UXZneOomVH3PYRHb2zhImI=.webp)\n\n**Step 6: Revise and Polish**\n\nReview the executive summary once you have written it for clarity, coherence, and accuracy. Be sure it captures the essence of the full document and represents its content accurately.\n\n\n![eEHGAJs-gI3w4h-rSGrOrVyXnMvrdnWVwWeOGIGrjls=](https://app.affine.pro/api/workspaces/qf73AF6vzWphbTJdN7KiX/blobs/eEHGAJs-gI3w4h-rSGrOrVyXnMvrdnWVwWeOGIGrjls=.webp)\n\nRemember, to write an effective executive summary,take into account these steps. Focus on presenting relevant details clearly while maintaining brevity. Through careful crafting, you can ensure that your executive summaries are informative yet concise!\n\n### 2 Top Free Executive Summary Templates You Have to Try\n\nAre you looking for free executive summary templates to help you create a compelling and informative document? Look no further! In this section, we will share two top-notch templates that you should definitely try out.\n\n1.[AFFiNE](http://affine.pro) Executive Summary Template for Business Plan\n\n\n![28LdbZHSkjA2Ks0IjBYfv0AfnowTudZlfV9MryvI57k=](https://app.affine.pro/api/workspaces/qf73AF6vzWphbTJdN7KiX/blobs/28LdbZHSkjA2Ks0IjBYfv0AfnowTudZlfV9MryvI57k=.webp)\n\nAFFiNE executive summary template for business plan follows a traditional format, with sections for an overview, market analysis, product offering and conclusion. It's clean and straightforward, making it ideal for any industry or business type.\n\n2.AFFiNE Simple Executive Summary Template\n\n\n![9Gs8BfclAm58Z9_w501nDNESIsAejLuXkJsYYdvAouI=](https://app.affine.pro/api/workspaces/qf73AF6vzWphbTJdN7KiX/blobs/9Gs8BfclAm58Z9_w501nDNESIsAejLuXkJsYYdvAouI=.webp)\n\nAFFiNE simple executive summary template will make a positive impact before you submit your report. Define your target market and the problem(s) they face in the problem summary section; explain to your readers how your project or product will solve that problem in the solution section.\n\nWhether it's adjusting the layout or removing sections altogether, make sure your executive summary accurately represents your unique proposition or idea!\n\n### Design Your Own Executive Summary Template by AFFiNE\n\nDesigning your own executive summary template can provide you with a personalized and unique way to showcase the key highlights of your business plan or report. With AFFiNE, a user-friendly platform, you have the flexibility to create a customized executive summary that perfectly aligns with your brand and captures the attention of your target audience.\n\n\n![o7LQRbUwYfnNmBFLgNwkmK0c5fcLOepmeRh7iN4Gcwk=](https://app.affine.pro/api/workspaces/qf73AF6vzWphbTJdN7KiX/blobs/o7LQRbUwYfnNmBFLgNwkmK0c5fcLOepmeRh7iN4Gcwk=.webp)\n\nKey features:\n\n1.Real-time collaboration: At AFFiNE Cloud, you can break free from boring stuff and reimagined collaboration beyond the confines of traditional document modes: collaborative whiteboarding to collaborate with others on a canvas as limitless as your imagination.\n\n\n![jjKkV-ai7hORH_aVcXIsd_GGYmLYifhYodvCBZDBDJY=](https://app.affine.pro/api/workspaces/qf73AF6vzWphbTJdN7KiX/blobs/jjKkV-ai7hORH_aVcXIsd_GGYmLYifhYodvCBZDBDJY=.webp)\n\n2.Grammarly Support: Our collaborative never-wrong undo-redo ability with Conflict-free Replicated Data Types can now seamlessly collaborate with third-party editing. Now, as you type, Grammarly will automatically check your text in real-time, ensuring that your writing is polished and error-free.\n\n\n![9bzGBstt4mdlBTSp8b15WnG5vZ7hkES4IZHZE7LyVrQ=](https://app.affine.pro/api/workspaces/qf73AF6vzWphbTJdN7KiX/blobs/9bzGBstt4mdlBTSp8b15WnG5vZ7hkES4IZHZE7LyVrQ=.webp)\n\n3.Custom Classifying for Ultimate Flexibility: Unlike typical Kanban boards limited to tagging, we provide unparalleled customization. Now, you can classify based on almost any property, allowing for personalized categorization that aligns perfectly with your needs.[图片]\n\n\n![UQ37RBZanYmZt_xalHX36RiT4YeUrGDNNQNtrNbC-zs=](https://app.affine.pro/api/workspaces/qf73AF6vzWphbTJdN7KiX/blobs/UQ37RBZanYmZt_xalHX36RiT4YeUrGDNNQNtrNbC-zs=.webp)\n\nSo why wait? Start creating your own professional executive summaries today with AFFiNE's easy-to-use tool. Currently, AFFiNE has released its stable version, but we are continuing to build to a more feature-rich and stable build. Come and join us on our journey over on our media platforms.\n\n* Official Website: [https://affine.pro/](https://affine.pro/)\n* GitHub: [https://github.com/toeverything/AFFiNE](https://github.com/toeverything/AFFiNE)\n* Discord: [https://discord.gg/Arn7TqJBvG](https://discord.gg/Arn7TqJBvG)\n* Twitter: [https://twitter.com/AffineOfficial](https://twitter.com/AffineOfficial)\n\n\n",
  "publish": true
}