{
  "title": "How to Increase Productivity in the Workplace?",
  "authors": [
    "AFFiNE"
  ],
  "tags": [
    "Content"
  ],
  "description": "Get ready to boost productivity in your workplace and create a better work environment. Here are the top strategies used by business leaders to increase efficiency and performance.",
  "created": 1684281600000,
  "updated": 1684281600000,
  "layout": "blog",
  "id": "iz9tYmfoda",
  "slug": "how-to-increase-productivity-in-the-workplace",
  "cover": "https://app.affine.pro/api/workspaces/qf73AF6vzWphbTJdN7KiX/blobs/7l5H8O8QIoJcguL93pkBDp1t6CxkbsOOBWIzJyT4tHA=.webp",
  "md": "---\n\ntitle: \"How to Increase Productivity in the Workplace?\"\n\nauthor: AFFiNE\n\ntags: Content\n\nslug: how-to-increase-productivity-in-the-workplace\n\ndescription: Get ready to boost productivity in your workplace and create a better work environment. Here are the top strategies used by business leaders to increase efficiency and performance.\n\ncreated: 2023-05-17\n\nupdated: 2023-05-17\n\nlayout: blog\n\npublish: true\n\n---\n\n\n![7l5H8O8QIoJcguL93pkBDp1t6CxkbsOOBWIzJyT4tHA=](https://app.affine.pro/api/workspaces/qf73AF6vzWphbTJdN7KiX/blobs/7l5H8O8QIoJcguL93pkBDp1t6CxkbsOOBWIzJyT4tHA=)\n\n## Introduction\n\nProductivity can make or break any business, and when you have a motivated team that is able to reach its goals efficiently, everyone wins!\n\n**But what do you do if your team's productivity isn't where it should be?**\n\n**How can you increase production and get back on track?**\n\nThe answer lies in effective measures that create an environment conducive to good work habits.\n\nThis blog post will cover five strategies to help you increase productivity in the workplace.\n\n## 1. Set Clear Goals and Expectations\n\nSetting clear goals and expectations is crucial for any business to thrive. When employees have a clear understanding of what is expected of them, they are more likely to perform their duties accurately and efficiently.Furthermore, when they have specific goals to work toward, they remain motivated and focused on achieving their objectives. This creates a positive work environment that promotes collaboration and boosts employee morale.\n\nAdditionally, setting measurable goals and tracking progress can assist in identifying areas that need improvement or recognition.Overall, having a system of clear goals and expectations benefits not only the employees but also the company as a whole in achieving its mission and vision.\n\n**Here are some tips for setting up and managing clear goals:**\n\n* **Establish priorities** - When creating goals, it’s important to determine what is most important and focus on those objectives first.\n* **Set time limits** - Setting time limits helps keep the team focused and on track to complete tasks in a timely manner.\n* **Track progress** - Monitoring progress helps you identify areas of improvement and recognize what is working.\n## 2. Keep Things Simple\n\nIn a world where we are constantly bombarded with information and distractions, the art of simplicity seems almost lost.\n\n**Yet, keeping things simple is a powerful tool when it comes to increasing our productivity.**\n\nBy focusing on one task at a time, we can give our full attention and energy to that one thing, resulting in a job well done. Multitasking, on the other hand, can lead to mistakes, decreased quality of work, and increased stress levels. So, take a deep breath, prioritize your tasks, and keep things simple.\n\nYou might be surprised at how much more you can accomplish in a day with some simple changes.Here are some tips to help you keep things simple:\n\n* **Break down tasks** - Breaking down large tasks into smaller, more manageable chunks can make them easier to focus on.\n* **Schedule breaks** - Give your employees a few minutes throughout the day to take a break and re-energize.\n* **Focus on one task** - Encourage your employees to focus on one task at a time and give their full attention to it.\n## 3. Use Productivity Apps\n\nProductivity is the name of the game in almost every industry. With so much to do in so little time, employees need all the help they can get to streamline their workflows and stay on top of their tasks.This is where productivity apps come in.From to-do lists to goal-tracking tools, these apps are designed to help workers prioritize their workdays and manage their time more efficiently.\n\nHere are some of the most popular productivity apps:\n\n### AFFiNE\n\nAFFiNE is a powerful, open-source digital planner app designed to rival popular tools like Notion, Miro, and Monday. This all-in-one platform combines elements of note-taking, project management, and collaboration to help you streamline your work and personal life.\n\n\n![7jUyO8CkQYjN_51iumHD_EsMEy14yX2wfkHxubexrCU=](https://app.affine.pro/api/workspaces/qf73AF6vzWphbTJdN7KiX/blobs/7jUyO8CkQYjN_51iumHD_EsMEy14yX2wfkHxubexrCU=)\n\nKey features of AFFiNE include:\n\n* Flexible note-taking: Create, edit, and organize your notes with an intuitive interface and rich text editing capabilities.\n* Project management: Plan and manage your projects with visual boards, task assignments, and progress tracking.\n* Collaboration: Work with your team in real-time, share your notes and projects, and communicate effectively with in-app messaging.\n* Customizable interface: Tailor the app to suit your needs and preferences with various themes, templates, and widgets.\nIn addition to those mentioned above, AFFiNE is a fantastic, completely free daily planner app that welcomes everyone to experience its powerful features, making it a delightful surprise for those seeking a comprehensive solution for their daily planning needs.\n\n* For more things related to AFFiNE, come and check out our website: [AFFiNE — All In One KnowledgeOS](https://affine.pro/)\n* Wanna try it online: [https://app.affine.pro/](https://app.affine.pro/)\n### Taskade\n\n\n![8jEYihdlNbdp8rg2O1WsArySud62ihmVnjdTJMxdUak=](https://app.affine.pro/api/workspaces/qf73AF6vzWphbTJdN7KiX/blobs/8jEYihdlNbdp8rg2O1WsArySud62ihmVnjdTJMxdUak=)\n\n[Taskade](https://www.taskade.com/) is a lightweight, free digital planner app perfect for those seeking simplicity and a focus on task management. It offers a clean interface, making it easy to create and manage tasks, set due dates, and collaborate with others. Key features of Taskade include:\n\n* Project templates: Start your projects quickly with pre-built templates for various use cases.\n* Real-time collaboration: Work together with your team on tasks and projects, with live updates and communication.\n* Hierarchical organization: Organize your tasks and notes in a nested structure for easy navigation and management.\n* Cross-platform support: Access Taskade on any device through the web, desktop, and mobile apps.\n### Trello\n\n\n![TSiNGK4yY7gF5SPbz296KqchXM3pdJPE2lGOBz5tcew=](https://app.affine.pro/api/workspaces/qf73AF6vzWphbTJdN7KiX/blobs/TSiNGK4yY7gF5SPbz296KqchXM3pdJPE2lGOBz5tcew=)\n\nTrello is a neat app that can keep track of everything, from the big picture to the minute details. It offers an intuitive design and user experience, being extremely popular as a Kanban Board solution.\n\n* Boards: Trello boards are the foundation of the platform. They are used to organize your tasks and projects. Boards can be customized with different colors, labels, and backgrounds.\n* Comments: Comments can be used to collaborate with team members on tasks and projects. They can be used to ask questions, share ideas, and provide feedback.\n* Power-Ups: Power-Ups are add-ons that extend the functionality of Trello. They can be used to add new features, such as calendars, Gantt charts, and voting.\n* Integrations: Trello can be integrated with other popular apps, such as Slack, Google Drive, and Salesforce. This allows you to work with your favorite tools from within Trello.\n## 4. Creating a Positive Work Environment\n\nCreating a positive work environment can have a huge impact on productivity.\n\nWhen people feel valued and appreciated, they're more likely to be engaged in their work and motivated to do their best.\n\n**Here are some tips for creating a positive work environment:**\n\n* **Show appreciation** - A simple “thank you” or an acknowledgement of a job well done can go a long way in boosting morale.\n* **Provide feedback** - Regularly providing feedback helps employees stay on track and understand what's expected of them.\n* **Encourage collaboration** - Promoting an environment of collaboration helps foster creativity and encourages team spirit.\n* **Create a sense of purpose** - Helping your employees connect to their work by emphasizing its importance can be a great motivator.\n* L**isten to your employees** - Listening to the needs and concerns of employees can help you create a workplace that is conducive to productivity.\nBy following these tips, you can create a truly positive work environment for your employees and help them achieve their highest potential.\n\n## 5. Minimizing Time-Wasting Activities\n\nWe all have a limited amount of time each day to accomplish everything on our to-do list. Unfortunately, many of us fall into the trap of engaging in time-wasting activities, such as mindlessly scrolling through social media or constantly checking our emails. Not only do these activities eat away at our precious time, but they also have negative effects on our productivity levels. The good news is that by identifying these common time-wasting habits, we can take steps to eliminate them and increase our overall productivity.\n\n**Here’s how to avoid some common productivity killers**:\n\n* **Perfectionism** - Instead of getting stuck in the details, focus on the big picture and strive for progress, not perfection.\n* **Procrastination** - Break down tasks into smaller chunks and use a timer to stay focused.\n* **Multitasking** - Concentrate on one task at a time and give it your full attention.\n* **Unnecessary interruptions** - Set specific times for checking emails and social media, and turn off notifications when you need to focus.\n* **Impulsive** decisions - Think twice before making a decision and consider the long-term consequences.\nBy being mindful of these time-wasting activities, you can reclaim your time and devote it to more productive pursuits.\n\n## Which Strategy Will Help YOUR Team Improve Productivity in the Workplace?\n\nImproving productivity is a challenge that most teams face in the workplace. But the strategy you should take to overcome it is not the same for everyone.\n\nIndeed, there are several ways to approach this challenge, depending on the specific needs of your team. For some, it may be beneficial to introduce new tools and technologies, while others may benefit from improving communication and collaboration.\n\nAnd let's not forget about creating a positive work environment that inspires creativity and fosters productivity. The key is identifying the most effective strategies for your team and taking action.\n\n**One solution that can work for all teams is utilizing a productivity app like [AFFiNE](https://affine.pro/).**\n\nIt's designed to help teams increase efficiency and collaboration. With the right tools, motivation, and guidance, your team can reach its full potential and improve productivity in the workplace.\n\n\n---\n\nAFFiNE is still in alpha, but we are continuing to build to a more feature-rich and stable build. Come and join us on our journey over on our media platforms.\n\n* Official Website: [https://affine.pro/](https://affine.pro/)\n* GitHub: [https://github.com/toeverything/AFFiNE](https://github.com/toeverything/AFFiNE)\n* Discord: [https://discord.gg/Arn7TqJBvG](https://discord.gg/Arn7TqJBvG)\n* Telegram: [https://t.me/affineworkos](https://t.me/affineworkos)\n",
  "publish": true
}