{
  "title": "Top 10 Best Free Online Sticky Notes Software & Tools of 2024",
  "authors": [
    "Yiyang Zhang"
  ],
  "tags": [
    "Content"
  ],
  "description": "Uncover the beauty embedded in the online sticky notes. Discover the 10 best free online sticky notes software to refresh your note-taking in 2024.",
  "created": 1704758400000,
  "updated": 1704758400000,
  "layout": "blog",
  "id": "9S57yXg6ldzuHTywm6HQo",
  "slug": "Top 10-best-free-online-sticky-notes-free-software-tools",
  "cover": null,
  "md": "---\n\ntitle: \"Top 10 Best Free Online Sticky Notes Software & Tools of 2024\"\n\nauthor: \"Yiyang Zhang\"\n\ntags: Content\n\nslug: Top 10-best-free-online-sticky-notes-free-software-tools\n\ndescription: \"Uncover the beauty embedded in the online sticky notes. Discover the 10 best free online sticky notes software to refresh your note-taking in 2024.\"\n\ncreated: 2024-01-09\n\nupdated: 2024-01-09\n\nlayout: blog\n\npublish: true\n\n---\n\nWelcome to the digital era where sticky notes are no longer confined to your desk or refrigerator! With the rise of online sticky note tools, you can now capture and organize your thoughts with just a few clicks. Whether you're a busy professional, a creative genius, or simply someone who loves jotting down ideas, these virtual sticky notes are here to revolutionize the way you stay organized and productive.\n\nIn this article, we will explore the top 10 best free online sticky notes software and tools of 2024. But before we dive into that exciting list, let's first understand what exactly an online sticky note tool is and what features you should look for when choosing one that suits your needs perfectly.\n\n# What is an Online Sticky Notes Tool?\n\nAn online sticky notes tool is a digital platform dedicated to the creation and management of virtual sticky notes. Similar to their physical counterparts, these digital notes serve as a convenient method for capturing and organizing ideas, reminders, tasks, or any other information users wish to track. The distinguishing feature of online sticky notes lies in their digital format, offering an organized and clutter-free workspace on computers or mobile devices. These tools often allow users to easily view and rearrange notes through simple drag-and-drop actions. Additionally, online sticky note tools frequently provide synchronization across multiple devices, ensuring accessibility and up-to-date information regardless of the user's location.\n\n# What Should You Look for in An Online Sticky Notes Tool?\n\nWhen selecting an online sticky notes tool, consider several key aspects to ensure it aligns with your preferences and enhances productivity:\n\n* **Ease of Use**: Prioritize tools that are intuitive and user-friendly, allowing you to quickly jot down thoughts without complications.\n* **Customization Options**: Look for tools that offer customization features to personalize the appearance and organization of your sticky notes, accommodating different user preferences.\n* **Collaboration Features**: Consider tools with real-time collaboration features, facilitating simultaneous editing and viewing for multiple users, and supporting collaborative work on shared projects or notes.\n* **Integration Capabilities**: Opt for tools that seamlessly integrate with other apps and platforms, enhancing productivity by syncing notes with cloud storage services or integrating with task management apps.\n* **Accessibility Across Devices**: Choose an online sticky notes tool that is available on various platforms, including desktop computers, smartphones, and tablets, ensuring accessibility anytime and anywhere.\nBy keeping these factors in mind when selecting an online sticky notes tool, you'll be well-equipped to find one that suits your needs perfectly.\n\n# Top 10 Best Free Online Sticky Notes Free Tools of 2024\n\nIn today's digital age, staying organized and keeping track of important information has never been easier thanks to online sticky notes tools. These convenient tools allow you to jot down quick reminders, make to-do lists, or simply keep your thoughts organized in a virtual space.\n\n### 1. [AFFiNE](https://affine.pro/)\n\nAFFiNE provides professionals with a unified platform that enables them to plan a knowledge base, collaborate with teammates, and develop content. This flexible tool empowers users to create their sticky notes and set their goals while staying in sync and building content with blocks. The limitless workspace stimulates user-driven innovation. AFFiNE offers safe data storage, open-source benefits, and collaborative functionality. With its user-friendly interface and powerful features, creating a sticky note becomes effortless.\n\n**Key features:**\n\n* **Dynamic Sticky Note Creation with Kanban Template**: AFFiNE's Kanban layout is divided into columns: 'Planned', 'Ongoing', and 'Complete'. Each task, represented by a coloured sticky note, moves through these stages. The colours denote different project categories, making it easy to identify tasks at a glance. It empowers users to manage evolving workloads efficiently. For group projects, it serves as an agile coach, promoting teamwork. You can also insert images effortlessly into your sticky notes for enhanced visual representation.\n暂时无法在飞书文档外展示此内容\n* **Robust Note-Taking with [Database](https://affine.pro/blog/best-project-planning-tools-software-for-teams-2023)**: AFFiNE integrates a powerful database with both Kanban and Table views. It enables users to transform sticky notes into dynamic tools. By using Kanban, users can easily track progress and prioritize tasks with editable properties. If you switch to the Table view, you will get a clear overview of the project. You can also locate specific entries or information within the database by using the keyword search feature. Additionally, you can easily organize and prioritize database lines with the intuitive drag-and-drop feature.\n* **Seamless Integration and Enhanced Organization**:  Effortlessly elevate your sticky notes with AFFiNE's dynamic page blocks, allowing you to incorporate diverse elements such as images, attachments, and databases. Cut directly from pages, these versatile blocks provide the freedom to rearrange and design your whiteboard with flexibility. Our innovative auto-connect feature simplifies the process of binding related blocks together without the need for manual line drawing, maintaining a cohesive and uninterrupted flow for your sticky notes.\n* **Centralized Communication & Collaboration**: You can easily share your notes with colleagues or friends, allowing for efficient teamwork and idea sharing in AFFiNE. Collaborate seamlessly with your team members regardless of their location or time zone. Share files, exchange ideas, and provide feedback in real-time through AFFiNE. With AFFiNE, everyone can contribute to the same set of notes in real-time.\n[图片]\n### 2. [CardBoard](https://cardboardit.com/digital-sticky-notes-online-whiteboard-platform/)\n\nCardBoard stands as an advanced online collaborative workspace solution, centering on virtual sticky note features that transcend the capabilities of basic post-it corkboard applications, particularly in the realms of complexity and convenience for team collaboration and remote meetings. Offering complete customization and seamless sharing capabilities, CardBoard facilitates real-time communication across digital whiteboards.\n\n**Key features:**\n\n* Text input and customization\n* Drag-and-drop Interface\n* Visual collaboration\n**Pros of CardBoard**\n\n* Collaborative workspace\n* Various templates\n* In-app communication\n**Cons of CardBoard**\n\n* Card size limitation\n* Card overlapping issue\n### 3. [Trello](https://affine.pro/blog/best-trello-alternatives-project-management)\n\nTrello is a widely used online project management tool that utilizes a card-based system for task organization. While not primarily an online sticky notes tool, Trello's card system functions similarly to digital sticky notes, making it a popular choice for managing projects and tasks collaboratively.\n\n**Key features:**\n\n* Card-Based system\n* Lists and boards\n* Collaboration and comments\n**Pros of Trello**\n\n* User-friendly interface\n* Adaptable to various project management styles and workflows\n* Offer integration with numerous third-party tools and services\n**Cons of Trello**\n\n* Limited complexity\n* Dependency on third-party integrations\n### 4. [Google Jamboard](https://workspace.google.com/products/jamboard/)\n\nGoogle Jamboard extends its accessibility through a web app and a mobile app, making its innovative features available to users across diverse platforms. The web and mobile applications empower users to engage in freeform writing or drawing on virtual jam boards, categorized into sessions and conveniently distributed as tabs. Furthermore, users can harness the power of Google's search capabilities, seamlessly insert images, and web pages, and collaborate on a jamboard directly through Google Meet, marking a convergence of functionality and convenience.\n\n**Key features:**\n\n* Digital drawing, writing, and collaboration on a touchscreen display\n* Real-time collaboration\n* Integration with Google Drive\n**Pros of Google Jamboard**\n\n* Enables effective collaboration and brainstorming sessions\n* Integrate with other Google productivity tools\n* Work on both the physical 55-inch display and through web and mobile apps for accessibility.\n**Cons of Google Jamboard**\n\n* The physical Jamboard device can be expensive for some organizations.\n* Learning curve\n### 5. [Canva](https://www.canva.com/pro/)\n\nCanva is a versatile graphic design platform that empowers users to create a variety of visual content, including presentations, posters, social media graphics, and more. While not inherently designed as an online sticky notes tool, Canva offers elements that can be adapted for collaborative and visual organization purposes.\n\nKey Features:\n\n* Drag-and-drop design\n* Offer a vast library of templates, graphics, and elements\n* Allow for collaborative design projects\n**Pros of Canva:**\n\n* An intuitive interface makes it accessible to users with varying design skills\n* Suitable for creating a wide range of visual content beyond sticky notes\n* Cloud-based\n**Cons of Canva:**\n\n* Limited sticky note functionality\n* The learning curve for advanced features\n### 6. [Stickies.io](https://stickies.io/)\n\nStickies.io permits the overlay of post-it notes, enabling the arrangement of similar or contextually relevant ideas. Elevating the collaborative experience further, this online whiteboard tool boasts an infinite canvas functionality, providing ample space for creative exploration. This innovative tool employs intelligent \"stickies,\" or digital notes, which adapt their color code based on the context, ensuring uniform formatting.\n\n**Key features:**\n\n* Incognito mode for sharing thoughts in private\n* One-click alignment of sticky notes\n* Collaboration feature\n**Pros of Stickies.io:**\n\n* Multiple sheets and organization\n* Stackable stickies\n* Infinite canvas function\n**Cons of Stickies.io:**\n\n* No mobile app\n* Do not offer integrations with other tools or platforms\n### 7. [Figma](https://affine.pro/blog/top-8-figma-competitors-alternatives-design-prototyping)\n\nFigma is primarily recognized as a collaborative design and prototyping tool rather than an online sticky notes tool. It is widely used for interface design, user experience (UX) design, and user interface (UI) design. While Figma does offer features for collaborative work, real-time editing, and comment, its core functionality is centered around designing and prototyping digital interfaces.\n\n**Key Features of Figma:**\n\n* Support real-time collaboration for design and prototyping.\n* Cloud-based Storage\n* Enable the creation of interactive prototypes for user testing.\n**Pros of Figma**\n\n* Seamless Collaboration: Facilitates collaboration among team members in real-time.\n* Cross-Platform Compatibility: Works on various operating systems, including Windows, macOS, and Linux.\n* Version History: Keeps a comprehensive version history for design iterations.\nCons of Figma\n* Beginners might find the interface initially complex.\n* Limited Offline Functionality:\n1. Miro\n[图片]\nMiro is a versatile online collaborative platform that is often used for visual collaboration, including tasks like brainstorming, ideation, and creating virtual sticky notes. While it offers a broad range of features beyond sticky notes, its sticky note functionality is a notable aspect of its collaborative toolkit.\nKey Features of Miro:\n* Provide a digital canvas for collaborative work.\n* Real-time collaboration.\n* Offer a variety of templates for different use cases and integrate with other popular tools.\nPros of Miro\n* Support a wide range of visual collaboration activities\n* Intuitive interface that is easy for users to navigate.\n* Cross-platform compatibility\nCons of Miro\n* The pricing structure may be considered a bit steep for some users\n* Offline mode limitations\n1. Pinup\n[图片]\nPinup presents itself as a complimentary online solution for virtual sticky notes, skillfully emulating the tactile essence of real paper notes pinned to a corkboard. The virtual sticky notes board seamlessly integrates into your browser, eliminating the need for downloads or installations, and boasts a user-friendly interface.\nKey features:\n* Realistic sticky note feel\n* Browser-based with no need for downloads or installations\n* Offer customization and color-coding features for personalized quick notes\nPros of Pinup\n* Each canvas has a unique code and URL for easy access\n* Allow file import from the computer or Dropbox\n* Group Chat Feature\nCons of Pinup\n* Limited features beyond notes\n* No integration options\n1. Linoit\n[图片]\nLinoit is an online collaborative platform that allows users to create and share digital bulletin boards, which can be populated with various multimedia elements, including virtual sticky notes, images, and videos. It provides a virtual space for users to collaborate, brainstorm, and organize information.\nKey features:\n* Straightforward to-do lists and reminders.\n* A dynamic discussion board suitable for friends, families, and educational institutions.\n* Multimedia integration\nPros of Linoit\n* User-Friendly Interface: Linoit features an intuitive interface that is easy for users to navigate.\n* Suitable for a range of collaborative activities, from project planning to creative brainstorming.\n* Accessible through web browsers\nCons of Linoit\n* Learning curve\n* Dependency on the internet\nEach of these tools offers unique features that cater to different preferences and workflows when it comes to organizing tasks digitally. Remember – finding the right online sticky notes tool ultimately depends on your personal preferences and specific needs. Take some time to explore these options and see\n\nTry AFFiNE as Your Notes Tool\n\nIf you need a reliable and feature-rich online sticky notes tool, look no further than AFFiNE. This powerful software offers everything you could want in a note-taking application. With AFFiNE, you can create colorful and customizable sticky notes that will help keep your thoughts organized and easily accessible. Whether it's jotting down reminders, brainstorming ideas, or simply keeping track of important information, AFFiNE has got you covered.\n[图片]\nSo why wait? Give AFFiNE a try today and revolutionize the way you take notes online. With its ease of use, collaborative features, and extensive customization options - this is one online sticky notes tool that won't disappoint! Commence improving your plans by using AFFiNE's user-friendly tool. Presently, AFFiNE has launched its Stable Version, with ongoing efforts to develop a more comprehensive and dependable iteration. Join us on our voyage through our social media channels and be part of the experience. Come and join us on our journey over on our media platforms. 🚀\n\n* Official Website: [https://affine.pro/](https://affine.pro/)\n* GitHub: [https://github.com/toeverything/AFFiNE](https://github.com/toeverything/AFFiNE)\n* Discord: [https://discord.gg/Arn7TqJBvG](https://discord.gg/Arn7TqJBvG)\n* Twitter: [https://twitter.com/AffineOfficial](https://twitter.com/AffineOfficial)\n",
  "publish": true
}