{
  "title": "Top 8 Figma Competitors and Alternatives for Design and Prototyping [Free & Paid]",
  "authors": [
    "Xuan Pang"
  ],
  "tags": [
    "Content"
  ],
  "description": "Explore the best Figma competitors and alternatives for design and prototyping, both free and paid options. Find the perfect tool for your needs.",
  "created": 1701043200000,
  "updated": 1701043200000,
  "layout": "blog",
  "id": "o8NOfJmsD47Bn7NiInBuW",
  "slug": "top-8-figma-competitors-alternatives-design-prototyping",
  "cover": "https://app.affine.pro/api/workspaces/qf73AF6vzWphbTJdN7KiX/blobs/RjGD8kU8Nztd9tQv4E9BXnALTj_o6Iw1nztpCtLJV0U=.webp",
  "md": "---\n\ntitle: \"Top 8 Figma Competitors and Alternatives for Design and Prototyping [Free & Paid]\"\n\nauthor: Xuan Pang\n\ntags: Content\n\nslug: top-8-figma-competitors-alternatives-design-prototyping\n\ndescription: \"Explore the best Figma competitors and alternatives for design and prototyping, both free and paid options. Find the perfect tool for your needs.\"\n\ncreated: 2023-11-27\n\nupdated: 2023-11-27\n\nlayout: blog\n\npublish: true\n\n---\n\n**Figma** is renowned in the design world for its collaborative features, realistic prototyping, and vector graphics capabilities, streamlining the co-creation process and saving valuable time. üé®üíª\n\nHowever, it's not the only player in town, and **it may not suit everyone's needs due to its complexity or pricing**. If you're in search of a Figma alternative, this article presents the top 8 options, evaluates their key features, and assists you in finding the ideal solution for your design workflows. üèÜüîç\n\n## **What Is Figma and How Does Collaborative Design Work?**\n\nFigma is a cloud-based design tool known for its strong focus on collaboration. It allows multiple users to work on design projects in real-time, making it ideal for remote teams. Users can edit design files simultaneously, leave comments for feedback, access version history, and control permissions, all within the platform. üé®üíª\n\n\n![RjGD8kU8Nztd9tQv4E9BXnALTj_o6Iw1nztpCtLJV0U=](https://app.affine.pro/api/workspaces/qf73AF6vzWphbTJdN7KiX/blobs/RjGD8kU8Nztd9tQv4E9BXnALTj_o6Iw1nztpCtLJV0U=.webp)\n\nIn a nutshell, Figma's collaborative design features simplify and streamline the process of working together on design projects, whether you're in the same room or on opposite sides of the world. ü§ùüåé\n\n### **What features to look for in Figma alternatives?**\n\n\n![21OjnYC5dEGj8hhhrJoPPpFsBe42YArkJ44TuxH0jm8=](https://app.affine.pro/api/workspaces/qf73AF6vzWphbTJdN7KiX/blobs/21OjnYC5dEGj8hhhrJoPPpFsBe42YArkJ44TuxH0jm8=.webp)\n\n1. **Collaboration Capabilities**: The platform should facilitate digital whiteboards, note-taking, real-time editing, and comments to ensure seamless collaboration, keeping your team well-informed about even the smallest design updates. ü§ù‚úçÔ∏è\n1. **Diverse Templates**: It should provide a range of ready-made templates for various design purposes, such as graphic design, portfolio creation, brand guideline development, design review, and logo customization. üìãüñåÔ∏èEffective Project Management: The tool should empower you to organize your projects with task division, assignees, deadlines, priority settings, progress tracking, and timely deliveries, ensuring smooth project management. üìÖüìà\n1. **Tailored Design Capabilities**: The platform should provide robust features for crafting unique designs that align with your company's objectives and client requirements, allowing for customization. üé®üîß\n1. **Design-Centric User Interface**: A Figma alternative should feature a user-friendly interface with drag-and-drop functionality for quick design integration, affinity designer tools, and collaboration features to connect teams across different domains. üñ•Ô∏èüí¨\n### Top 8 Figma Competitors and Alternatives\n\n##### 1. [AFFiNE](https://affine.pro/)\n\nAFFiNE is an all-in-one app that provides a comprehensive suite of services including mind maps, whiteboard functionality, kanban boards, and more. This versatile tool is designed to facilitate effective memorization and cognitive improvement by offering a range of features that enhance your thinking processes. Whether you're organizing ideas, visualizing concepts, or structuring information, AFFiNE empowers you to optimize your thought processes and boost memory retention.\n\nüöÄ **Here are some of the brilliant features that AFFiNE offers:** üåü\n\n* **Seamless Drawing and Collaboration**: With AFFiNE Cloud, unleash your creativity with powerful drawing and sketching tools. Work in real-time on multiple devices and effortlessly collaborate with friends or colleagues. Share your workspace and bring your ideas to life with ease.\n\n![geVdzkEXxJy55-tagrtTlTRCSJjFXK03lLprTpvrv5M=](https://app.affine.pro/api/workspaces/qf73AF6vzWphbTJdN7KiX/blobs/geVdzkEXxJy55-tagrtTlTRCSJjFXK03lLprTpvrv5M=.webp)\n\n* **Simplified Flowcharts and Mind Maps**: With a single click, this feature allows shapes to automatically extend from one another, saving you time and energy and making the process more convenient.\n\n![q1kRb852K7CyMTlg9CXig9gOklaMKSlob1bGxmyH11k=](https://app.affine.pro/api/workspaces/qf73AF6vzWphbTJdN7KiX/blobs/q1kRb852K7CyMTlg9CXig9gOklaMKSlob1bGxmyH11k=.webp)\n\n* **Local first approach**: One of the key strengths of AFFiNE is its support for offline working. This means you can create and work on your workflows at any time, even when you don't have an internet connection. In this way, you can manage your time more convenient. Additionally, AFFiNE prioritizes data security, keeping your information safe and private. You can download the **[stable version](https://affine.pro/download)** and give it a shot.\n##### 2. [InVision](https://www.invisionapp.com/)\n\n\n![vF0Bni3ce5DuTuohg_0ohUIwEv2oSSwCsVxVCtfFP08=](https://app.affine.pro/api/workspaces/qf73AF6vzWphbTJdN7KiX/blobs/vF0Bni3ce5DuTuohg_0ohUIwEv2oSSwCsVxVCtfFP08=.webp)\n\nInVision acts as an all-encompassing hub for design teams, promoting collaboration among designers, product managers, engineers, marketers, clients, and stakeholders. Established in 2011 and headquartered in New York, InVision provides features like live presentations, design communication, version control, and synchronization.\n\n**Noteworthy Features:**\n\n* **Design Sharing and Presentation**: It allows you to share your designs with others and conduct presentations to collect valuable feedback and insights.\n* **Design Prototyping**: Create interactive prototypes that mimic user interactions effectively.\n* **Design Project Management:** Streamline the management of your design projects, allowing you to monitor tasks, timelines, and collaborations efficiently.\n##### 3. [Adobe XD](https://adobexdplatform.com/)\n\nAdobe XD serves as a versatile design and prototyping tool, allowing users to simulate user interactions with their designs. It offers the flexibility to modify objects as needed and incorporate elements like animations, voice interactions, and transitions. Once designs are finalized and approved, they can be readily published for further development. Adobe XD functions seamlessly on macOS and Windows, even in offline mode.\n\nKey Features:\n\n* **Effortless Creative Cloud Integration**: Users enjoy easy access to Adobe Photoshop files and a wide array of creative resources. Adobe XD simplifies the creation of intricate designs with its comprehensive feature set.\n* **Three-Dimensional Object Transformations**: The tool empowers users to manipulate objects in three dimensions, enhancing the development of complex designs and enabling smoother transitions between artboards.\n* **Dynamic Animations and Transition Design**: By utilizing the auto-animate feature, users can quickly transform static designs into functional prototypes with a realistic touch. It also supports the creation of micro-interactions using triggers and actions like tapping, dragging, hovering, and more.\n##### 4. [UXPin](https://www.uxpin.com/)\n\n\n![680nBk1wdR4oAtr_3NQpqxR-5V_YvgkYvkmrJ4DmuoI=](https://app.affine.pro/api/workspaces/qf73AF6vzWphbTJdN7KiX/blobs/680nBk1wdR4oAtr_3NQpqxR-5V_YvgkYvkmrJ4DmuoI=.webp)\n\nUXPin is a cost-effective graphic design software with a focus on drawing and vector graphics. It offers a comprehensive set of tools for creating logos, illustrations, icons, and various graphic elements. Being free and open-source, it's an appealing choice for designers who want high-quality graphics without a hefty financial commitment.\n\nKey Features:\n\n* **Affordability**: UXPin's open-source nature makes it a budget-friendly option for designers looking to create top-notch graphics without breaking the bank.\n* **Versatile Design Capabilities**: The platform provides a rich toolkit suitable for designing logos, illustrations, icons, and other graphical components.\n* **User-Friendly Interface**: UXPin offers an intuitive and easy-to-navigate interface. Regular updates keep the software aligned with the latest graphic design trends.\n##### 5. Moqups\n\n\n![xlMQJohn2ROaoDJ3ZWOtVlD3KhfiHC08z7qd4LTNT6w=](https://app.affine.pro/api/workspaces/qf73AF6vzWphbTJdN7KiX/blobs/xlMQJohn2ROaoDJ3ZWOtVlD3KhfiHC08z7qd4LTNT6w=.webp)\n\nMoqups is a cloud-based visual collaboration platform designed to facilitate prototype creation and testing for websites and applications. It empowers teams to collaborate on sketches, blueprints, and mock-ups using its interactive whiteboard. Additionally, its versatile drawing tools enable designers to craft sitemaps, storyboards, and charts seamlessly, facilitating smooth transitions between various design elements.\n\n**Key Features:**\n\n* **Wireframing and Prototyping**: Moqups provides a versatile set of tools for creating wireframes and interactive prototypes. Users can easily design and test the functionality and user experience of their web and mobile applications.\n* **Collaborative Workspaces**: Moqups offers collaborative workspaces where multiple team members can work together in real time. This feature is especially valuable for remote or distributed teams, enabling seamless cooperation on design projects.\n* **Library of Templates and Assets**: Moqups comes with an extensive library of pre-designed templates and UI elements, making it easier for users to create professional-looking wireframes and prototypes. This library includes common design components like buttons, icons, and forms, saving designers time and effort in the design process.\n##### 6. [ClickUp](https://clickup.com/)\n\n\n![1yKIgqBw9WXrac9_ECD5k7pvRoH2UdURoQx6KayezAU=](https://app.affine.pro/api/workspaces/qf73AF6vzWphbTJdN7KiX/blobs/1yKIgqBw9WXrac9_ECD5k7pvRoH2UdURoQx6KayezAU=.webp)\n\nManage multiple workflows, collaborate more effectively, and streamline your work into one place with ClickUp ‚Äì a free project management solution for teams. Whether you're new to project management apps or a seasoned user, ClickUp's customizable features can adapt to any team size. Plus, stay on top of your projects while on the go with the ClickUp mobile app.\n\n**Key features:**\n\n* **Customization without code or add-ons:** ClickUp offers a highly customizable workspace where you can tailor your tasks, workflows, and views to suit your specific needs.\n* **Collaboration capabilities:** ClickUp excels in fostering collaboration among team members. It provides features like task assignments, commenting, and file sharing, ensuring that your team can work together seamlessly no matter where they are located.\n* **Real-time reporting**: With ClickUp, you can access real-time reporting and analytics that give you insights into your projects and team's performance. Monitor progress, track key metrics, and make data-driven decisions to optimize your workflow.\n##### 7. [Miro](https://miro.com/)\n\n\n![mjm8K6XuY-jJV6XcgjoXXJMvd2b1cKhCL-25ZalaM8Q=](https://app.affine.pro/api/workspaces/qf73AF6vzWphbTJdN7KiX/blobs/mjm8K6XuY-jJV6XcgjoXXJMvd2b1cKhCL-25ZalaM8Q=.webp)\n\nMiro is an online workspace and collaborative platform that offers a collaborative whiteboard app for effortless teamwork. It has been a trusted tool in this space for years, with an increasing range of integrations and features that people love. Whether you're in a hybrid or remote team focused on UX design or sales departments that need visual task monitoring, Miro can meet your needs. With video chat and whiteboard capabilities, team meetings become less necessary.\n\n**Key features:**\n\n* **Collaborative Whiteboarding**: Miro provides a digital canvas where teams can collaborate in real-time, just like a physical whiteboard. Multiple users can brainstorm, draw diagrams, create flowcharts, and work together seamlessly, regardless of their physical location.\n* **Agile Framework Support:** Miro is designed to support agile methodologies and frameworks. Teams can use it for sprint planning, retrospectives, and visualizing agile processes like Scrum or Kanban. It offers templates and features tailored to agile workflows, making it a valuable tool for Agile teams.\n* **Integration Ecosystem**: Miro boasts a robust integration ecosystem that allows you to connect it with a wide range of other tools and platforms. Whether it's integrating with project management software, productivity apps, or cloud storage solutions, Miro ensures that it fits seamlessly into your existing workflow.\n##### 8. [Framer](https://www.framer.com/)\n\n\n![-zxFwsDRetTBKh6pIOHBzeegN0TQTHTGRHAd_uUOkEE=](https://app.affine.pro/api/workspaces/qf73AF6vzWphbTJdN7KiX/blobs/-zxFwsDRetTBKh6pIOHBzeegN0TQTHTGRHAd_uUOkEE=.webp)\n\nFramer is a versatile tool tailored for crafting interactive prototypes of websites and apps, setting itself apart from traditional design software by seamlessly blending design and coding. It empowers designers to create custom designs using JavaScript and React.\n\n**Key Features:**\n\n* **Robust Hosting**: Framer employs secure servers backed by stringent physical and network security protocols, ensuring your data's integrity through continuous monitoring.\n* **Access Control**: You have complete control over project access and editing permissions in Framer. Choose from private, selective sharing, or public visibility to safeguard your work.\n* **Dynamic Data Visualizations**: Framer's capabilities extend to designing dynamic data visualizations, including a wide range of charts, graphs, and maps. For example, you can use Framer to create interactive data visualizations to showcase survey results effectively.\nThis comprehensive list presents you with the top 8 Figma competitors and alternatives, encompassing both free and paid solutions. Whether you're in search of a budget-friendly option or require specific features, we highly recommend considering AFFiNE  as an alternative. Currently, AFFiNE has released its stable version, but we are continuing to build to a more feature-rich and stable build. Come and join us on our journey over on our media platforms.\n\n\n![iAkxI4vjnArhF6y4orPOS0piuCYS-KQkmSdCyYVIsJQ=](https://app.affine.pro/api/workspaces/qf73AF6vzWphbTJdN7KiX/blobs/iAkxI4vjnArhF6y4orPOS0piuCYS-KQkmSdCyYVIsJQ=.webp)\n\n* Official Website: [https://affine.pro/](https://affine.pro/)\n* GitHub: [https://github.com/toeverything/AFFiNE](https://github.com/toeverything/AFFiNE)\n* Discord: [https://discord.gg/Arn7TqJBvG](https://discord.gg/Arn7TqJBvG)\n* Twitter: [https://twitter.com/AffineOfficial](https://twitter.com/AffineOfficial)\n",
  "publish": true
}