{
  "title": "Top 8 Microsoft Visio Alternatives & Competitors of 2023",
  "authors": [
    "Yiyang Zhang"
  ],
  "tags": [
    "Content"
  ],
  "description": "Discover the top 8 diagramming software options for 2023. Find alternatives to Microsoft Visio and explore features, pricing, and more.",
  "created": 1695254400000,
  "updated": 1695254400000,
  "layout": "blog",
  "id": "z3nwYhJsAc",
  "slug": "top-8-microsoft-visio-alternatives-competitors-2023",
  "cover": "https://insider.affine.pro/api/workspaces/qf73AF6vzWphbTJdN7KiX/blobs/HK4noT2qDR1U6-B2l3RdaaWZClmc9wk5QmFkul6Yp_k=.webp",
  "md": "---\n\ntitle: \"Top 8 Microsoft Visio Alternatives & Competitors of 2023\"\n\nauthor: Yiyang Zhang\n\ntags: Content\n\nslug: top-8-microsoft-visio-alternatives-competitors-2023\n\ndescription: \"Discover the top 8 diagramming software options for 2023. Find alternatives to Microsoft Visio and explore features, pricing, and more.\"\n\ncreated: 2023-09-21\n\nupdated: 2023-09-21\n\nlayout: blog\n\npublish: true\n\n---\n\nBeing productive is crucial in today's constantly advancing technological world. Professionals in various industries have preferred Microsoft Visio as their tool of choice for visualizing and organizing complex information. However, with changing demands and advancements in technology, it's important to explore alternative options that can provide similar functionality while catering to your specific needs with unique features.\n\n\n![HK4noT2qDR1U6-B2l3RdaaWZClmc9wk5QmFkul6Yp_k=](https://insider.affine.pro/api/workspaces/qf73AF6vzWphbTJdN7KiX/blobs/HK4noT2qDR1U6-B2l3RdaaWZClmc9wk5QmFkul6Yp_k=)\n\nGet ready to discover the tools that will take your diagram-creating skills to new heights! In this article, we will explore the top eight alternatives to Microsoft Visio that can revolutionize the way you create diagrams in 2023. Whether you're an expert in business or a creative thinker, there are numerous options available that can enhance your productivity. So, are you ready to embrace innovation and discover new possibilities to elevate your efficiency?\n\n### What is Microsoft Visio?\n\nMicrosoft Visio is a powerful diagramming and vector graphics tool that allows users to create professional-level visuals for various purposes. It provides a wide range of templates, shapes, and tools that make it easy to design flowcharts, organizational charts, network diagrams, floor plans, and more. With its intuitive interface and extensive features, Microsoft Visio has become the go-to software for businesses and individuals alike. However, it's challenging enough to set up that it's best suited for bigger businesses with the IT resources to handle the process.\n\n**Pros and Cons of Microsoft Visio**\n\n\n![tExUJsnwZJajJ_RoZ_UB9r0EFnQtiFq4Iwa1O3VOVRY=](https://insider.affine.pro/api/workspaces/qf73AF6vzWphbTJdN7KiX/blobs/tExUJsnwZJajJ_RoZ_UB9r0EFnQtiFq4Iwa1O3VOVRY=)\n\n* **Pros**\n  * **Versatility**. Whether you need to map out complex processes or simply visualize ideas in a clear and concise manner, Visio offers the flexibility to meet your specific needs. Its drag-and-drop functionality makes it incredibly user-friendly.\n  * **Integration with other Microsoft Office applications**. This seamless integration enables users to easily import data from these programs into their diagrams or export their diagrams for use in other documents.\n  * Collaboration capabilities. Through cloud-based storage solutions like OneDrive, multiple team members can work on the same diagram simultaneously, making collaboration efficient and reducing version control issues.\n* **Cons**\n  * **Confusing purchasing process**. Microsoft Visio price plans might be a little bit complex since it provides several different plans, and you can also get the program from Office 365.\n  * **Not available on Mac, Linux, or as a web app**. Lagging may occur when building diagrams in the web app.\n* **Pricing**: Online Plan 1 ($5 per user per month) & Online Plan2 ($14.96 per user per month)\n### What should You Look for in Microsoft Visio Alternatives?\n\n\n![YZjEkBiKpBgfDpdCoQq40qAWXAx2E2S4TpOCqanmuvY=](https://insider.affine.pro/api/workspaces/qf73AF6vzWphbTJdN7KiX/blobs/YZjEkBiKpBgfDpdCoQq40qAWXAx2E2S4TpOCqanmuvY=)\n\n* Compatibility. Make sure the alternative software you choose can seamlessly integrate with your existing tools and systems.\n* Ease of use. The whole point of using an alternative is to simplify your workflow, so it's essential that the software offers an intuitive interface and user-friendly features.\n* Collaboration capabilities. Look for alternatives that allow multiple users to work on diagrams simultaneously and provide easy sharing options.\n* Customizability. You may have specific diagramming needs or industry requirements, so finding a solution that allows customization will greatly benefit you.\n* Cost-effectiveness. Compare pricing plans and evaluate which option offers the best value for money without compromising functionality.\nBy carefully assessing these factors when exploring Microsoft Visio alternatives, you'll be able to find a suitable solution that meets all your diagramming needs while boosting collaboration and efficiency in your workflow.\n\n### Best 8 Microsoft Visio Alternatives for 2023\n\nLooking for the best Microsoft Visio alternatives to boost your productivity in 2023? Look no further! We've compiled a list of the top 8 alternatives that will help you create stunning diagrams, flowcharts, and organizational charts with ease.\n\n1.**[AFFiNE](https://affine.pro/)**\n\n\n![o7LQRbUwYfnNmBFLgNwkmK0c5fcLOepmeRh7iN4Gcwk=](https://insider.affine.pro/api/workspaces/qf73AF6vzWphbTJdN7KiX/blobs/o7LQRbUwYfnNmBFLgNwkmK0c5fcLOepmeRh7iN4Gcwk=)\n\n\n\nAFFiNE is the next-gen knowledge base for professionals that brings planning, sorting, and creating together. It comes with an edgeless mode and a rich toolbar, whose conversion converts doc files to whiteboard. The data modified by users on the whiteboard can be synchronized after conversion to docs, enabling freer editing and writing. Without switching different tools, you can create flowcharts, mindmaps, and inventory. What sets AFFiNE apart is that it is a free and open-source program that employs offline technology to ensure it is accessible to all users.\n\n**Key features of AFFiNE:**\n\n* Properties Editing: To enhance your interaction, we've introduced a dedicated panel for Kanban editing. Here, you have the freedom to edit properties at your convenience, enriching your Kanban experience.\n\n![PrWKlqwLbz13lYnPPyIU4acy6ukqZ4X4ZFMVonMmSO8=](https://insider.affine.pro/api/workspaces/qf73AF6vzWphbTJdN7KiX/blobs/PrWKlqwLbz13lYnPPyIU4acy6ukqZ4X4ZFMVonMmSO8=)\n\n* Unparalleled customization: Now, you can classify based on almost any property, allowing for personalized categorization that aligns perfectly with your needs.\n\n![UQ37RBZanYmZt_xalHX36RiT4YeUrGDNNQNtrNbC-zs=](https://insider.affine.pro/api/workspaces/qf73AF6vzWphbTJdN7KiX/blobs/UQ37RBZanYmZt_xalHX36RiT4YeUrGDNNQNtrNbC-zs=)\n\n* Intuitive Drag-and-Drop Sorting: By simply dragging and dropping to the desired spot, you have the flexibility to move entire columns or individual Kanban cards to your preferred locations effortlessly.\n\n![zwXUytnIiLZIAPLE1ujUVUFmHqngYjhG1Y0eaIXSS4g=](https://insider.affine.pro/api/workspaces/qf73AF6vzWphbTJdN7KiX/blobs/zwXUytnIiLZIAPLE1ujUVUFmHqngYjhG1Y0eaIXSS4g=)\n\n* AFFiNE Cloud: With AFFiNE Cloud, you can invite your family and friends to collaborate in real-time within a shared workspace. This feature makes your habit of tracking work smoother and more efficient.\n\n![7sC9sHff3sHGQBmTEKzUZGo-t0-4fs92M2IM3GSiPkQ=](https://insider.affine.pro/api/workspaces/qf73AF6vzWphbTJdN7KiX/blobs/7sC9sHff3sHGQBmTEKzUZGo-t0-4fs92M2IM3GSiPkQ=)\n\n* Edgeless Mode: Our exciting Edgeless Mode, including a redesigned toolbar, eraser, connector, blockslicer, integrated canvas text and copy as PNG, etc. Get ready to unlock new levels of productivity and immerse yourself in a seamless and efficient workflow.\n\n![q1kRb852K7CyMTlg9CXig9gOklaMKSlob1bGxmyH11k=](https://insider.affine.pro/api/workspaces/qf73AF6vzWphbTJdN7KiX/blobs/q1kRb852K7CyMTlg9CXig9gOklaMKSlob1bGxmyH11k=)\n\nPrice: community free forever.\n\n2.**[Lucidchart](https://www.lucidchart.com/pages/)**\n\n\n![2OcBEcPtKFwIN0zpps1Da1Tdj5eYu38C4RfnhzfIno4=](https://insider.affine.pro/api/workspaces/qf73AF6vzWphbTJdN7KiX/blobs/2OcBEcPtKFwIN0zpps1Da1Tdj5eYu38C4RfnhzfIno4=)\n\nLucidchart is an intelligent diagramming application that empowers teams to clarify complexity, align their insights, and build the futureâ€”faster. With its intuitive interface and extensive template library, Lucidchart is a popular choice among professionals. It offers collaboration features and seamless integration with other tools like Google Drive.\n\nKey features:\n\n* Intelligent diagramming\n* 1,000+ templates\n* Ability to share outside of Google Docs\nPros of Lucidchart\n\n* Intuitive user interface\n* Smooth performance on all tested platforms\n* Adequate shapes and templates\nCons of Lucidchart\n\n* No desktop apps\n* Quite limiting free account\n* Mobile apps don't have an offline mode\nPricing: $4.95 per month for basic plan; $9.95 per month for pro plan\n\n3.**[SmartDraw](https://www.smartdraw.com/)**\n\n\n![ketDWKTPYe3ASxOAV0IZ1bqKkS7AmUnuKuWjIqIAT7s=](https://insider.affine.pro/api/workspaces/qf73AF6vzWphbTJdN7KiX/blobs/ketDWKTPYe3ASxOAV0IZ1bqKkS7AmUnuKuWjIqIAT7s=)\n\nSmartDraw is a powerful flowchart software tool for businesses that need to make a lot of visual assets. Aside from flowcharts and schematics, SmartDraw has powerful customization and collaboration options, so drafting these designs is a breeze. SmartDraw stands out for its vast selection of pre-made templates and automated diagramming capabilities. It also supports cloud storage and has robust sharing options.\n\nKey features:\n\n* Huge selection of templates and objects\n* Helpful Smart Panel feature\n* Create diagrams straight from data with built-in extensions\nPros of SmartDraw\n\n* Good integration options\n* Easy to use\n* The powerful engine allows for professional charts and diagrams\nCons of SmartDraw\n\n* Weak collaboration features.\n* Expensive.\n* Can't export to Visio format.\nPricing: $9.95/month after a free trial\n\n4.**[Draw.io](https://www.drawio.com/)**\n\n\n![yFweQQEmqC_LKCvZMMS873C5tDv7mSkJTxCdCMRk7vE=](https://insider.affine.pro/api/workspaces/qf73AF6vzWphbTJdN7KiX/blobs/yFweQQEmqC_LKCvZMMS873C5tDv7mSkJTxCdCMRk7vE=)\n\nDraw.io can be used instantly to build charts since it's online (though it can be used offline as well). With drag-and-drop functionality, a library of shapes, plenty of templates, importing/exporting a variety of formats, and more, it's easy to get started and start creating at any time.\n\nKey features:\n\n* Intuitive interface with drag-and-drop functionality.\n* Allows track and restore changes.\n* Support various formats for import and export.\nPros of Draw.io\n\n* No login is required, free\n* Speed & simple\n* Excellent real-time collaboration support is included when connected to a Google account\nCons of Draw.io\n\n* Collection of templates and unimpressive shapes.\n* Less professional\n* Importing from other file types was unsuccessful in testing.\nPricing: Free\n\n5.**[Cacoo](https://nulab.com/cacoo/)**\n\n\n![m9vYBTj8s0HM9IlXSoBzoOAvmEnUDTEq12Uatz-e3KY=](https://insider.affine.pro/api/workspaces/qf73AF6vzWphbTJdN7KiX/blobs/m9vYBTj8s0HM9IlXSoBzoOAvmEnUDTEq12Uatz-e3KY=)\n\nCacoo is an online diagramming tool that allows you to collaborate on wireframes, flowcharts, and more. With easy sharing links and embed links, you can edit, track changes, and collaborate on flowcharts you designed and updated. With Cacoo, you can organize team assets, save work directly, monitor project status with activity notifications, and more.\n\nKey features:\n\n* Multiple people can edit diagrams at the same time.\n* Support chat, comment, or video chat inside the tool.\n* It has hundreds of templates to get you started.\nPros of Cacoo\n\n* Smart and modern charts\n* A wide range of cloud services\n* Team management keeps charts organized at the team level\nCons of Cacoo\n\n* Learning curve\n* Not enough integrations\nPricing: $6 per user per month\n\n6.**[Creately](https://creately.com/)**\n\n\n![pjSCg9_WhN-7OZblPHyLl_P6gEJ4dXbCccQbOj-jg_c=](https://insider.affine.pro/api/workspaces/qf73AF6vzWphbTJdN7KiX/blobs/pjSCg9_WhN-7OZblPHyLl_P6gEJ4dXbCccQbOj-jg_c=)\n\nCreately is a data-connected visual workspace where you can plan and brainstorm new projects. The software is built to help you make flowcharts quickly and easily. Creately boasts an extensive library of shapes, icons, and templates that cater to various industries' needs. Its advanced diagramming features make it suitable for both professionals and students alike.\n\nKey features:\n\n* Huge library of shapes. Allow choose the shape from Icon Finder or Google.\n* Automatically pick the right connector.\n* Create complex shapes from the written text.\nPros of Creatly\n\n* Support real-time collaboration.\n* Offer Web and desktop apps.\nCons of Creatly\n\n* Limited template selection.\n* Canceling or changing an account requires an email to the company.\nPricing: $5 per month for individual; Team plans are based on the team size\n\n7.[Gliffy](https://www.gliffy.com/)\n\n\n![MX3r0f8CK6D8teLMqrzHIN8hznvtyO-qwNENL-0qK44=](https://insider.affine.pro/api/workspaces/qf73AF6vzWphbTJdN7KiX/blobs/MX3r0f8CK6D8teLMqrzHIN8hznvtyO-qwNENL-0qK44=)\n\nGliffy is a great choice for teams in need of a reliable and integrated diagramming tool on Confluence. With its intuitive user interface, plenty of ready-to-use components, and automatic updating of diagrams, there's no need to worry about having an outdated image - you'll always have the latest version. As if that weren't enough, Gliffy has Cloud Fortified certification, over 18 million users, and a long pedigree within Atlassian's products.\n\nKey features:\n\n* Links and syncs diagrams\n* Real-Time collaboration in Confluence cloud\n* Advanced security and access management features\nPros of Gliffy\n\n* Simple and easy to use\n* Wide range of shapes, symbols, and templates designed for flowchart\n* Support collaboration\nCons of Gliffy\n\n* Occasional lags and errors when you work with a large diagram\n* No option to export selected areas directly as PNG or JPEG\nPricing: Professional (1-9 users): $10/month per user; Professional (0-50 users): $8/month per user\n\n8.**[Miro](https://miro.com/)**\n\n\n![yqGbxR5Lpay-KancTPQDMXE8Kafc0wcJBADdMdtEJtI=](https://insider.affine.pro/api/workspaces/qf73AF6vzWphbTJdN7KiX/blobs/yqGbxR5Lpay-KancTPQDMXE8Kafc0wcJBADdMdtEJtI=)\n\nMiro embraces more than 1,000 templates, including mind maps, Kanban boards, Gantt charts, product wireframes, research boards, and flowcharts. Miro provides an online collaborative platform where teams can brainstorm ideas, map workflows, and design prototypes all in one place.Â This versatile tool combines whiteboarding, collaboration, and project management functionalities, taking visual communication to new heights.\n\nKey features:\n\n* Provide real-time collaborative drawing\n* Built-in comments, video, chat, and seamless communication\n* Unlimited team workspaces with granular permissions, privacy & sharing controls\nPros of Miro\n\n* Easy to build smart-looking flowcharts and mind maps\n* Simple to collaborate with teammates\n* Intuitive UI\nCons of Miro\n\n* Hard to import or export content from time to time\n* Difficult to navigate large accounts\nPricing: $8/month per user for starter; $16/month per user for business\n\n### Unravel Your Productivity with Microsoft Visio Alternative\n\nSo why limit yourself to just one option when there are so many incredible Microsoft Visio alternatives available? Unleash your creativity and enhance your productivity by exploring new possibilities beyond traditional boundaries. With the right alternative at hand- **AFFiNE**- you'll discover new levels of efficiency and excellence in your work.\n\n",
  "publish": true
}