{
  "title": "Top 25 AI Art Prompts Ideas to Spark Your Creativity",
  "authors": [
    "Yiyang Zhang"
  ],
  "tags": [
    "Content"
  ],
  "description": "Ignite your creativity with our 25 AI art prompts ideas with diverse themes, leveraging AI algorithms to push artistic boundaries. Discover how AI assistants can generate visually captivating artwork, providing fresh perspectives.",
  "created": 1710720000000,
  "updated": 1710720000000,
  "layout": "blog",
  "id": "XrcpmGgWT1fWxJsn0BXt5",
  "slug": "top-25-ai-art-prompts-ideas-spark-your-creativity",
  "cover": "https://app.affine.pro/api/workspaces/qf73AF6vzWphbTJdN7KiX/blobs/jAKAj15tAeFRm4f4X5VQNraqUE2bDqxdSBrZRtFiC2w=.webp",
  "md": "---\n\ntitle: \"Top 25 AI Art Prompts Ideas to Spark Your Creativity\"\n\nauthor: \"Yiyang Zhang\"\n\ntags: Content\n\nslug: top-25-ai-art-prompts-ideas-spark-your-creativity\n\ndescription: \"Ignite your creativity with our 25 AI art prompts ideas with diverse themes, leveraging AI algorithms to push artistic boundaries. Discover how AI assistants can generate visually captivating artwork, providing fresh perspectives.\"\n\ncreated: 2024-03-18\n\nupdated: 2024-03-18\n\nlayout: blog\n\npublish: true\n\n---\n\n\n![jAKAj15tAeFRm4f4X5VQNraqUE2bDqxdSBrZRtFiC2w=](https://app.affine.pro/api/workspaces/qf73AF6vzWphbTJdN7KiX/blobs/jAKAj15tAeFRm4f4X5VQNraqUE2bDqxdSBrZRtFiC2w=)\n\nWelcome to the captivating domain where the intricacies of art intertwine with the innovations of artificial intelligence, forging an exciting frontier of [creative exploration](https://affine.pro/blog/10-best-free-storyboard-creator-software). Across the globe, artists and designers, regardless of their proficiency level, are harnessing the potential of AI art prompts to transcend traditional boundaries and craft visually stunning compositions.\n\nAs AI-generated art gains momentum on a global scale, now is the opportune moment to immerse oneself in this burgeoning movement. With renowned platforms such as OpenArt, midjourney, stable diffusion and Canva paving the way, individuals can readily engage in artistic exploration, yielding remarkable results in a fraction of the time required by conventional artistic software.\n\nUnlocking the full potential of AI-driven creativity begins with the mastery of crafting the AI prompt. Whether you're a seasoned creative seeking inspiration or an aspiring artist eager to delve into the realm of AI-generated art, this article serves as your beacon, guiding you toward unparalleled artistic innovation!\n\n# **What is AI Art?**\n\nAI art represents a groundbreaking amalgamation of technology and artistic expression, leveraging algorithms to transcend conventional boundaries. Diverging from traditional methodologies, AI delves into data patterns to craft visually captivating masterpieces, serving as [a digital collaborator](https://affine.pro/blog/top-10-best-free-digital-planner-apps-2023) that enriches the creative process with fresh perspectives and concepts.\n\nThrough the power of machine learning, AI not only replicates human artistic styles but also pioneers entirely novel approaches, opening doors to boundless experimentation and ingenuity within the realm of art. Collaborating with AI enables artists to delve into unexplored themes, hues, and compositions, fostering a realm of creative exploration previously untapped.\n\nThe allure of AI art lies in its capacity to astonish and provoke, constantly challenging preconceived notions. Embracing this fusion of human ingenuity and technological prowess liberates artists from conventional constraints, propelling them toward uncharted realms of creative discovery and innovation.\n\n# **How to Write AI Art Prompts that Meet Your Needs**\n\nCrafting AI art prompts requires a thoughtful and [strategic approach](https://affine.pro/blog/10-best-b2b-social-media-marketing-strategies). A haphazard approach might not yield the desired results.\n\n\n![Ws_54ZLzjc64IBV036CY5qw3kvHJSmbxl5NECQRx7uY=](https://app.affine.pro/api/workspaces/qf73AF6vzWphbTJdN7KiX/blobs/Ws_54ZLzjc64IBV036CY5qw3kvHJSmbxl5NECQRx7uY=)\n\n* **Define the style or theme you wish to explore clearly:**\nClearly defining the style or theme you want to explore helps provide a clear direction for your AI-generated artwork. Whether it's abstract, realistic, futuristic, or dreamlike, having a defined starting point is crucial for the [creative process](https://affine.pro/blog/top-10-best-process-mapping-tools-software-2023-free-paid).\n\n* **Consider the emotions or concepts you aim to convey:**\nIdentifying the emotions or concepts you want your AI-generated artwork to evoke guides the development of your prompt. Whether it's joy, melancholy, wonder, or a blend of emotions, having a clear intention behind your art enhances its impact.\n\n* **Experiment with different input parameters and settings on your AI platform:**\nThis point encourages experimentation with various input parameters and settings on your AI platform to observe their effects on the generated output. Exploring different options can lead to discovering new possibilities and refining your artistic vision.\n\n* **Embrace playful exploration and push boundaries for artistic breakthroughs:**\nEncouraging artists to adopt a playful mindset and push the boundaries of traditional art-making processes. Being open to unexpected results can lead to creative breakthroughs and innovative artistic expressions.\n\n* **Recognize AI as a tool to amplify creativity, not restrict it:**\nAcknowledging that AI is a tool meant to enhance artistic creativity rather than limit it. It implies that artists should view AI as a partner in their creative process, leveraging its capabilities to expand their artistic horizons.\n\n* **Stay open-minded and receptive to new possibilities in crafting prompts tailored to your artistic vision:**\nEncouraging artists to remain open-minded and receptive to new ideas and possibilities. It suggests that flexibility and adaptability are essential when crafting prompts to ensure they align with the artist's unique artistic vision and goals.\n\n# **Top 25 Prompt Ideas for AI Art to Spark Your Creativity**\n\nAre you ready to ignite your creativity with AI art? Look no further as we unveil the top 25 prompt ideas that will unleash your artistic potential.\n\n### **Nature:**\n\n\n![dHrZEpZLqI84ZPH4YSNMEfXKMABd5AnfjUrL86CHTdc=](https://app.affine.pro/api/workspaces/qf73AF6vzWphbTJdN7KiX/blobs/dHrZEpZLqI84ZPH4YSNMEfXKMABd5AnfjUrL86CHTdc=)\n\n* Create an AI-generated landscape inspired by an imaginary world where nature reigns supreme, blending elements of fantasy and reality.\n* Generate an abstract representation of the changing seasons, capturing the essence of transition and transformation through colors, shapes, and textures.\n* Use AI to generate a surreal interpretation of a natural phenomenon such as the Northern Lights, infusing the artwork with a sense of wonder and enchantment.\n* Explore the intricate patterns and textures found in a specific plant or flower, reimagining them through the lens of artificial intelligence to create a mesmerizing botanical artwork.\n* Generate an AI-driven interpretation of a picturesque sunrise or sunset, emphasizing the interplay of light and shadow to evoke a sense of tranquility and serenity.\n### **Technology:**\n\n\n![TLR0vdbUiDOOOrAJViJnu5DteeNnm3Tg3NHiwE_XmXw=](https://app.affine.pro/api/workspaces/qf73AF6vzWphbTJdN7KiX/blobs/TLR0vdbUiDOOOrAJViJnu5DteeNnm3Tg3NHiwE_XmXw=)\n\n* Create an AI-generated artwork that explores the convergence of humans and machines, depicting a futuristic world where technology has become an integral part of existence.\n* Generate a visually striking representation of data visualization, transforming complex datasets into captivating patterns and designs that challenge perceptions and spark curiosity.\n* Explore the concept of AI-generated architecture, envisioning futuristic cityscapes and structures that push the boundaries of imagination and innovation.\n* Use AI to reinterpret iconic technological symbols or inventions, infusing them with new meaning and symbolism to provoke thought and reflection.\n* Generate an abstract representation of the digital landscape, exploring themes of connectivity, virtuality, and the ever-expanding reach of technology.\n### **Fantasy:**\n\n\n![RL0grOsQ_7AOrtGR5m7wkBO-6h6UzDZigOGfWd69kiE=](https://app.affine.pro/api/workspaces/qf73AF6vzWphbTJdN7KiX/blobs/RL0grOsQ_7AOrtGR5m7wkBO-6h6UzDZigOGfWd69kiE=)\n\n* Create an AI-generated character inspired by mythical creatures or folklore, blending elements of fantasy and imagination to bring it to life in a unique and captivating way.\n* Generate a fantastical landscape inhabited by creatures of your imagination, exploring themes of adventure, discovery, and the unknown.\n* Use AI to reimagine classic fairy tales or legends, creating visually stunning interpretations that breathe new life into age-old stories.\n* Explore the concept of dreamscapes through AI-generated art, capturing the ethereal beauty and surreal imagery of the subconscious mind.\n* Generate an otherworldly scene inspired by science fiction, depicting futuristic cities, alien worlds, or interstellar journeys that ignite the imagination and inspire wonder.\n### **Abstract:**\n\n\n![-7vXrk0hxyQFSz4Xe0ksej4FxcB0w2fxWoEs9WQUbVM=](https://app.affine.pro/api/workspaces/qf73AF6vzWphbTJdN7KiX/blobs/-7vXrk0hxyQFSz4Xe0ksej4FxcB0w2fxWoEs9WQUbVM=)\n\n* Create an AI-generated abstract artwork that explores the concept of chaos and order, using color, shape, and texture to convey a sense of balance and harmony.\n* Generate a dynamic composition inspired by music, transforming soundwaves into visual patterns and rhythms that dance across the canvas.\n* Use AI to explore the concept of duality, creating a visually striking artwork that juxtaposes contrasting elements such as light and dark, movement and stillness, or chaos and calm.\n* Generate an abstract representation of emotions, using AI to translate feelings such as love, fear, joy, or sorrow into visual expressions that resonate on a deep emotional level.\n* Create an AI-driven exploration of geometry and symmetry, playing with repetition, reflection, and distortion to create mesmerizing patterns and designs.\n### **Surrealism:**\n\n\n![fGBtOlYfiyZqDF14ZxDqx9_RQsBMWqcN6YEjbF1ZrzA=](https://app.affine.pro/api/workspaces/qf73AF6vzWphbTJdN7KiX/blobs/fGBtOlYfiyZqDF14ZxDqx9_RQsBMWqcN6YEjbF1ZrzA=)\n\n* Generate a surreal interpretation of a familiar landscape or scene, warping reality to create a dreamlike tableau that challenges perceptions and invites exploration.\n* Create an AI-generated artwork that blurs the boundaries between the real and the imagined, combining elements of everyday life with fantastical elements to create a sense of wonder and intrigue.\n* Use AI to explore the concept of metamorphosis, depicting fantastical transformations and shape-shifting creatures that defy logic and reason.\n* Generate a surrealistic self-portrait that explores themes of identity, introspection, and the subconscious mind, using AI to reveal hidden layers of meaning and symbolism.\n* Create an otherworldly scene inspired by the subconscious mind, delving into the realm of dreams, memories, and the surreal to create a captivating and thought-provoking artwork.\n# **Kickstart Your Creativity with Edgeless AI in AFFiNE**\n\nWhether you're a seasoned pro or just starting on your artistic journey, incorporating AI assistants into your workflow can open up new avenues for experimentation and innovation. If you're looking to take your AI art creations to the next level, consider exploring the possibilities of edgeless AI in [**AFFiNE**](https://affine.pro/). This cutting-edge technology offers endless potential for pushing the boundaries of what's possible in the world of AI-generated artwork.\n\n<div style=\"text-align:center;\">\n\n<iframe width=\"560\" height=\"315\" src=\"https://www.youtube.com/embed/3cfeKOufZWU?si=IiXDIdwfnM2Z7KPL\" title=\"YouTube video player\" frameborder=\"0\" allow=\"accelerometer; autoplay; clipboard-write; encrypted-media; gyroscope; picture-in-picture; web-share\" allowfullscreen></iframe>\n\n</div>\n\nAFFiNE is a versatile editor that lets you write, draw, plan, and present all in one place. Easily capture detailed information about your new business using the page mode, allowing for straightforward document editing. Efficiently organize your projects by using a database to keep track of deadlines, assign responsibilities, and effortlessly monitor project progress. Take advantage of AFFiNE's powerful whiteboard feature to brainstorm ideas with your team. Our AFFiNE AI is also on the way!\n\n## **AFFiNE AI: Transforming Ideas into Visuals and Words Seamlessly**\n\nExplore AFFiNE AI, your true multimodal AI copilot, dedicated to turning \"all your ideas into reality.\"\n\n* **Write with You:** Leveraging AI technology, AFFiNE AI provides intelligent assistance for every step of your writing process, from crafting sentences to entire articles. Whether you're creating content, professionally rewriting, adjusting tone, or correcting spelling and grammar, AFFiNE AI makes your text more vivid and accurate.\n* **Draw with You:** With the power of AI, AFFiNE AI can transform your outlines or ideas into eye-catching visual works. Whether it's creating presentations or building mind maps, AFFiNE AI helps you clearly express and share your creativity.\n* **Plan with You:** AFFiNE AI's smart planning tools help you manage and organize knowledge with auto-sorting and tagging features. Based on principles of open source and privacy protection, it ensures your information is secure and easily accessible.\n##### **Join our waiting list now to be among the first to experience the leap in creativity and efficiency brought by AFFiNE AI！**\n\n\n![eHMyjy-Aq0AI9SYHlhHyIDFftXVQdEFUwt8PTqLtrVE=](https://app.affine.pro/api/workspaces/qf73AF6vzWphbTJdN7KiX/blobs/eHMyjy-Aq0AI9SYHlhHyIDFftXVQdEFUwt8PTqLtrVE=)\n\nSo why wait? Dive into the exciting world of AI art today and let edgeless AI in AFFiNE inspire you to create mesmerizing masterpieces that captivate audiences around the globe. The only limit is your imagination! Presently, **AFFiNE** has launched its [**Stable Version**](https://affine.pro/download), with ongoing efforts to develop a more comprehensive and dependable iteration. Join us on our voyage through our social media channels and be part of the experience. **Come and join us on our journey over on our media platforms. 🚀**\n\n* Official Website: [https://affine.pro/](https://affine.pro/)\n* GitHub: [https://github.com/toeverything/AFFiNE](https://github.com/toeverything/AFFiNE)\n* Discord: [https://discord.gg/Arn7TqJBvG](https://discord.gg/Arn7TqJBvG)\n* Twitter: [https://twitter.com/AffineOfficial](https://twitter.com/AffineOfficial)\n\n\n",
  "publish": true
}