{
  "title": "10 Best fWhiteboard Layout Ideas in 2024: How to be More Productive?",
  "authors": [
    "Jackie peng"
  ],
  "tags": [
    "Content"
  ],
  "description": "This article explores 10 best whiteboard layout ideas for you to maximize productivity and creativity",
  "created": 1701388800000,
  "updated": 1701907200000,
  "layout": "blog",
  "id": "AHEdzxXh4c46qtjAt4H2C",
  "slug": "white-boardboard-layout-ideas-organization",
  "cover": "https://insider.affine.pro/api/workspaces/qf73AF6vzWphbTJdN7KiX/blobs/keF8GaEq1Tscv1wXlvKHFy8EJl3yas24L1Q31HudyYQ=.webp",
  "md": "---\n\ntitle: \"10 Best fWhiteboard Layout Ideas in 2024: How to be More Productive?\"\n\nauthor: Jackie peng\n\ntags: Content\n\nslug: white-boardboard-layout-ideas-organization\n\ndescription: This article explores 10 best whiteboard layout ideas for you to maximize productivity and creativity\n\ncreated: 2023-12-01\n\nupdated: 2023-12-07\n\nlayout: blog\n\npublish: true\n\n---\n\nðŸ“šImagine being a project manager leading a complex, multi-departmental project involving various stages, key milestones, and stakeholder expectations. In this scenario, effectively conveying complex concepts, coordinating team members, and planning the project's path is crucial. A well-structured whiteboard layout plays a key role here.\n\nUsing a whiteboard, you can create areas to map different project stages, list key tasks and assign responsibilities, and have a dedicated space for creative brainstorming and problem-solving. This layout not only helps you and your team stay organized and focused but also provides a visual platform for tracking progress and facilitating communication among team members. Whether it's outlining a complex project plan or planning a team-building trip, a well-thought-out whiteboard layout simplifies the process and enhances team efficiency.\n\n## So what is the Whiteboard Productivity Layout ideas?\n\n\"Whiteboard Layout ideas\" refers to strategic methods of organizing a whiteboard to enhance productivity and efficiency in various settings, like offices, classrooms, or personal workspaces. These layouts are designed to optimize the use of space on a whiteboard for different purposes, such as project planning, brainstorming, or tracking tasks. Hereâ€™s an expansion on this concept:\n\n* Sectioned Areas: Divide the board into specific sections for distinct purposes, like a 'To-Do' list, a 'Brainstorming' area, and a 'Project Timeline'.\n* Color Coding: Use different colors to distinguish between tasks, priorities, or teams, making information visually distinguishable and easier to process.\n* Visual Aids: Incorporate diagrams, flowcharts, or graphs to represent complex information or data, aiding in clearer understanding.\n* Progress Trackers: Designate areas to track the progress of projects or goals, using tools like Gantt charts or Kanban boards.\n* Idea Generation Space: Reserve a freeform area for creative thinking and spontaneous ideas, encouraging innovation and team collaboration.\nSuch layouts turn a simple whiteboard into a dynamic, multifunctional tool, greatly aiding in organizing thoughts, visualizing projects, and fostering a collaborative environment.\n\n## Why does the Whiteboard lvlayout matter that much?\n\nThe layout of a whiteboard matters significantly because:\n\n* Enhances Organization: A well-structured layout helps in organizing thoughts, tasks, and projects in a coherent manner, making it easier to track and manage.\n* Boosts Productivity: By clearly visualizing tasks and deadlines, a whiteboard layout can streamline workflow, reduce time spent on planning, and increase overall productivity.\n* Facilitates Collaboration: In team settings, a well-planned whiteboard layout promotes effective communication, ensuring that all team members are on the same page and can contribute ideas easily.\n* Adapts to Different Needs: Different layouts can cater to various needs, whether it's for brainstorming, project management, or goal tracking, making it a versatile tool in both professional and personal settings.\n* Encourages Creativity: A designated space for brainstorming or freeform ideas can stimulate creative thinking and innovation.\n## 10 Best Whiteboard layout ideas for better explaination and productivity\n\n### 1) Gantt chart\n\n\n![keF8GaEq1Tscv1wXlvKHFy8EJl3yas24L1Q31HudyYQ=](https://insider.affine.pro/api/workspaces/qf73AF6vzWphbTJdN7KiX/blobs/keF8GaEq1Tscv1wXlvKHFy8EJl3yas24L1Q31HudyYQ=)\n\nIn the realm of project management, a project manager often grapples with complex challenges such as difficulties in cross-departmental communication, looming deadlines, and evolving project requirements. These challenges can lead to project delays, dampened team morale, and even compromised quality of final outcomes. In such scenarios, a well-designed whiteboard layout can be a game-changer.\n\nPicture a whiteboard divided into several key areas: a dynamic Gantt chart clearly depicting each project phase and critical tasks; a dedicated section for real-time updates and highlighting urgent matters; another area specifically for team member queries and feedback, and a flexible brainstorming zone for immediate problem-solving and innovative thinking. This layout not only enables the project manager to track progress more effectively, reducing the risks of oversights and misunderstandings but also provides a centralized platform for team communication and collaboration, greatly enhancing transparency and engagement within the entire project\n\n\n\n",
  "publish": true
}